[
  {
    "case_visual": {
      "title": "차 안에 있던 바이올린이 파손되었을때\n보상 받을 수 있을까?",
      "description": "차 안에 있던 바이올린이 파손되었을때\n보상 받을 수 있을까?"
    },
    "title": "교통사고로 제3자 물건이 파손된 경우",
    "situation": "주말 오후, 바이올린 연주가 홍길동 씨는 공연장을 향해 운전 중이었다. 옆자리에는 중요한 공연을 위해 빌린 친구의 바이올린을 놓아두었다. 시계를 확인한 홍길동 씨는 공연 시간에 다소 늦을 것 같아 서두르기 시작했다. 무심코 과속 운전을 하는 바람에 앞 차량을 충격하는 사고를 냈다. 인명 피해는 없었지만, 사고의 충격으로 차에 둔 친구의 바이올린이 파손되었다. 고가의 악기인지라 자신이 물어주기에는 많이 부담스러웠던 홍길동 씨는 울상이 되고 말았다. 결국 홍길동 씨는 사고로 파손된 친구의 바이올린을 보상해달라고 보험사에 요구했다. 그러나 보험사 담당자 전우치 씨는 자동차보험 표준약관에 따라 보상이 안 된다고 거절했다.",
    "situation_highlight": "홍길동 씨 주장대로 친구의 바이올린은 보험처리 가능할까?",
    "sections": {
      "section_1": {
        "type": "과실비율",
        "title": "본인 과실로 인한 파손 물품은 보상받을 수 없음",
        "main_ratio": "파손된 바이올린에 대한 보상은 받지 못한다",
        "details": [
          "전우치 씨의 주장대로 자동차보험 표준약관에는 피보험자동차 안에 있거나 피보험자동차로 운송 중인 물품에 생긴 손해는 보상하지 않는다고 명시되어 있다. 사고는 홍길동 씨의 과실에 의해 발생한 사고이거니와 바이올린은 차량 부속품이 아니므로 보험처리가 불가능하다."
        ],
        "additional_cases": []
      },
      "section_2": {
        "type": "key point",
        "title": "자동차보험 표준약관으로 알아보는\n재물손해 보상 범위",
        "subtitles": [
          "보상 기준, 소지품은 가능, 휴대품은 불가능",
          "자동차보험 표준약관 제1조(용어의 정의) 제16항",
          "자동차보험이 보상하지 않는 대물배상",
          "자동차보험 표준약관 제8조(보상하지 않는 손해) 제3항"
        ],
        "details": [
          "자동차보험 표준약관에 따르면 휴대품과 소지품을 구분해 보상 기준을 정하고 있습니다. 자신의 몸에 지닌 휴대품은 보상 범위에 해당하지 않지만, 소지품으로 분류되는 물품은 보상받을 수 있습니다.",
          "자동차 사고로 인해 물품 파손이 발생했을 경우, 보상되지 않는 예외 상황도 있습니다.",
          "다음 중 어느 하나에 해당하는 손해는 대물배상에서 보상하지 않습니다."
        ]
      },
      "section_3": {
        "type": "꿀팁",
        "title": "사고 피해자일 때는 보상 가능",
        "steps": [],
        "subtitles": [],
        "details": [
          "상대방 차의 과실로 내 차에 실린 물품이 파손되었다면 상대방 차량이 가입된 자동차보험에서 보상받을 수 있습니다."
        ]
      },
      "section_4": {
        "type": "Q&A",
        "title": "도난된 물품은 보상 불가능",
        "question": "Q. 자동차에 있던 노트북을 도난당했어요. 보상받을 수 있을까요?",
        "answer_title": "",
        "answer_details": [
          "자동차 사고로 인해 휴대품이 아닌 소지품이 훼손된 경우에만 보상되며, 분실이나 도난으로 인해 대상물이 없어진 경우에는 보상되지 않습니다. 따라서 평소 휴대폰, 노트북, 캠코더, 카메라, 핸드백, 골프채 등 고가의 물품은 차에 보관하지 않는 것이 좋습니다. 어쩔 수 없이 보관하더라도 눈에 띄지 않는 곳에 놓아둡니다."
        ]
      }
    },
    "full_content": "교통사고로 제3자 물건이 파손된 경우\n주말 오후, 바이올린 연주가 홍길동 씨는 공연장을 향해 운전 중이었다. 옆자리에는 중요한 공연을 위해 빌린 친구의 바이올린을 놓아두었다. 시계를 확인한 홍길동 씨는 공연 시간에 다소 늦을 것 같아 서두르기 시작했다. 무심코 과속 운전을 하는 바람에 앞 차량을 충격하는 사고를 냈다. 인명 피해는 없었지만, 사고의 충격으로 차에 둔 친구의 바이올린이 파손되었다. 고가의 악기인지라 자신이 물어주기에는 많이 부담스러웠던 홍길동 씨는 울상이 되고 말았다. 결국 홍길동 씨는 사고로 파손된 친구의 바이올린을 보상해달라고 보험사에 요구했다. 그러나 보험사 담당자 전우치 씨는 자동차보험 표준약관에 따라 보상이 안 된다고 거절했다.\n홍길동 씨는 교통사고로 인한 물품 파손이니 보상해달라고 한다.\n홍길동 씨 주장대로 친구의 바이올린은 보험처리 가능할까?\n과실비율\n본인 과실로 인한 파손 물품은 보상받을 수 없음\n파손된 바이올린에 대한 보상은 받지 못한다\n전우치 씨의 주장대로 자동차보험 표준약관에는 피보험자동차 안에 있거나 피보험자동차로 운송 중인 물품에 생긴 손해는 보상하지 않는다고 명시되어 있다. 사고는 홍길동 씨의 과실에 의해 발생한 사고이거니와 바이올린은 차량 부속품이 아니므로 보험처리가 불가능하다.\nkey point\n자동차보험 표준약관으로 알아보는\n재물손해 보상 범위\n보상 기준, 소지품은 가능, 휴대품은 불가능\n자동차보험 표준약관에 따르면 휴대품과 소지품을 구분해 보상 기준을 정하고 있습니다. 자신의 몸에 지닌 휴대품은 보상 범위에 해당하지 않지만, 소지품으로 분류되는 물품은 보상받을 수 있습니다.\n자동차보험 표준약관 제1조(용어의 정의) 제16항\n가. 휴대품\n통상적으로 몸에 지니고 있는 물품으로 현금, 유가증권, 만년필, 소모품, 손목시계, 귀금속, 장신구, 그 밖에 이와 유사한 물품을 말합니다.\n나. 소지품\n휴대품을 제외한 물품으로 정착(*1)되어 있지 않고 휴대할 수 있는 물품을 말합니다.(*2)\n(*1) 정착: 볼트, 너트 등으로 고정되어 있어서 공구 등을 사용하지 않으면 쉽게 분리할 수 없는 상태\n(*2) 예: 휴대전화기, 노트북, 캠코더, 카메라, 음성재생기(CD 플레이어, MP3 플레이어, 카세트테이프 플레이어 등), 녹음기, 전자수첩, 전자사전, 휴대용라디오, 핸드백, 서류가방, 골프채 등\n자동차보험이 보상하지 않는 대물배상\n자동차 사고로 인해 물품 파손이 발생했을 경우, 보상되지 않는 예외 상황도 있습니다.\n자동차보험 표준약관 제8조(보상하지 않는 손해) 제3항\n다음 중 어느 하나에 해당하는 손해는 대물배상에서 보상하지 않습니다.\n1. 피보험자 또는 그 부모, 배우자나 자녀가 소유 · 사용 · 관리하는 재물에 생긴 손해\n2. 피보험자가 사용자의 업무에 종사하고 있을 때 피보험자의 사용자가 소유 · 사용 · 관리하는 재물에 생긴 손해\n3. 피보험자동차에 싣고 있거나 운송 중인 물품에 생긴 손해. 그러나 탑승자의 신체를 보호할 인명보호장구에 한하여 피해자 1인당 200만원의 한도에서 실제 손해를 보상합니다.\n4. 다른 사람의 서화, 골동품, 조각물, 그 밖에 미술품과 탑승자와 통행인의 의류나 휴대품에 생긴 손해\n5. 탑승자와 통행인의 분실 또는 도난으로 인한 소지품에 생긴 손해. 그러나 훼손된 소지품에 한하여 피해자 1인당 200만원의 한도에서 실제 손해를 보상합니다.\n꿀팁\n사고 피해자일 때는 보상 가능\n상대방 차의 과실로 내 차에 실린 물품이 파손되었다면 상대방 차량이 가입된 자동차보험에서 보상받을 수 있습니다.\nQ&A\n도난된 물품은 보상 불가능\nQ. 자동차에 있던 노트북을 도난당했어요. 보상받을 수 있을까요?\nA. 안 됩니다.\n자동차 사고로 인해 휴대품이 아닌 소지품이 훼손된 경우에만 보상되며, 분실이나 도난으로 인해 대상물이 없어진 경우에는 보상되지 않습니다. 따라서 평소 휴대폰, 노트북, 캠코더, 카메라, 핸드백, 골프채 등 고가의 물품은 차에 보관하지 않는 것이 좋습니다. 어쩔 수 없이 보관하더라도 눈에 띄지 않는 곳에 놓아둡니다.",
    "category": "차 vs. 기타",
    "case_id": "차 vs. 기타_0"
  },
  {
    "case_visual": {
      "title": "사고 차량을 무리하게 운행하다\n파손이 심해졌다면?",
      "description": "사고 차량을 무리하게 운행하다\n파손이 심해졌다면?"
    },
    "title": "사고 직후 차량 운행으로 엔진이 파손된 경우",
    "situation": "홍길동 씨는 지방 출장을 가던 길에 앞 차량과 추돌사고를 일으켰다. 다행히 인명 피해는 없었지만, 차량은 심하게 파손된 상태라서 정비가 필요했다. 다급해진 홍길동 씨는 평소 이용하던 정비공장이 1km 안에 있다는 걸 깨닫고 차량을 운행하기 시작했다. 500m쯤 갔을 때 엔진오일 경고등을 확인했지만 무리가 없을 것으로 판단하고 계속 운행해 정비공장에 도착했다. 그런데 다음날 정비공장에서 엔진이 과열되어 파손되었다고 연락이 왔다.\n홍길동 씨는 추돌사고 때문에 파손된 것으로 보고 보험사에 전화해 처리해달라고 주장했다. 하지만 보험사 담당자 전우치 씨는 무리한 운행이 부른 엔진 파손이라며 불가능하다고 전했다. 이에 홍길동 씨는 이동 거리가 1km 정도밖에 되지 않았으므로 무리한 운행 탓으로 보기 어렵다며 의견을 굽히지 않았다.\n교통사고 후에는 적절한 조치로 피해를 줄이는 것이 최선이다. 파손된 차량을 그대로 운행하면 파손 정도가 더욱 심해질 수 있다. 운전자의 섣부른 판단과 무리한 운행이 부른 피해는 보상받기 어려운 것이 현실. 고장이나 사고로 인해 차량이 멈춰 섰다면 직접 운전하는 것보다 보험사의 긴급출동서비스를 이용하는 것이 바람직하다.",
    "situation_highlight": "홍길동 씨 차량은 보험처리 가능할까?",
    "sections": {
      "section_1": {
        "type": "과실비율",
        "title": "함부로 사고 차량을 이동하면 보험처리 불가능",
        "main_ratio": "무리한 운행으로 발생한 손해액은 보험처리 불가능",
        "details": [
          "자동차보상은 자동차 사고로 실제 파손된 부분에 대해서만 보상하며, 운전자의 무리한 운행으로 가중된 차량 파손 부분에 대해서는 보험처리가 불가능하다. 즉, 추돌사고 이후 육안으로 운행에 장애가 있을 것으로 판단할 수 있었음에도 무리하게 운행한 결과, 엔진이 과열되면서 파손되었기 때문에 추돌사고로 인한 것이라고 보기 어렵다."
        ],
        "additional_cases": []
      },
      "section_2": {
        "type": "꿀팁",
        "title": "파손된 차량은 견인 조치가 정답.\n교통사고 차량 파손 시 대처법",
        "steps": [
          "Step 1\n차량 파손 상태 확인하기\n교통사고 후, 견인하기 전에 사고 상황과 차량 상태를 기록해야 합니다. 견인 전에 증거 확보를 위한 노면 위치 표시와 사진 촬영을 모두 해야 합니다. 별다른 표시를 하지 않거나 증거가 충분하지 못하다면 이후 교통사고 합의와 보상 범위를 두고 의견 차이로 논쟁을 벌일 수 있으니 확실히 해두는 것이 좋습니다.",
          "Step 2\n보험사에 알리고 긴급출동 서비스 받기\n보험사에 사고접수를 하고 긴급출동 서비스를 받습니다. 간혹 경찰에 신고한 경우 일반 긴급출동 차량이 먼저 오기도 하는데, 보험사에서 온 긴급출동 차량이라도 가자는 정비업체로 무조건 가기보다 본인이 아는 카센터 혹은 자동차회사의 직영 정비공장으로 보냅니다. 믿고 맡길 수 있는 긴급출동 서비스를 받아야 나중에 문제가 생기지 않습니다.",
          "Step 3\n수리 후 꼼꼼한 점검 자세도 중요\n사고로 부상을 입어서 병원에 간 사이 긴급출동 차량이 차량을 끌고 간 곳에서 수리를 받게 되었다면 중간중간 견적을 확인하고 차 상태를 확인하는 것이 좋습니다. 수리 후 인도받을 때는 수리견적서를 받고 모든 부분을 꼼꼼히 살핀 후, 주행테스트까지 마칩니다. 만약 작은 이상이라도 있다면 정비업체와 무턱대고 싸울 것이 아니라 이상 있는 부분의 사진을 찍어 놓은 후 보험사에 대해 알리고 보험금 지불정지를 신청합니다. 그 후, 재수리를 신청합니다."
        ],
        "subtitles": [],
        "details": []
      }
    },
    "full_content": "사고 직후 차량 운행으로 엔진이 파손된 경우\n홍길동 씨는 지방 출장을 가던 길에 앞 차량과 추돌사고를 일으켰다. 다행히 인명 피해는 없었지만, 차량은 심하게 파손된 상태라서 정비가 필요했다. 다급해진 홍길동 씨는 평소 이용하던 정비공장이 1km 안에 있다는 걸 깨닫고 차량을 운행하기 시작했다. 500m쯤 갔을 때 엔진오일 경고등을 확인했지만 무리가 없을 것으로 판단하고 계속 운행해 정비공장에 도착했다. 그런데 다음날 정비공장에서 엔진이 과열되어 파손되었다고 연락이 왔다.\n홍길동 씨는 추돌사고 때문에 파손된 것으로 보고 보험사에 전화해 처리해달라고 주장했다. 하지만 보험사 담당자 전우치 씨는 무리한 운행이 부른 엔진 파손이라며 불가능하다고 전했다. 이에 홍길동 씨는 이동 거리가 1km 정도밖에 되지 않았으므로 무리한 운행 탓으로 보기 어렵다며 의견을 굽히지 않았다.\n교통사고 후에는 적절한 조치로 피해를 줄이는 것이 최선이다. 파손된 차량을 그대로 운행하면 파손 정도가 더욱 심해질 수 있다. 운전자의 섣부른 판단과 무리한 운행이 부른 피해는 보상받기 어려운 것이 현실. 고장이나 사고로 인해 차량이 멈춰 섰다면 직접 운전하는 것보다 보험사의 긴급출동서비스를 이용하는 것이 바람직하다.\n홍길동 씨는 차량이 심하게 파손된 상태라 급하게 정비가 필요했다고 주장했다.\n홍길동 씨 차량은 보험처리 가능할까?\n과실비율\n함부로 사고 차량을 이동하면 보험처리 불가능\n무리한 운행으로 발생한 손해액은 보험처리 불가능\n자동차보상은 자동차 사고로 실제 파손된 부분에 대해서만 보상하며, 운전자의 무리한 운행으로 가중된 차량 파손 부분에 대해서는 보험처리가 불가능하다. 즉, 추돌사고 이후 육안으로 운행에 장애가 있을 것으로 판단할 수 있었음에도 무리하게 운행한 결과, 엔진이 과열되면서 파손되었기 때문에 추돌사고로 인한 것이라고 보기 어렵다.\n이럴 땐 이런 과실 판정\n추돌사고가 났을 때, 경황이 없는 운전자가 시동을 끄지 않아 엔진이 과열되었다면 보험처리 가능하다.\n꿀팁\n파손된 차량은 견인 조치가 정답.\n교통사고 차량 파손 시 대처법\nStep 1\n차량 파손 상태 확인하기\n교통사고 후, 견인하기 전에 사고 상황과 차량 상태를 기록해야 합니다. 견인 전에 증거 확보를 위한 노면 위치 표시와 사진 촬영을 모두 해야 합니다. 별다른 표시를 하지 않거나 증거가 충분하지 못하다면 이후 교통사고 합의와 보상 범위를 두고 의견 차이로 논쟁을 벌일 수 있으니 확실히 해두는 것이 좋습니다.\nStep 2\n보험사에 알리고 긴급출동 서비스 받기\n보험사에 사고접수를 하고 긴급출동 서비스를 받습니다. 간혹 경찰에 신고한 경우 일반 긴급출동 차량이 먼저 오기도 하는데, 보험사에서 온 긴급출동 차량이라도 가자는 정비업체로 무조건 가기보다 본인이 아는 카센터 혹은 자동차회사의 직영 정비공장으로 보냅니다. 믿고 맡길 수 있는 긴급출동 서비스를 받아야 나중에 문제가 생기지 않습니다.\nStep 3\n수리 후 꼼꼼한 점검 자세도 중요\n사고로 부상을 입어서 병원에 간 사이 긴급출동 차량이 차량을 끌고 간 곳에서 수리를 받게 되었다면 중간중간 견적을 확인하고 차 상태를 확인하는 것이 좋습니다. 수리 후 인도받을 때는 수리견적서를 받고 모든 부분을 꼼꼼히 살핀 후, 주행테스트까지 마칩니다. 만약 작은 이상이라도 있다면 정비업체와 무턱대고 싸울 것이 아니라 이상 있는 부분의 사진을 찍어 놓은 후 보험사에 대해 알리고 보험금 지불정지를 신청합니다. 그 후, 재수리를 신청합니다.\n차량 파손 상태, 기록은 이렇게!\n도로의 전경 혹은 노면 흔적까지 함께 확인할 수 있도록 멀리서도 3장 이상은 찍습니다.\n차량이 파손되었다면 견인하기 전에 파손 부위의 전후좌우를 다각도에서 여러 장 촬영합니다.\n파손 부위를 선명하게 알아볼 수 있도록 근접 촬영합니다.",
    "category": "차 vs. 기타",
    "case_id": "차 vs. 기타_1"
  },
  {
    "case_visual": {
      "title": "발레파킹 시 주차요원의\n운전 미숙으로 사고가 나면?",
      "description": "발레파킹 시 주차요원의\n운전 미숙으로 사고가 나면?"
    },
    "title": "무심코 맡긴 발레파킹, 사고 책임은 누구?",
    "situation": "모처럼 외식으로 기분이 좋은 전우치 씨는 가족들을 차량에 태우고 유명 음식점으로 향했다. 음식점에 다다르자 발레파킹 표지판 앞으로 주차요원 홍길동 씨가 나와 전우치 씨를 맞이했다. 차량 열쇠를 건네받은 홍길동 씨는 주차하기 위해 운전을 시작했다. 쿵! 홍길동 씨의 미숙한 운전으로 차량 앞부분이 주차장 벽에 부딪히는 사고가 발생했다. 이 사고로 차량 범퍼가 파손된 상황. 화가 난 전우치 씨가 홍길동 씨에게 책임을 묻자 홍길동 씨는 당황하기 시작했다.",
    "situation_highlight": "",
    "sections": {
      "section_1": {
        "type": "과실비율",
        "title": "주차요원 소속 업체에 배상책임",
        "main_ratio": "전우치 씨는 발레파킹 업체에 손해배상 청구 가능",
        "details": [
          "업체에서 차주의 손해를 모두 배상해준 뒤 주차요원에게 구상권을 청구할 수 있다. 구상권이란, 타인이 부담해야 할 것을 자신이 변제했을 때, 그 타인에게 상환을 청구할 수 있는 권리다.\n하지만 손해배상받을 수 있는 요건이 충족되어야 한다. 「자동차손해배상 보장법」에 따르면 사건에 따라 미묘한 차이는 있으나 대부분의 발레파킹 시 책임은 차 소유주가 아닌 발레파킹 업체의 부담이 된다. 법적 근거는 「자동차손해배상 보장법」 제3조로 자신이 자동차 운행(차량 관리도 포함되므로 발레파킹도 해당)에 주의를 게을리하지 않았고 제3자에게 고의 또는 과실이 있으며 자동차 구조상 결함이나 기능상 장해가 없을 경우 손해를 배상할 책임을 면한다는 규정이다."
        ],
        "additional_cases": []
      },
      "section_2": {
        "type": "key point",
        "title": "타인이 운전하다 사고를 내면?\n대리운전 서비스별 사고 손해배상 책임",
        "subtitles": [],
        "details": []
      },
      "section_3": {
        "type": "꿀팁",
        "title": "소중한 내 차, 남의 손에 넘기기 전에\n이것저것 따져보기",
        "steps": [],
        "subtitles": [
          "발레파킹 맡길 때, 확인하세요!",
          "대리운전 부를 때, 확인하세요!",
          "정기적인 차량 점검 습관도 중요"
        ],
        "details": [
          "발레파킹을 맡기기 전에 해당 직원이 영업소 직원이 맞는지 확인하고, 주차확인증을 받아 발레파킹을 맡겼다는 사실을 입증할 물증을 확보해야 합니다. 또 도난 사건이 발생하지 않도록 차 안에 고가의 제품이나 현금 등을 방치하지 말고, 액세서리나 휴대용 기기 등도 눈에 보이지 않는 곳에 두는 것이 바람직합니다.",
          "대리운전 서비스를 받을 때는 우선 운전기사의 운전면허와 신분을 확인하고, 운전기사의 보험에 가입 여부와 보상 범위를 알아야 합니다. 사업자로 등록되어 신용 있는 업체를 이용하는 것도 위험을 덜 수 있는 좋은 방법입니다. 또 대리운전기사들은 주어진 시간 내에 최대한 많은 일을 해야 해서 거칠게 운전하는 습관이 있을 수 있으니 안전하게 운전해달라고 당부하는 것도 잊지 마세요.",
          "소중한 내 차, 아무에게나 덥석 맡길 수 없는 법. 사고는 언제 어디서나 누구에게든 일어날 수 있다는 사실을 기억하세요. 타인에게 차를 맡기기 전에는 차 상태를 미리 확인하고 점검하는 자세가 중요합니다."
        ]
      },
      "section_4": {
        "type": "Q&A",
        "title": "발레파킹을 맡긴 후 차량에 있던 소지품을 도난당했다면?",
        "question": "Q. 발레파킹 서비스 이용 중 차량 내 소지품이 분실되는 사고를 당했어요. 보상받을 수 있을까요?",
        "answer_title": "",
        "answer_details": [
          "고가의 제품이나 거액의 현금뿐 아니라 차량에 무심코 두었던 전자기기, 소액의 동전과 지폐는 도난당해도 명백한 증거가 없으면 처벌이나 보상이 불가능합니다. 경우에 따라서는 민법에 따라 손해배상 책임을 물을 수도 있지만, 금액이 경미하면 이러한 대응이 무의미할 때가 많습니다. 그렇기 때문에 소지품 분실 및 차량 도난에 주의하는 자세를 습관화하는 것이 중요합니다."
        ]
      }
    },
    "full_content": "무심코 맡긴 발레파킹, 사고 책임은 누구?\n모처럼 외식으로 기분이 좋은 전우치 씨는 가족들을 차량에 태우고 유명 음식점으로 향했다. 음식점에 다다르자 발레파킹 표지판 앞으로 주차요원 홍길동 씨가 나와 전우치 씨를 맞이했다. 차량 열쇠를 건네받은 홍길동 씨는 주차하기 위해 운전을 시작했다. 쿵! 홍길동 씨의 미숙한 운전으로 차량 앞부분이 주차장 벽에 부딪히는 사고가 발생했다. 이 사고로 차량 범퍼가 파손된 상황. 화가 난 전우치 씨가 홍길동 씨에게 책임을 묻자 홍길동 씨는 당황하기 시작했다.\n과실비율\n주차요원 소속 업체에 배상책임\n전우치 씨는 발레파킹 업체에 손해배상 청구 가능\n업체에서 차주의 손해를 모두 배상해준 뒤 주차요원에게 구상권을 청구할 수 있다. 구상권이란, 타인이 부담해야 할 것을 자신이 변제했을 때, 그 타인에게 상환을 청구할 수 있는 권리다.\n하지만 손해배상받을 수 있는 요건이 충족되어야 한다. 「자동차손해배상 보장법」에 따르면 사건에 따라 미묘한 차이는 있으나 대부분의 발레파킹 시 책임은 차 소유주가 아닌 발레파킹 업체의 부담이 된다. 법적 근거는 「자동차손해배상 보장법」 제3조로 자신이 자동차 운행(차량 관리도 포함되므로 발레파킹도 해당)에 주의를 게을리하지 않았고 제3자에게 고의 또는 과실이 있으며 자동차 구조상 결함이나 기능상 장해가 없을 경우 손해를 배상할 책임을 면한다는 규정이다.\nkey point\n타인이 운전하다 사고를 내면?\n대리운전 서비스별 사고 손해배상 책임\n1. 발레파킹 > 업체에 손해배상 청구 가능\n발레파킹 서비스를 신청한 고객은 주차요원에게 자동차 키를 건네는 동시에 그 차에 대한 책임을 업체에 전가하는 것이고, 차 키를 건넨 후 사고에 대해서는 차주와 아무런 관련 없이 영업소가 배상책임을 집니다. 그러므로 주차요원이 낸 사고는 차주에게 책임을 물을 수 없습니다. 하지만 모든 책임을 영업소에서 배상해야 하는 것은 아닙니다. 영업소에서 차주의 손해를 모두 배상한 뒤 주차요원에게 구상권을 청구할 수 있습니다.\n2. 대리운전 > 업체에 손해배상 청구 가능\n대리운전이 보편화되면서 대리운전 업체들의 가격경쟁 때문에 금전적 부담이 줄어드는 반면 대리운전에 의한 교통사고는 점점 늘어나고 있는 실정입니다. 운전기사의 과실로 사고가 발생해 차량이 파손된 경우, 대리운전 업체에 책임을 물을 수 있습니다. 하지만 대리운전 업체가 보험에 가입하지 않아 운전자가 모두 책임져야 하는 상황이 발생할 수도 있으니 사전에 보험 가입 여부 확인이 필수입니다.\n3. 버스/택시 > 버스/택시기사의 과실로 운송업체가 보상책임\n버스나 택시에 타고 있을 때, 무리한 운전으로 다른 차량을 파손하는 경우가 발생합니다. 이 경우 피해 차량에 대한 손해배상 책임은 모두 기사에게 있고, 승객에게는 교통사고 발생에 따른 형사법적 책임이 없습니다. 다만 본인의 무리한 요구가 사고의 직접적 원인으로 작용했다면 일부 책임이 있을 수 있습니다.\n꿀팁\n소중한 내 차, 남의 손에 넘기기 전에\n이것저것 따져보기\n발레파킹 맡길 때, 확인하세요!\n발레파킹을 맡기기 전에 해당 직원이 영업소 직원이 맞는지 확인하고, 주차확인증을 받아 발레파킹을 맡겼다는 사실을 입증할 물증을 확보해야 합니다. 또 도난 사건이 발생하지 않도록 차 안에 고가의 제품이나 현금 등을 방치하지 말고, 액세서리나 휴대용 기기 등도 눈에 보이지 않는 곳에 두는 것이 바람직합니다.\n대리운전 부를 때, 확인하세요!\n대리운전 서비스를 받을 때는 우선 운전기사의 운전면허와 신분을 확인하고, 운전기사의 보험에 가입 여부와 보상 범위를 알아야 합니다. 사업자로 등록되어 신용 있는 업체를 이용하는 것도 위험을 덜 수 있는 좋은 방법입니다. 또 대리운전기사들은 주어진 시간 내에 최대한 많은 일을 해야 해서 거칠게 운전하는 습관이 있을 수 있으니 안전하게 운전해달라고 당부하는 것도 잊지 마세요.\n정기적인 차량 점검 습관도 중요\n소중한 내 차, 아무에게나 덥석 맡길 수 없는 법. 사고는 언제 어디서나 누구에게든 일어날 수 있다는 사실을 기억하세요. 타인에게 차를 맡기기 전에는 차 상태를 미리 확인하고 점검하는 자세가 중요합니다.\nQ&A\n발레파킹을 맡긴 후 차량에 있던 소지품을 도난당했다면?\nQ. 발레파킹 서비스 이용 중 차량 내 소지품이 분실되는 사고를 당했어요. 보상받을 수 있을까요?\nA. 명백한 증거 없이는 처벌이나 보상이 불가능합니다.\n고가의 제품이나 거액의 현금뿐 아니라 차량에 무심코 두었던 전자기기, 소액의 동전과 지폐는 도난당해도 명백한 증거가 없으면 처벌이나 보상이 불가능합니다. 경우에 따라서는 민법에 따라 손해배상 책임을 물을 수도 있지만, 금액이 경미하면 이러한 대응이 무의미할 때가 많습니다. 그렇기 때문에 소지품 분실 및 차량 도난에 주의하는 자세를 습관화하는 것이 중요합니다.",
    "category": "차 vs. 기타",
    "case_id": "차 vs. 기타_2"
  },
  {
    "case_visual": {
      "title": "음식점 주차장에 주차한 차\n도난당하면?",
      "description": "음식점 주차장에 주차한 차\n도난당하면?"
    },
    "title": "예상치 못한 차량 도난 사고",
    "situation": "회사 동료들과 오랜만에 드라이브 겸 멀리 점심을 먹으러 나온 홍길동 씨, 맛있게 밥을 먹고 나오니 주차장에 주차해둔 차가 없어졌다. 불법주차를 한 것도 아니고, 자동차 열쇠를 가지고 있는 다른 누군가가 근처에 있었던 것도 아니다.\n어찌해야 할지 몰라서 우왕좌왕하는 홍길동 씨, 어떻게 조치해야 할까?",
    "situation_highlight": "음식점 주차장에서 사라져버린 내 차, 보상받을 수 있을까?",
    "sections": {
      "section_1": {
        "type": "key point",
        "title": "경찰, 보험사에 신고",
        "subtitles": [
          "경찰 신고는 이렇게!",
          "보험사 신고도 필수!"
        ],
        "details": [
          "우선 차량이 도난당한 것을 확신하는 순간 바로 경찰서에 신고한다. 112에 전화해 도난 사실을 알리고 자동차가 도난당한 장소의 관할 경찰서로 차주가 직접 찾아가 신고하면 된다. 이때 신분증과 차량 소유를 입증할 수 있는 차량등록증 또는 보험계약서 등을 함께 제출해야 한다.\n음식점에 주차했던 홍길동 씨의 차량은 해당하지 않는 사항이겠으나 혹시라도 불법주차로 인해 자동차가 견인된 것은 아닌지, 가족이나 지인 누군가가 차를 임의로 운행한 것은 아닌지 등을 확인해 두는 것이 좋다.",
          "자기차량손해보험에 들어있는 자동차의 경우 반드시 보험사에 신고해야 한다. 도난에 대한 보상뿐 아니라 혹시 모를 2차 사고도 대비해 둘 필요가 있기 때문이다. 차량을 훔친 범인이 운전하다가 사고를 내서 대물, 혹은 대인 피해를 낼 경우도 있으니 경찰 신고 직후 보험사에도 신고해두어야 한다.\n자기차량손해보험에 의한 도난 보상은 보험사 사고접수일 및 경찰서 신고일로부터 30일이 지나도 차를 찾지 못할 경우 보험금이 지급된다. 그사이 차량을 찾으면 보험금은 지급되지 않는다. 단, 차에 있던 귀중품이나 카오디오 등 차 외의 부속물에 대한 보상은 이루어지지 않는다. 찾아낸 자동차가 파손되어 있다면 이에 대한 보상은 받을 수 있다."
        ]
      },
      "section_2": {
        "type": "key point",
        "title": "보상받은 후 자동차를 되찾게 되면?",
        "subtitles": [],
        "details": [
          "도난 후 30일이 지나서 보상금을 이미 받은 다음 자동차를 찾게 되는 경우도 있다. 이럴 때는 보상금과 자동차 중에서 선택하게 되는데, 자동차를 원한다면 차를 돌려받은 후 보상금을 반납하면 된다. 이 경우 차량이 파손되어 있다면 파손 등에 보상과 재등록 비용 등은 보상받을 수 있다.\n또한, 차량 도난의 경우 자동차 주인의 과실이 명백할 경우를 제외하고는 보험료 할증이 없다. 자동차 주인의 명백한 과실은 차 문을 열어 둔 경우, 열쇠를 차 안에 둔 채 자리를 비운 경우, 주차 지역이 아닌 곳에 차를 세운 경우 등이 해당한다."
        ]
      },
      "section_3": {
        "type": "꿀팁",
        "title": "차량 도난 방지를 위한 주의 사항",
        "steps": [
          "Tip 1\n밖에서 차 안이 들여다보이는 장소에는 귀중품 두지 않기",
          "Tip 2\n사람이나 차량이 적은 한적한 곳에 주차하지 않기",
          "Tip 3\n기본 사항이지만, 주차 시 차 문 잠그는 것을 잊지 않기",
          "Tip 4\n잠시 정차하더라도 차 열쇠를 꽂아둔 채 자리 비우지 않기"
        ],
        "subtitles": [],
        "details": []
      }
    },
    "full_content": "예상치 못한 차량 도난 사고\n회사 동료들과 오랜만에 드라이브 겸 멀리 점심을 먹으러 나온 홍길동 씨, 맛있게 밥을 먹고 나오니 주차장에 주차해둔 차가 없어졌다. 불법주차를 한 것도 아니고, 자동차 열쇠를 가지고 있는 다른 누군가가 근처에 있었던 것도 아니다.\n어찌해야 할지 몰라서 우왕좌왕하는 홍길동 씨, 어떻게 조치해야 할까?\n음식점 주차장에서 사라져버린 내 차, 보상받을 수 있을까?\nkey point\n경찰, 보험사에 신고\n경찰 신고는 이렇게!\n우선 차량이 도난당한 것을 확신하는 순간 바로 경찰서에 신고한다. 112에 전화해 도난 사실을 알리고 자동차가 도난당한 장소의 관할 경찰서로 차주가 직접 찾아가 신고하면 된다. 이때 신분증과 차량 소유를 입증할 수 있는 차량등록증 또는 보험계약서 등을 함께 제출해야 한다.\n음식점에 주차했던 홍길동 씨의 차량은 해당하지 않는 사항이겠으나 혹시라도 불법주차로 인해 자동차가 견인된 것은 아닌지, 가족이나 지인 누군가가 차를 임의로 운행한 것은 아닌지 등을 확인해 두는 것이 좋다.\n보험사 신고도 필수!\n자기차량손해보험에 들어있는 자동차의 경우 반드시 보험사에 신고해야 한다. 도난에 대한 보상뿐 아니라 혹시 모를 2차 사고도 대비해 둘 필요가 있기 때문이다. 차량을 훔친 범인이 운전하다가 사고를 내서 대물, 혹은 대인 피해를 낼 경우도 있으니 경찰 신고 직후 보험사에도 신고해두어야 한다.\n자기차량손해보험에 의한 도난 보상은 보험사 사고접수일 및 경찰서 신고일로부터 30일이 지나도 차를 찾지 못할 경우 보험금이 지급된다. 그사이 차량을 찾으면 보험금은 지급되지 않는다. 단, 차에 있던 귀중품이나 카오디오 등 차 외의 부속물에 대한 보상은 이루어지지 않는다. 찾아낸 자동차가 파손되어 있다면 이에 대한 보상은 받을 수 있다.\nkey point\n보상받은 후 자동차를 되찾게 되면?\n도난 후 30일이 지나서 보상금을 이미 받은 다음 자동차를 찾게 되는 경우도 있다. 이럴 때는 보상금과 자동차 중에서 선택하게 되는데, 자동차를 원한다면 차를 돌려받은 후 보상금을 반납하면 된다. 이 경우 차량이 파손되어 있다면 파손 등에 보상과 재등록 비용 등은 보상받을 수 있다.\n또한, 차량 도난의 경우 자동차 주인의 과실이 명백할 경우를 제외하고는 보험료 할증이 없다. 자동차 주인의 명백한 과실은 차 문을 열어 둔 경우, 열쇠를 차 안에 둔 채 자리를 비운 경우, 주차 지역이 아닌 곳에 차를 세운 경우 등이 해당한다.\n꿀팁\n차량 도난 방지를 위한 주의 사항\nTip 1\n밖에서 차 안이 들여다보이는 장소에는 귀중품 두지 않기\nTip 2\n사람이나 차량이 적은 한적한 곳에 주차하지 않기\nTip 3\n기본 사항이지만, 주차 시 차 문 잠그는 것을 잊지 않기\nTip 4\n잠시 정차하더라도 차 열쇠를 꽂아둔 채 자리 비우지 않기",
    "category": "차 vs. 기타",
    "case_id": "차 vs. 기타_3"
  },
  {
    "case_visual": {
      "title": "도로 공사현장 기자재로 차가 미끄러진 경우,\n누구의 과실일까?",
      "description": "도로 공사현장 기자재로 차가 미끄러진 경우,\n누구의 과실일까?"
    },
    "title": "도로 위 널브러진 파이프에 미끄러져 가드레일을 들이받은 사고",
    "situation": "고속도로를 주행 중이던 전우치 씨는 ‘공사 중’이라는 표지판을 발견하고 공사현장에 진입했다. 그런데 알 수 없는 물체에 바퀴가 덜컹, 걸리는 느낌을 받았다. 도로 위에 아무렇게나 널브러진 파이프에 앞바퀴가 걸린 것. 차량은 그대로 미끄러져 중앙 가드레일을 들이받고 범퍼가 파손됐다.\n그때, 공사현장 직원인 홍길동 씨가 사고 난 것을 보고 달려왔다. 사고 발생에 대한 자초지종을 설명한 전 씨. 그런데 기대했던 것과 달리 홍 씨는 전 씨가 전방주시를 소홀히 했다며 대수롭지 않게 반응했다.",
    "situation_highlight": "도로 위 기자재로 인한 사고, 누가 책임져야 할까?",
    "sections": {
      "section_1": {
        "type": "과실비율",
        "title": "안전조치를 소홀히 한 홍 씨의 회사에\n과실비율 더 크게 적용",
        "main_ratio": "홍 씨의 공사회사에 70% 과실",
        "details": [
          "도로확장공사를 도급받아 이를 시행하고 있던 홍 씨의 회사는 공사가 완료될 때까지 사고 방지를 위해 현장을 안전한 상태로 유지하고 관리할 책임이 있다. 하지만 기자재가 도로에 흩어져 있었음에도 적절한 조치를 취하지 않는 등 안전관리를 소홀히 했으므로 70% 과실이 인정된다.\n공사 중이라는 걸 알고 있었으면서 진입 및 운전 과정에서 전방주시의무를 소홀히 한 전 씨 또한 사고 발생과 손해 확대의 원인이 되므로 30% 과실이 인정된다."
        ],
        "additional_cases": []
      },
      "section_2": {
        "type": "key point",
        "title": "‘도로 위의 지뢰’ 아찔한 공사현장 장애물 사고",
        "subtitles": [],
        "details": []
      },
      "section_3": {
        "type": "꿀팁",
        "title": "전방은 밝게, 주시는 확실하게!\n안전한 야간운전 방법",
        "steps": [
          "Tip 1\n도로 상태나 차로 등을 확인하면서 주행하기\n밤에 앞차의 미등만 보고 주행하면 길가에 정차한 차량까지 운행 중인 것으로 착각하기 쉬우니 잘 살피면서 주행합니다.",
          "Tip 2\n중앙선에서 조금 떨어져 주행하기\n밤에 운전할 때는 중앙선을 침범해 오는 차량, 도로를 횡단하려고 중앙선 부근에 서 있는 보행자와 충돌하기 쉬우니 중앙선에서 바짝 붙지 말고 조금 떨어져서 주행합니다.",
          "Tip 3\n피로는 안전운행의 적\n신경이 피로해져서 졸릴 때는 곧 운전을 중지하고 휴식을 취하거나 교대운전을 합니다.",
          "Tip 4\n뒤차 불빛에 현혹되지 않도록 룸미러 조정하기\n뒤차의 전조등 불빛이 룸미러에 반사되어 눈이 부실 때는 브레이크를 밟지 말고 룸미러 각도를 조정해 눈이 부시지 않도록 합니다.",
          "Tip 5\n타인에게 자신의 차량 알리기\n해가 저물기 전에 전조등, 미등, 차폭등을 켜고 위험이 예견되거나 상대방이 나를 발견하지 못했다고 판단되면 나의 존재를 알려 위험을 예방합니다.",
          "Tip 6\n신호 충분히 하기\n밤에는 등화에 의해서만 모든 정보가 수집되므로 신호는 항상 여유 있고 정확하게, 그리고 일찍 해야 합니다."
        ],
        "subtitles": [],
        "details": []
      }
    },
    "full_content": "도로 위 널브러진 파이프에 미끄러져 가드레일을 들이받은 사고\n고속도로를 주행 중이던 전우치 씨는 ‘공사 중’이라는 표지판을 발견하고 공사현장에 진입했다. 그런데 알 수 없는 물체에 바퀴가 덜컹, 걸리는 느낌을 받았다. 도로 위에 아무렇게나 널브러진 파이프에 앞바퀴가 걸린 것. 차량은 그대로 미끄러져 중앙 가드레일을 들이받고 범퍼가 파손됐다.\n그때, 공사현장 직원인 홍길동 씨가 사고 난 것을 보고 달려왔다. 사고 발생에 대한 자초지종을 설명한 전 씨. 그런데 기대했던 것과 달리 홍 씨는 전 씨가 전방주시를 소홀히 했다며 대수롭지 않게 반응했다.\n도로 위 기자재로 인한 사고, 누가 책임져야 할까?\n과실비율\n안전조치를 소홀히 한 홍 씨의 회사에\n과실비율 더 크게 적용\n홍 씨의 공사회사에 70% 과실\n도로확장공사를 도급받아 이를 시행하고 있던 홍 씨의 회사는 공사가 완료될 때까지 사고 방지를 위해 현장을 안전한 상태로 유지하고 관리할 책임이 있다. 하지만 기자재가 도로에 흩어져 있었음에도 적절한 조치를 취하지 않는 등 안전관리를 소홀히 했으므로 70% 과실이 인정된다.\n공사 중이라는 걸 알고 있었으면서 진입 및 운전 과정에서 전방주시의무를 소홀히 한 전 씨 또한 사고 발생과 손해 확대의 원인이 되므로 30% 과실이 인정된다.\nkey point\n‘도로 위의 지뢰’ 아찔한 공사현장 장애물 사고\n경고등, 표지판, 바리게이트, 방호 울타리, 충격흡수시설 등 각종 장애물로 인한 사고\n공사를 위해 파놓은 홀이나 일시적으로 변경한 차선 등 도로 유실 및 부실에 의한 사고\n적재물을 싣고 가는 건설차량이나 화물차량에서 떨어지는 적재물로 인한 사고\n꿀팁\n전방은 밝게, 주시는 확실하게!\n안전한 야간운전 방법\nTip 1\n도로 상태나 차로 등을 확인하면서 주행하기\n밤에 앞차의 미등만 보고 주행하면 길가에 정차한 차량까지 운행 중인 것으로 착각하기 쉬우니 잘 살피면서 주행합니다.\nTip 2\n중앙선에서 조금 떨어져 주행하기\n밤에 운전할 때는 중앙선을 침범해 오는 차량, 도로를 횡단하려고 중앙선 부근에 서 있는 보행자와 충돌하기 쉬우니 중앙선에서 바짝 붙지 말고 조금 떨어져서 주행합니다.\nTip 3\n피로는 안전운행의 적\n신경이 피로해져서 졸릴 때는 곧 운전을 중지하고 휴식을 취하거나 교대운전을 합니다.\nTip 4\n뒤차 불빛에 현혹되지 않도록 룸미러 조정하기\n뒤차의 전조등 불빛이 룸미러에 반사되어 눈이 부실 때는 브레이크를 밟지 말고 룸미러 각도를 조정해 눈이 부시지 않도록 합니다.\nTip 5\n타인에게 자신의 차량 알리기\n해가 저물기 전에 전조등, 미등, 차폭등을 켜고 위험이 예견되거나 상대방이 나를 발견하지 못했다고 판단되면 나의 존재를 알려 위험을 예방합니다.\nTip 6\n신호 충분히 하기\n밤에는 등화에 의해서만 모든 정보가 수집되므로 신호는 항상 여유 있고 정확하게, 그리고 일찍 해야 합니다.",
    "category": "차 vs. 기타",
    "case_id": "차 vs. 기타_4"
  },
  {
    "case_visual": {
      "title": "도로 틈에 고인 빗물 때문에\n사고가 나면 과실 범위는?",
      "description": "도로 틈에 고인 빗물 때문에\n사고가 나면 과실 범위는?"
    },
    "title": "고인 빗물이 옆 차선 운전자의 시야를 가린 상황",
    "situation": "비가 보슬보슬 내리는 아침, 홍길동 씨는 도로 틈에 고여 있는 빗물을 확인하지 못하고 직진하다가 옆 차선의 임꺽정 씨 차량으로 빗물을 튀겼다. 갑작스러운 물 폭탄이 차량 전면에 튀어 앞이 잘 보이지 않게 된 임 씨는 핸들을 급히 조작하다가 인도를 충격하고 말았다. 앞 범퍼가 파손된 상황, 임 씨는 홍 씨에게 수리비를 요구했다.\n홍 씨는 도로관리 관청의 관리 부실에 의한 사고라고 주장하며 관청에 연락을 취했다. 현장에 도착한 관청 직원 전우치 씨는 오전 내내 폭우가 내렸고 사고 시각에도 비가 내리고 있는 상황에서 홍 씨가 도로 틈을 확인하지 못한 과실이라고 주장했다.",
    "situation_highlight": "서로 다른 의견으로 대립각을 세우는 두 사람, 누구의 과실이 더 클까?",
    "sections": {
      "section_1": {
        "type": "과실비율",
        "title": "빗길운전, 운전자의 각별한 주의 요구",
        "main_ratio": "안전운행을 하지 않은 홍 씨의 과실비율이 높음",
        "details": [
          "홍 씨가 폭우로 인해 악화된 도로 상황을 고려하지 않아 일어난 사고다. 따라서 안전운행의 의무를 다하지 못한 홍 씨의 책임이 크다. 하지만 도로 관리의 의무를 다하지 못한 관청에게도 20~50%의 배상책임이 주어진다."
        ],
        "additional_cases": []
      },
      "section_2": {
        "type": "key point",
        "title": "사고율과 치사율 높은 빗길운전",
        "subtitles": [
          "안전운전을 방해하는 최대 적을 피하라!\n빗길 위험요소 3"
        ],
        "details": [
          "눈길만큼이나 빗길에서의 운전도 매우 위험합니다. 빗길 운전이 눈길 운전보다 사고율이 높고 치사율 또한 높기 때문입니다. 비 오는 날은 자동차가 미끄러지기 쉽고, 제동거리가 평상시보다 길어지기 때문에 주의해야 합니다. 또 시야 확보가 어려워 평소보다 주변을 살피는 데 주의를 기울여야 합니다."
        ]
      },
      "section_3": {
        "type": "꿀팁",
        "title": "빗길 위, 안전운전 행동 요령",
        "steps": [
          "Tip 1\n안전거리 확보하기\n차간 거리를 평소보다 50% 이상 확보해 미끄러짐에 의한 추돌사고를 대비합니다.",
          "Tip 2\n감속 운행하기\n비가 오면 브레이크를 밟아도 평소보다 반응속도가 느려지므로 제한속도보다 최대 20% 정도 감속 운행하는 것이 좋습니다. 가장 미끄러운 시기는 비가 내리기 시작할 때입니다.",
          "Tip 3\n낮에도 전조등 작동하기\n비 오는 날은 낮에도 어두우니 전조등을 켭니다. 전조등은 시야 확보를 하는 동시에 다른 차량에게 내 차의 위치를 알리는 역할을 합니다.",
          "Tip 4\n타이어 점검으로 수막현상 최소화하기\n수막현상은 타이어의 공기압이 낮거나 타이어가 오래됐을 때 발생하기도 하니 평상시 타이어를 정기적으로 점검합니다.",
          "Tip 5\n중앙차로 이용하기\n도로의 선형 구조상 가장자리 차선에 물웅덩이가 발생할 확률이 높습니다. 따라서 가능하면 중앙차로를 이용하는 것이 안전합니다.",
          "Tip 1\n1차로 주행 및 낙석 주의구간 운행\n비 오는 날은 마주 오는 차량과 정면으로 충돌할 위험이 있는 1차로 주행은 피하고, 낙석 주의구간이 있을 때는 시간이 걸리더라도 멀리 돌아가는 것이 안전합니다.",
          "Tip 2\nDMB 시청 및 통화\n시야 확보가 어려운 상황에서 주변을 살펴야 하므로 DMB 시청 및 라디오 청취, 통화는 삼갑니다.",
          "Tip 3\n급출발 및 급브레이크\n급출발이나 급브레이크는 미끄러짐이나 전복사고의 원인이 되므로 브레이크 페달을 여러 번 나누어 밟는 것이 좋습니다.",
          "Tip 4\n물가 주차 및 물웅덩이 주의\n물가 주차는 침수 위험이 있고, 길에 물이 고여 있는 곳을 지나다가 시동이 꺼지기도 하므로 물가 주차와 물웅덩이를 주의합니다."
        ],
        "subtitles": [
          "DO",
          "DON'T"
        ],
        "details": []
      }
    },
    "full_content": "고인 빗물이 옆 차선 운전자의 시야를 가린 상황\n비가 보슬보슬 내리는 아침, 홍길동 씨는 도로 틈에 고여 있는 빗물을 확인하지 못하고 직진하다가 옆 차선의 임꺽정 씨 차량으로 빗물을 튀겼다. 갑작스러운 물 폭탄이 차량 전면에 튀어 앞이 잘 보이지 않게 된 임 씨는 핸들을 급히 조작하다가 인도를 충격하고 말았다. 앞 범퍼가 파손된 상황, 임 씨는 홍 씨에게 수리비를 요구했다.\n홍 씨는 도로관리 관청의 관리 부실에 의한 사고라고 주장하며 관청에 연락을 취했다. 현장에 도착한 관청 직원 전우치 씨는 오전 내내 폭우가 내렸고 사고 시각에도 비가 내리고 있는 상황에서 홍 씨가 도로 틈을 확인하지 못한 과실이라고 주장했다.\n서로 다른 의견으로 대립각을 세우는 두 사람, 누구의 과실이 더 클까?\n과실비율\n빗길운전, 운전자의 각별한 주의 요구\n안전운행을 하지 않은 홍 씨의 과실비율이 높음\n홍 씨가 폭우로 인해 악화된 도로 상황을 고려하지 않아 일어난 사고다. 따라서 안전운행의 의무를 다하지 못한 홍 씨의 책임이 크다. 하지만 도로 관리의 의무를 다하지 못한 관청에게도 20~50%의 배상책임이 주어진다.\n이럴 땐 이런 과실 판정\n홍 씨가 과속운전을 했다면 관청의 과실비율은 10~20%까지 낮아진다.\nkey point\n사고율과 치사율 높은 빗길운전\n눈길만큼이나 빗길에서의 운전도 매우 위험합니다. 빗길 운전이 눈길 운전보다 사고율이 높고 치사율 또한 높기 때문입니다. 비 오는 날은 자동차가 미끄러지기 쉽고, 제동거리가 평상시보다 길어지기 때문에 주의해야 합니다. 또 시야 확보가 어려워 평소보다 주변을 살피는 데 주의를 기울여야 합니다.\n안전운전을 방해하는 최대 적을 피하라!\n빗길 위험요소 3\n1. 위험한 수막현상\n수막현상이란, 물웅덩이가 생긴 도로를 고속으로 달릴 때 타이어가 물 위에 떠서 구르게 되는 현상을 뜻합니다. 타이어와 길바닥이 닿지 않아 마찰력이 줄어 타이어가 헛도는 느낌이 드는데, 이때 제동을 하거나 핸들을 조작하면 미끄러지기 쉽습니다.\n2. 어려운 시야 확보\n차량 앞유리에 직접 부딪히는 빗방울 때문에 전방과 후방의 사물이 제대로 보이지 않을 수 있습니다. 따라서 평소보다 시야 확보에 더욱 신경 써야 합니다. 앞차나 옆차가 돌발적으로 물웅덩이를 밟고 지나가면서 물이 튀는 경우도 있는데, 이럴 때는 시야가 일시적으로 안 보일 수 있어 조심해야 합니다.\n3. 늘어난 제동거리\n제동거리란, 자동차 운전자가 브레이크를 밟아 자동차가 정지할 때까지 도로면 위에서 미끄러지는 거리를 말합니다. 비 오는 날 제동거리는 평소보다 10%가량 늘어나기 때문에 돌발상황이 발생했을 때나 순간적으로 브레이크를 밟을 때 사고율이 올라갑니다.\n꿀팁\n빗길 위, 안전운전 행동 요령\nDO\nTip 1\n안전거리 확보하기\n차간 거리를 평소보다 50% 이상 확보해 미끄러짐에 의한 추돌사고를 대비합니다.\nTip 2\n감속 운행하기\n비가 오면 브레이크를 밟아도 평소보다 반응속도가 느려지므로 제한속도보다 최대 20% 정도 감속 운행하는 것이 좋습니다. 가장 미끄러운 시기는 비가 내리기 시작할 때입니다.\nTip 3\n낮에도 전조등 작동하기\n비 오는 날은 낮에도 어두우니 전조등을 켭니다. 전조등은 시야 확보를 하는 동시에 다른 차량에게 내 차의 위치를 알리는 역할을 합니다.\nTip 4\n타이어 점검으로 수막현상 최소화하기\n수막현상은 타이어의 공기압이 낮거나 타이어가 오래됐을 때 발생하기도 하니 평상시 타이어를 정기적으로 점검합니다.\nTip 5\n중앙차로 이용하기\n도로의 선형 구조상 가장자리 차선에 물웅덩이가 발생할 확률이 높습니다. 따라서 가능하면 중앙차로를 이용하는 것이 안전합니다.\nDON'T\nTip 1\n1차로 주행 및 낙석 주의구간 운행\n비 오는 날은 마주 오는 차량과 정면으로 충돌할 위험이 있는 1차로 주행은 피하고, 낙석 주의구간이 있을 때는 시간이 걸리더라도 멀리 돌아가는 것이 안전합니다.\nTip 2\nDMB 시청 및 통화\n시야 확보가 어려운 상황에서 주변을 살펴야 하므로 DMB 시청 및 라디오 청취, 통화는 삼갑니다.\nTip 3\n급출발 및 급브레이크\n급출발이나 급브레이크는 미끄러짐이나 전복사고의 원인이 되므로 브레이크 페달을 여러 번 나누어 밟는 것이 좋습니다.\nTip 4\n물가 주차 및 물웅덩이 주의\n물가 주차는 침수 위험이 있고, 길에 물이 고여 있는 곳을 지나다가 시동이 꺼지기도 하므로 물가 주차와 물웅덩이를 주의합니다.",
    "category": "차 vs. 기타",
    "case_id": "차 vs. 기타_5"
  },
  {
    "case_visual": {
      "title": "지하철 공사현장에서\n접촉사고가 나면\n과실 범위는?",
      "description": "지하철 공사현장에서\n접촉사고가 나면\n과실 범위는?"
    },
    "title": "공사현장 시설물과 접촉해 차량이 파손된 상황",
    "situation": "어두운 밤, 전우치 씨 차량이 지하철 공사현장을 지나가고 있었다.\n그때 차량 아래에 뭔가가 걸리는 느낌이 들면서 둔탁한 소리가 들려왔다. 전 씨가 차를 세우고 살펴보니 공사현장 복공판(평면 철판) 때문에 아래쪽이 파손되어 있었다. 복공판의 이음부가 이탈해 사고 원인으로 작용한 상황이었다.\n전 씨는 건설회사가 안전조치를 제대로 하지 않았기 때문에 발생한 사고라며 수리비를 요구했다. 하지만 건설회사의 홍길동 대표는 안전운행 표지판도 설치되어 있고, 노후된 차량에 무리하게 4인이 탑승해 차고가 낮아져 발생한 사고라며 배상책임이 없다고 주장했다.",
    "situation_highlight": "",
    "sections": {
      "section_1": {
        "type": "과실비율",
        "title": "홍 씨에게 시설 관리 부주의로 인한 배상책임",
        "main_ratio": "건설회사 대표 홍 씨의 과실이 크지만, 운전자인 전 씨에게도 과실이 인정",
        "details": [
          "도로 등 시설물의 공사를 시공하는 경우 안전조치가 선행되어야 한다. 지하철 공사 중 도로와 복공판 이음부의 이탈이 발생해서 사고 원인을 제공했다면 담당 건설회사의 과실이 더 크다.\n또한 전 씨 차량에 4인이 탑승한 것은 도로교통법상 탑승인원을 초과한 것이 아니므로 무리한 운행으로 볼 수는 없다. 하지만 사고 당시 공사 진입로에 야광 공사안내 표지판이 있었음에도 전방주시를 하지 못한 홍 씨에게도 과실 40% 정도가 인정된다."
        ],
        "additional_cases": []
      },
      "section_2": {
        "type": "key point",
        "title": "도로 공사현장 주변에서는 더욱 주의 필요",
        "subtitles": [
          "도로공사란?",
          "공사안내 표지판은 안전운행의 도움말",
          "「도로교통법」 제5조(신호 또는 지시에 따를 의무)"
        ],
        "details": [
          "도로공사는 차량 운행이 원활하도록 도로를 유지 · 보수 · 개량하는 작업을 말합니다. 도로공사의 종류는 30일 이상 시행하는 장기공사, 5~30일 동안 시행하는 중기공사, 5일을 넘기지 않는 단기공사, 전화나 전기 등 공공시설의 유지 · 보수 혹은 재해 시 복구활동을 위한 긴급공사, 공사지점이 일정한 고정공사, 이동하면서 공사가 진행되는 이동공사로 나뉩니다.",
          "공사안내 표지판을 발견하면 감속하면서 도로상황 등 주의사항을 눈여겨보는 것이 공사현장에서의 사고를 막는 제1의 법칙입니다.",
          "도로를 통행하는 보행자, 차마 또는 노면전차의 운전자는 교통안전시설이 표시하는 신호 또는 지시, 자치경찰공무원과 경찰보조자가 하는 신호 또는 지시를 따라야 한다."
        ]
      },
      "section_3": {
        "type": "key point",
        "title": "도로 공사현장에서 자주 일어나는 사고",
        "subtitles": [],
        "details": []
      },
      "section_4": {
        "type": "꿀팁",
        "title": "감속은 필수! 공사현장 주변 운전 시 주의사항",
        "steps": [
          "Tip 1\n표지판 자세히 살피기\n공사안내 표지판을 발견하면 전방 몇 미터 거리에 공사현장이 있는지 파악하고, 적정 속도 및 도로 변경 상황 등을 자세히 살펴 지시에 따라 대처합니다.",
          "Tip 2\n감속으로 사고 위험 줄이기\n공사구간은 좁고 복잡해 사고 위험이 크니, 진입 전부터 서행하면서 안전하게 지나갑니다.",
          "Tip 3\n공사구간 우회하기\n공사현장의 위험을 피하는 확실한 방법은 공사구간을 우회하는 것입니다. 공사구간을 미리 알고 있다면 대안 경로를 찾아두는 것도 좋습니다.",
          "Tip 4\n시설물 및 기자재 주의하기\n공사현장의 다양한 시설물과 기자재 또한 사고의 원인이 될 수 있으니 차량의 전후좌우 상황을 모두 살피는 자세가 중요합니다."
        ],
        "subtitles": [],
        "details": []
      }
    },
    "full_content": "공사현장 시설물과 접촉해 차량이 파손된 상황\n어두운 밤, 전우치 씨 차량이 지하철 공사현장을 지나가고 있었다.\n그때 차량 아래에 뭔가가 걸리는 느낌이 들면서 둔탁한 소리가 들려왔다. 전 씨가 차를 세우고 살펴보니 공사현장 복공판(평면 철판) 때문에 아래쪽이 파손되어 있었다. 복공판의 이음부가 이탈해 사고 원인으로 작용한 상황이었다.\n전 씨는 건설회사가 안전조치를 제대로 하지 않았기 때문에 발생한 사고라며 수리비를 요구했다. 하지만 건설회사의 홍길동 대표는 안전운행 표지판도 설치되어 있고, 노후된 차량에 무리하게 4인이 탑승해 차고가 낮아져 발생한 사고라며 배상책임이 없다고 주장했다.\n과실비율\n홍 씨에게 시설 관리 부주의로 인한 배상책임\n건설회사 대표 홍 씨의 과실이 크지만, 운전자인 전 씨에게도 과실이 인정\n도로 등 시설물의 공사를 시공하는 경우 안전조치가 선행되어야 한다. 지하철 공사 중 도로와 복공판 이음부의 이탈이 발생해서 사고 원인을 제공했다면 담당 건설회사의 과실이 더 크다.\n또한 전 씨 차량에 4인이 탑승한 것은 도로교통법상 탑승인원을 초과한 것이 아니므로 무리한 운행으로 볼 수는 없다. 하지만 사고 당시 공사 진입로에 야광 공사안내 표지판이 있었음에도 전방주시를 하지 못한 홍 씨에게도 과실 40% 정도가 인정된다.\n이럴 땐 이런 과실 판정\n탑승인원을 초과했다면 운전자 과실이 10% 추가되고, 운전자가 과속했다면 운전자 과실 10~20%가 추가된다.\nkey point\n도로 공사현장 주변에서는 더욱 주의 필요\n도로공사란?\n도로공사는 차량 운행이 원활하도록 도로를 유지 · 보수 · 개량하는 작업을 말합니다. 도로공사의 종류는 30일 이상 시행하는 장기공사, 5~30일 동안 시행하는 중기공사, 5일을 넘기지 않는 단기공사, 전화나 전기 등 공공시설의 유지 · 보수 혹은 재해 시 복구활동을 위한 긴급공사, 공사지점이 일정한 고정공사, 이동하면서 공사가 진행되는 이동공사로 나뉩니다.\n공사안내 표지판은 안전운행의 도움말\n공사안내 표지판을 발견하면 감속하면서 도로상황 등 주의사항을 눈여겨보는 것이 공사현장에서의 사고를 막는 제1의 법칙입니다.\n「도로교통법」 제5조(신호 또는 지시에 따를 의무)\n도로를 통행하는 보행자, 차마 또는 노면전차의 운전자는 교통안전시설이 표시하는 신호 또는 지시, 자치경찰공무원과 경찰보조자가 하는 신호 또는 지시를 따라야 한다.\nkey point\n도로 공사현장에서 자주 일어나는 사고\n지하철 공사현장 복공판 위에서 미끄러지는 사고\n펜스 및 칼라콘 등 안전조치 시설물과의 접촉사고\n도로에 널브러진 기자재로 인한 사고\n야간에 공사안내 표지판을 인지하지 못하고 공사현장에 진입해 일어나는 사고\n공사구간을 통행하는 건설차량 및 화물차량과의 접촉사고\n좁은 공사구간에서 보행자를 충격하는 사고\n꿀팁\n감속은 필수! 공사현장 주변 운전 시 주의사항\nTip 1\n표지판 자세히 살피기\n공사안내 표지판을 발견하면 전방 몇 미터 거리에 공사현장이 있는지 파악하고, 적정 속도 및 도로 변경 상황 등을 자세히 살펴 지시에 따라 대처합니다.\nTip 2\n감속으로 사고 위험 줄이기\n공사구간은 좁고 복잡해 사고 위험이 크니, 진입 전부터 서행하면서 안전하게 지나갑니다.\nTip 3\n공사구간 우회하기\n공사현장의 위험을 피하는 확실한 방법은 공사구간을 우회하는 것입니다. 공사구간을 미리 알고 있다면 대안 경로를 찾아두는 것도 좋습니다.\nTip 4\n시설물 및 기자재 주의하기\n공사현장의 다양한 시설물과 기자재 또한 사고의 원인이 될 수 있으니 차량의 전후좌우 상황을 모두 살피는 자세가 중요합니다.",
    "category": "차 vs. 기타",
    "case_id": "차 vs. 기타_6"
  },
  {
    "case_visual": {
      "title": "굴착기 작업 중 일반차량과\n접촉했을대 소유회사의 배상책임은?",
      "description": "굴착기 작업 중 일반차량과\n접촉했을대 소유회사의 배상책임은?"
    },
    "title": "작업하던 굴착기와 자가용의 접촉사고",
    "situation": "도로 공사가 한창이던 어느 날, 굴착기 작업을 하던 홍길동 씨가 근방을 지나던 전우치 씨의 자가용과 충돌하는 사고가 발생했다. 작업에 한창이던 홍길동 씨가 뒤쪽에서 다가오던 전우치 씨의 자가용을 발견하지 못하고 후진하다가 충돌하게 된 것.\n작업 당시 홍길동 씨는 앞쪽에서 작업을 지시하던 보조자 임꺽정 씨의 신호에 맞춰 작업하고 있었고, 굴착기 앞쪽에서 신호를 보내던 임꺽정 씨는 굴착기 뒤에서 직진하던 임꺽정 씨의 차량을 볼 수 없었다. 작업장 근처의 다른 작업자들이 근방을 주행하던 전우치 씨에게 주의를 줬지만 전 씨가 그대로 주행하다가 난 사고였다.\n자신의 차가 훼손된 것을 살펴본 전우치 씨는 대뜸 굴착기 운전자 홍길동 씨에게 배상을 요구했다. 홍길동 씨는 보조자 임꺽정 씨의 신호에 따라 작업하고 있었을 뿐이어서 이 상황이 얼떨떨하기만 했다. 그렇다고 공사장 바깥의 상황은 볼 수 없었던 임꺽정 씨가 잘못했다고 할 수도 없었다.",
    "situation_highlight": "작업 중이던 굴착기와 경고를 무시한 운전자, 배상책임은 누구에게 있을까?",
    "sections": {
      "section_1": {
        "type": "과실비율",
        "title": "작업 중 생긴 교통사고,\n배상책임은 중장비업체에게",
        "main_ratio": "작업자들의 경고 여부와 무관하게 중장비업체는 사고에 대한 배상책임",
        "details": [
          "일단, 정황에 따라 다소 차이가 있을 수 있겠으나 작업 중 생긴 교통사고는 중장비업체의 책임하에 있다고 본다. 따라서 이 사고의 핵심은 ‘주변 작업자들이 직진하던 일반차량 운전자에게 주의를 준 행위가 중장비업체의 과실을 면해줄 수 있는가’ 하는 문제다.\n작업장에서 굴착기를 운전한 것은 홍길동 씨, 운전신호를 관장한 것은 임꺽정 씨, 인근 차량을 주의시킨 것은 주변 작업자들이다. 일반적으로 보조자가 통행과 작업이 원활하도록 교통을 통제할 수는 있으나 실제 차량을 움직이는 것은 운전자의 결정 사항이다. 보조 운전자가 전체 교통 상황을 통제할 권리를 갖고 있지는 않다는 것이다.\n따라서 후진 행위에 대한 결정은 홍길동 씨가 하는 것이고, 이에 대한 과실을 인정해 중장비업체가 일반차량 운전자 전우치 씨에게 배상할 책임을 져야 한다.",
          "작업자들이 직진하지 말라고 주의를 줬음에도 불구하고 무리하게 직진해서 사고를 당한 전우치 씨에게도 일부 과실은 있다고 볼 수 있다.\n이 경우, 굴착기 운전자의 부주의가 더 크다고 볼 수 있어서 전우치 씨의 과실은 10~20%로 볼 수 있으며, 만일 굴착기가 전진 중이었다면 전우치 씨의 차량 역시 굴착기 운행을 예측하고 방어운전할 수 있었다는 점을 고려해 과실비율이 더 높아진다. 최대 50%까지 과실 범위가 산정될 수도 있다."
        ],
        "additional_cases": []
      }
    },
    "full_content": "작업하던 굴착기와 자가용의 접촉사고\n도로 공사가 한창이던 어느 날, 굴착기 작업을 하던 홍길동 씨가 근방을 지나던 전우치 씨의 자가용과 충돌하는 사고가 발생했다. 작업에 한창이던 홍길동 씨가 뒤쪽에서 다가오던 전우치 씨의 자가용을 발견하지 못하고 후진하다가 충돌하게 된 것.\n작업 당시 홍길동 씨는 앞쪽에서 작업을 지시하던 보조자 임꺽정 씨의 신호에 맞춰 작업하고 있었고, 굴착기 앞쪽에서 신호를 보내던 임꺽정 씨는 굴착기 뒤에서 직진하던 임꺽정 씨의 차량을 볼 수 없었다. 작업장 근처의 다른 작업자들이 근방을 주행하던 전우치 씨에게 주의를 줬지만 전 씨가 그대로 주행하다가 난 사고였다.\n자신의 차가 훼손된 것을 살펴본 전우치 씨는 대뜸 굴착기 운전자 홍길동 씨에게 배상을 요구했다. 홍길동 씨는 보조자 임꺽정 씨의 신호에 따라 작업하고 있었을 뿐이어서 이 상황이 얼떨떨하기만 했다. 그렇다고 공사장 바깥의 상황은 볼 수 없었던 임꺽정 씨가 잘못했다고 할 수도 없었다.\n작업 중이던 굴착기와 경고를 무시한 운전자, 배상책임은 누구에게 있을까?\n과실비율\n작업 중 생긴 교통사고,\n배상책임은 중장비업체에게\n작업자들의 경고 여부와 무관하게 중장비업체는 사고에 대한 배상책임\n일단, 정황에 따라 다소 차이가 있을 수 있겠으나 작업 중 생긴 교통사고는 중장비업체의 책임하에 있다고 본다. 따라서 이 사고의 핵심은 ‘주변 작업자들이 직진하던 일반차량 운전자에게 주의를 준 행위가 중장비업체의 과실을 면해줄 수 있는가’ 하는 문제다.\n작업장에서 굴착기를 운전한 것은 홍길동 씨, 운전신호를 관장한 것은 임꺽정 씨, 인근 차량을 주의시킨 것은 주변 작업자들이다. 일반적으로 보조자가 통행과 작업이 원활하도록 교통을 통제할 수는 있으나 실제 차량을 움직이는 것은 운전자의 결정 사항이다. 보조 운전자가 전체 교통 상황을 통제할 권리를 갖고 있지는 않다는 것이다.\n따라서 후진 행위에 대한 결정은 홍길동 씨가 하는 것이고, 이에 대한 과실을 인정해 중장비업체가 일반차량 운전자 전우치 씨에게 배상할 책임을 져야 한다.\n경고를 무시한 일반차량의 과실도 일부 인정\n작업자들이 직진하지 말라고 주의를 줬음에도 불구하고 무리하게 직진해서 사고를 당한 전우치 씨에게도 일부 과실은 있다고 볼 수 있다.\n이 경우, 굴착기 운전자의 부주의가 더 크다고 볼 수 있어서 전우치 씨의 과실은 10~20%로 볼 수 있으며, 만일 굴착기가 전진 중이었다면 전우치 씨의 차량 역시 굴착기 운행을 예측하고 방어운전할 수 있었다는 점을 고려해 과실비율이 더 높아진다. 최대 50%까지 과실 범위가 산정될 수도 있다.",
    "category": "차 vs. 기타",
    "case_id": "차 vs. 기타_7"
  }
]