[
  {
    "case_visual": {
      "title": "트럭의 적재물이 떨어져 생긴\n사고, 어느 쪽 과실일까?",
      "description": "트럭의 적재물이 떨어져 생긴\n사고, 어느 쪽 과실일까?"
    },
    "title": "트럭의 적재물이 떨어져 생긴 사고",
    "situation": "홍길동 씨는 고속도로에서 트럭 뒤를 운행 중이었다. 짐을 높게 쌓아 올린 트럭 뒤를 쫓아가는 것이 아무래도 불안해서 차선을 바꾸려던 찰나, 트럭 위에 불안하게 실려 있던 짐이 떨어지면서 홍길동 씨의 차를 파손하고 말았다. 다행히 인명 손상은 없었으나 홍길동 씨 차의 상태가 말이 아니다. 보조석 쪽 앞유리는 물론이고 백미러까지 파손되었다. 홍길동 씨, 너무 놀라고 화가 났는데 트럭 운전사 전우치 씨는 오히려 더 큰소리다.",
    "situation_highlight": "이 경우 과실책임은 누구에게 있을까? 물건을 떨어뜨린 트럭일까, 아니면 충분히 거리를 확보하지 않은 채 따라오던 뒤차일까?",
    "sections": {
      "section_1": {
        "type": "과실비율",
        "title": "장애물을 떨어뜨린 트럭운전자에게 책임",
        "main_ratio": "추가사고에 대한 피해 과실 책임은?",
        "details": [
          "고속도로에서 트럭이 떨어뜨린 적재물로 인해 뒤차가 입은 피해는 당연히 원인이 되는 행위를 한 트럭의 과실로 정리된다.\n다만, 이런 사고의 경우 가장 어려운 점은 원인 행위자에 대한 정보 확보가 잘 되지 않는다는 것이 더 큰 문제다. 수많은 차량이 빠른 속도로 달리는 고속도로에서 대부분의 경우 트럭 운전사는 자신의 트럭에서 물건이 떨어졌다는 것을 눈치채지 못하는 경우가 많고, 인식했더라도 주행을 계속해 달아나는 경우도 간혹 있기 때문이다. 블랙박스에 앞차 번호판이 상세히 기록되지 않는 경우, 고속도로 CCTV 등을 수배해서 번호를 찾는 것이 대안이 될 수 있겠다.",
          "트럭에서 물건이 떨어지는 경우, 대부분의 운전사는 핸들을 돌려 차선을 바꾸거나 급정거를 하게 된다. 이 경우 트럭과 뒤따라 달리던 차량 간의 사고 외에 추가사고가 발생하는 경우가 많다. 홍길동 씨가 급정거를 했고, 홍길동 씨 차를 뒤따라오던 차가 홍길동 씨 차와 추돌을 하게 된다면 이에 대한 과실책임은 누구에게 있을까?\n홍길동 씨 차를 뒤따르던 차량이다. 홍길동 씨 차량이 급정거한 이유가 트럭 적재물 낙하 때문이긴 하지만 뒤따르던 차량과의 충돌은 안전거리를 확보하지 않은 뒤차의 과실이기 때문이다.\n금융감독원의 금융분쟁조정위원회가 2014년 발간한 금융분쟁조정사례집에서 이와 유사한 경우를 다루고 있다. '트럭 바로 뒤의 승용차가 정지한 점을 감안할 때 추돌 차량도 안전거리만 확보했다면 충분히 사고를 피할 수 있었다'고 지적하고 있다."
        ],
        "additional_cases": []
      }
    },
    "full_content": "트럭의 적재물이 떨어져 생긴 사고\n홍길동 씨는 고속도로에서 트럭 뒤를 운행 중이었다. 짐을 높게 쌓아 올린 트럭 뒤를 쫓아가는 것이 아무래도 불안해서 차선을 바꾸려던 찰나, 트럭 위에 불안하게 실려 있던 짐이 떨어지면서 홍길동 씨의 차를 파손하고 말았다. 다행히 인명 손상은 없었으나 홍길동 씨 차의 상태가 말이 아니다. 보조석 쪽 앞유리는 물론이고 백미러까지 파손되었다. 홍길동 씨, 너무 놀라고 화가 났는데 트럭 운전사 전우치 씨는 오히려 더 큰소리다.\n달리는 트럭에 실려 있던 물건이 떨어져서 뒤따라 달리던 차에 피해를 입혔다.\n이 경우 과실책임은 누구에게 있을까? 물건을 떨어뜨린 트럭일까, 아니면 충분히 거리를 확보하지 않은 채 따라오던 뒤차일까?\n과실비율\n장애물을 떨어뜨린 트럭운전자에게 책임\n고속도로에서 트럭이 떨어뜨린 적재물로 인해 뒤차가 입은 피해는 당연히 원인이 되는 행위를 한 트럭의 과실로 정리된다.\n다만, 이런 사고의 경우 가장 어려운 점은 원인 행위자에 대한 정보 확보가 잘 되지 않는다는 것이 더 큰 문제다. 수많은 차량이 빠른 속도로 달리는 고속도로에서 대부분의 경우 트럭 운전사는 자신의 트럭에서 물건이 떨어졌다는 것을 눈치채지 못하는 경우가 많고, 인식했더라도 주행을 계속해 달아나는 경우도 간혹 있기 때문이다. 블랙박스에 앞차 번호판이 상세히 기록되지 않는 경우, 고속도로 CCTV 등을 수배해서 번호를 찾는 것이 대안이 될 수 있겠다.\n추가사고에 대한 피해 과실 책임은?\n트럭에서 물건이 떨어지는 경우, 대부분의 운전사는 핸들을 돌려 차선을 바꾸거나 급정거를 하게 된다. 이 경우 트럭과 뒤따라 달리던 차량 간의 사고 외에 추가사고가 발생하는 경우가 많다. 홍길동 씨가 급정거를 했고, 홍길동 씨 차를 뒤따라오던 차가 홍길동 씨 차와 추돌을 하게 된다면 이에 대한 과실책임은 누구에게 있을까?\n홍길동 씨 차를 뒤따르던 차량이다. 홍길동 씨 차량이 급정거한 이유가 트럭 적재물 낙하 때문이긴 하지만 뒤따르던 차량과의 충돌은 안전거리를 확보하지 않은 뒤차의 과실이기 때문이다.\n금융감독원의 금융분쟁조정위원회가 2014년 발간한 금융분쟁조정사례집에서 이와 유사한 경우를 다루고 있다. '트럭 바로 뒤의 승용차가 정지한 점을 감안할 때 추돌 차량도 안전거리만 확보했다면 충분히 사고를 피할 수 있었다'고 지적하고 있다.",
    "category": "차 vs. 사람",
    "case_id": "차 vs. 사람_0"
  },
  {
    "case_visual": {
      "title": "버스 손잡이를 잡지 않은\n승객이 넘어져 타쳤을 경우\n누구의 과실일까?",
      "description": "버스 손잡이를 잡지 않은\n승객이 넘어져 타쳤을 경우\n누구의 과실일까?"
    },
    "title": "버스에서 탑승객이 손잡이를 잡지 않아 넘어져 다친 상황",
    "situation": "버스 운전기사인 홍길동 씨는 지방도로에서 오르막 비포장도로를 달리고 있었다. 회전 반경을 앞두고 좌회전을 하는 찰나, 탑승객 전우치 씨가 넘어지는 사고가 발생했다. 버스 손잡이를 잡지 않고 있던 전우치 씨가 자리를 이탈하면서 부상을 당한 것. 전우치 씨는 탑승 당시 홍길동 씨가 안전조치에 대한 내용을 전달하지 않았고, 비포장도로에서 서행하지 않았다고 주장하고 나섰다. 전적으로 버스 운전기사 홍길동 씨의 과실 때문에 일어난 사고라며 자신은 과실이 없다고 덧붙였다. 이에 홍길동 씨는 승객으로서 의무를 다하지 않은 전우치 씨 또한 과실이 있다고 말했다.",
    "situation_highlight": "과연 전우치 씨의 주장대로 홍길동 씨에게 모든 책임이 있는 걸까?",
    "sections": {
      "section_1": {
        "type": "과실비율",
        "title": "안전의무 이행 여부에 따라 승객의 과실 발생",
        "main_ratio": "탑승객에게도 10~20%의 과실",
        "details": [
          "버스 운전자인 홍길동 씨의 과실이지만 일방적인 것은 아니다. 탑승객으로서의 안전의무를 게을리 한 전우치 씨에게도 과실이 발생한다. 버스가 비포장도로를 달리고 있는 상태는 이미 전우치 씨에게 안전이 요구된 상황이었다. 또 버스가 회전하면 전우치 씨도 미리 사고를 예방할 수 있는 조치를 취했어야 한다. 하지만 전우치 씨는 버스 손잡이를 잡지 않은 채 자리를 이탈했으므로 안전의무를 태만히 했다. 더불어 버스가 갑자기 급회전한 것이 아니므로 전우치 씨에게도 과실이 발생한다."
        ],
        "additional_cases": []
      },
      "section_2": {
        "type": "key point",
        "title": "탑승객과 동승자를 위협하는 차내 안전사고",
        "subtitles": [
          "나와 동승자의 안전을 최우선으로! 차내 안전사고",
          "차내 안전사고 원인 5"
        ],
        "details": [
          "차내 안전사고는 운전자의 과실이나 부주의로 인해 탑승객 또는 동승자가 부상당하는 경우를 말합니다. 교통사고는 「도로교통법」, 「교통사고처리특례법」, 「특정범죄 가중처벌 등에 관한 법률」 등에 의해 형사처분을 받을 수 있지만, 차내 안전사고는 일반적으로 「자동차손해배상 보장법」 에 의해 민사적으로 해결할 뿐 형사처벌을 받는 경우는 드뭅니다. 하지만 운전자는 자신을 믿고 차량에 동승한 이들을 보호해 안전운전의무를 성실히 행해야 합니다."
        ]
      },
      "section_3": {
        "type": "꿀팁",
        "title": "혼자가 아닌 ‘모두’를 위한 운전 자세가 중요!\n안전사고 예방 수칙",
        "steps": [
          "Rule1\n신호 준수와 제한속도 유지는 기본 중의 기본입니다.",
          "Rule2\n무신호 교차로, 곡선도로 등 사고 다발지역에서는 더 세심한 주의가 필요합니다.",
          "Rule3\n비포장도로 진입이나 급회전 등의 상황이 발생하면 탑승객이나 동승자에게 신호를 합니다.",
          "Rule4\n탑승객과 동승자가 탑승 후 자리에 앉았는지, 안전띠를 착용했는지 살핍니다.",
          "Rule5\n기상 현황을 살펴보고 필요하면 교통정보방송을 청취해 정보를 습득합니다.",
          "Rule6\n승객의 안전을 위협할 수 있는 차내 장식물이나 도구는 제거합니다.",
          "Rule7\n안전운전을 저해하는 DMB 시청 및 휴대폰 사용은 삼갑니다."
        ],
        "subtitles": [],
        "details": []
      }
    },
    "full_content": "버스에서 탑승객이 손잡이를 잡지 않아 넘어져 다친 상황\n버스 운전기사인 홍길동 씨는 지방도로에서 오르막 비포장도로를 달리고 있었다. 회전 반경을 앞두고 좌회전을 하는 찰나, 탑승객 전우치 씨가 넘어지는 사고가 발생했다. 버스 손잡이를 잡지 않고 있던 전우치 씨가 자리를 이탈하면서 부상을 당한 것. 전우치 씨는 탑승 당시 홍길동 씨가 안전조치에 대한 내용을 전달하지 않았고, 비포장도로에서 서행하지 않았다고 주장하고 나섰다. 전적으로 버스 운전기사 홍길동 씨의 과실 때문에 일어난 사고라며 자신은 과실이 없다고 덧붙였다. 이에 홍길동 씨는 승객으로서 의무를 다하지 않은 전우치 씨 또한 과실이 있다고 말했다.\n두 사람이 대립각을 세우며 신경전을 계속하고 있다.\n과연 전우치 씨의 주장대로 홍길동 씨에게 모든 책임이 있는 걸까?\n과실비율\n안전의무 이행 여부에 따라 승객의 과실 발생\n탑승객에게도 10~20%의 과실\n버스 운전자인 홍길동 씨의 과실이지만 일방적인 것은 아니다. 탑승객으로서의 안전의무를 게을리 한 전우치 씨에게도 과실이 발생한다. 버스가 비포장도로를 달리고 있는 상태는 이미 전우치 씨에게 안전이 요구된 상황이었다. 또 버스가 회전하면 전우치 씨도 미리 사고를 예방할 수 있는 조치를 취했어야 한다. 하지만 전우치 씨는 버스 손잡이를 잡지 않은 채 자리를 이탈했으므로 안전의무를 태만히 했다. 더불어 버스가 갑자기 급회전한 것이 아니므로 전우치 씨에게도 과실이 발생한다.\nkey point\n탑승객과 동승자를 위협하는 차내 안전사고\n나와 동승자의 안전을 최우선으로! 차내 안전사고\n차내 안전사고는 운전자의 과실이나 부주의로 인해 탑승객 또는 동승자가 부상당하는 경우를 말합니다. 교통사고는 「도로교통법」, 「교통사고처리특례법」, 「특정범죄 가중처벌 등에 관한 법률」 등에 의해 형사처분을 받을 수 있지만, 차내 안전사고는 일반적으로 「자동차손해배상 보장법」 에 의해 민사적으로 해결할 뿐 형사처벌을 받는 경우는 드뭅니다. 하지만 운전자는 자신을 믿고 차량에 동승한 이들을 보호해 안전운전의무를 성실히 행해야 합니다.\n차내 안전사고 원인 5\n1. 급제동\n앞서 가던 차량의 감속이나 정지로 인해 뒤따라가던 차량이 급제동을 하면서 그 충격에 의해 승객이 부상을 입는 경우가 많습니다. 또 전방에 무단횡단자 또는 오토바이 등이 갑자기 출현하거나 다른 차량이 끼어들어 이를 피하고자 급제동을 하면서 사고가 발생하기도 합니다.\n2. 급출발\n승객이나 동승자를 태우고 급출발하면서 사고가 일어나기도 합니다. 미처 좌석에 제대로 앉지 못했거나 안전띠를 착용하지 못했을 경우, 급출발 충격으로 넘어지거나 의자 등 차내 시설에 부딪혀 부상을 입기도 합니다.\n3. 회전\n차량이 교차로 등에서 좌회전 또는 우회전을 하거나 유턴 또는 커브길을 지날 때 차체가 기울며 승객이 넘어질 수 있고, 안전봉 등 차내 시설에 부딪혀 사고가 일어나기도 합니다.\n4. 진동\n차량이 과속방지턱, 웅덩이, 교량의 이음새 등 요철 부분을 지나면서 발생하는 진동에 의해 넘어지거나 안전봉, 의자 등에 부딪혀 부상을 입게 되는 경우를 말합니다.\n5. 승객 부주의\n승객이나 동승자가 운행 중 안전의무를 다하지 못한 경우에도 사고가 발생합니다. 특히 버스 탑승객의 경우 손잡이를 잡지 않거나 운행 중 이동하면서 넘어지기도 하고, 실수로 발을 헛디뎌 부상을 입거나 하차할 때 계단에서 미끄러지는 등 운전자 과실이 아닌 본인의 부주의에 의해 사고가 발생하기도 합니다.\n꿀팁\n혼자가 아닌 ‘모두’를 위한 운전 자세가 중요!\n안전사고 예방 수칙\nRule1\n신호 준수와 제한속도 유지는 기본 중의 기본입니다.\nRule2\n무신호 교차로, 곡선도로 등 사고 다발지역에서는 더 세심한 주의가 필요합니다.\nRule3\n비포장도로 진입이나 급회전 등의 상황이 발생하면 탑승객이나 동승자에게 신호를 합니다.\nRule4\n탑승객과 동승자가 탑승 후 자리에 앉았는지, 안전띠를 착용했는지 살핍니다.\nRule5\n기상 현황을 살펴보고 필요하면 교통정보방송을 청취해 정보를 습득합니다.\nRule6\n승객의 안전을 위협할 수 있는 차내 장식물이나 도구는 제거합니다.\nRule7\n안전운전을 저해하는 DMB 시청 및 휴대폰 사용은 삼갑니다.",
    "category": "차 vs. 사람",
    "case_id": "차 vs. 사람_1"
  },
  {
    "case_visual": {
      "title": "아파트 단지에서 후진 중\n어린이를 접촉, 과실의 책임은?",
      "description": "아파트 단지에서 후진 중\n어린이를 접촉, 과실의 책임은?"
    },
    "title": "차 뒤에 있던 어린이를 발견 못하고 후진 중 사고",
    "situation": "주말 오후 아파트 단지 안. 홍길동 씨는 주차해 두었던 차량을 몰고 외출하려던 참이었다. 차량들이 다닥다닥 붙어 있어 빠져나가려면 여러 번 움직여야 했다. 그때, 뒤에서 쿵, 하는 소리와 함께 아이 울음소리가 들려왔다. 미처 뒤를 확인하지 못하고 차량 뒤에서 놀고 있던 세 살 어린이를 충격하는 사고가 난 것이다. 홍길동 씨가 차에서 내려 넘어진 어린이를 일으켜 세우자, 이 모습을 본 아버지 전우치 씨가 허겁지겁 달려왔다. 언성을 높이는 전 씨에 홍 씨 또한 맞섰다.",
    "situation_highlight": "어린이의 친권자에게도 과실책임이 있을까?",
    "sections": {
      "section_1": {
        "type": "과실비율",
        "title": "어린이를 보호하지 않은 친권자에게도 과실 인정",
        "main_ratio": "어린이 보호의무를 게을리한 전우치 씨의 과실도 20~30%",
        "details": [
          "차량 통행이 빈번한 곳에 어린아이를 무단 방치한 전우치 씨의 과실이 인정된다. 세 살 정도의 어린이는 아직 사리 분별능력이 없기 때문에 사고를 미연에 방지하려면 친권자의 보호가 필요하다. 이를 간과한 채 어린이를 혼자 놀게 놔둔 친권자에게 과실이 인정된다."
        ],
        "additional_cases": []
      },
      "section_2": {
        "type": "key point",
        "title": "키 작은 어린이는 더욱 주의!\n어린이보호구역",
        "subtitles": [
          "전후좌우 살피며 천천히 운전하기",
          "꼭 알아야 할 어린이보호구역 표지판"
        ],
        "details": [
          "어린이보호구역은 유치원과 초등학교 정문에서부터 300m이내의 통학로를 포함합니다. 유치원생과 초등학생이 안전하게 등하교할 수 있도록 운전자는 어린이보호구역에서 시속 30km/h 이하로 서행해야 합니다."
        ]
      },
      "section_3": {
        "type": "꿀팁",
        "title": "어린이보호구역에서는 어린이가 왕!\n안전운전 요령",
        "steps": [
          "Tip 1\n어린이보호구역에서 주정차하지 않기\n키 작은 어린이가 차량 사이에 있을 경우 발견하지 못하거나 주정차 차량 때문에 아이가 달려오는 차를 발견하지 못할 수 있으므로 차량을 세우지 않습니다.",
          "Tip 2\n어린이 통학버스 보호의무는 기본"
        ],
        "subtitles": [],
        "details": []
      }
    },
    "full_content": "차 뒤에 있던 어린이를 발견 못하고 후진 중 사고\n주말 오후 아파트 단지 안. 홍길동 씨는 주차해 두었던 차량을 몰고 외출하려던 참이었다. 차량들이 다닥다닥 붙어 있어 빠져나가려면 여러 번 움직여야 했다. 그때, 뒤에서 쿵, 하는 소리와 함께 아이 울음소리가 들려왔다. 미처 뒤를 확인하지 못하고 차량 뒤에서 놀고 있던 세 살 어린이를 충격하는 사고가 난 것이다. 홍길동 씨가 차에서 내려 넘어진 어린이를 일으켜 세우자, 이 모습을 본 아버지 전우치 씨가 허겁지겁 달려왔다. 언성을 높이는 전 씨에 홍 씨 또한 맞섰다.\n운전자 부주의라는 전우치 씨와 친권자도 책임이 있다는 홍길동 씨의 실랑이가 계속되고 있다.\n어린이의 친권자에게도 과실책임이 있을까?\n과실비율\n어린이를 보호하지 않은 친권자에게도 과실 인정\n어린이 보호의무를 게을리한 전우치 씨의 과실도 20~30%\n차량 통행이 빈번한 곳에 어린아이를 무단 방치한 전우치 씨의 과실이 인정된다. 세 살 정도의 어린이는 아직 사리 분별능력이 없기 때문에 사고를 미연에 방지하려면 친권자의 보호가 필요하다. 이를 간과한 채 어린이를 혼자 놀게 놔둔 친권자에게 과실이 인정된다.\nkey point\n키 작은 어린이는 더욱 주의!\n어린이보호구역\n전후좌우 살피며 천천히 운전하기\n어린이보호구역은 유치원과 초등학교 정문에서부터 300m이내의 통학로를 포함합니다. 유치원생과 초등학생이 안전하게 등하교할 수 있도록 운전자는 어린이보호구역에서 시속 30km/h 이하로 서행해야 합니다.\n꼭 알아야 할 어린이보호구역 표지판\n꿀팁\n어린이보호구역에서는 어린이가 왕!\n안전운전 요령\n어린이 행동 특성\n구석진 곳을 좋아하는 어린이들\n체구가 작은 어이들은 구석진 곳을 좋아합니다. 몸을 숙인 채 놀고 있는 아이가 없는지, 차량 운행 시 주변을 살펴야 합니다.\n놀이에 집중하는 어린이들\n어린이들은 공을 차거나 장난감을 가지고 놀면서 주변 교통상황을 살피지 못합니다. 친구들과 장난을 치면서 갑자기 도로로 진입하는 경우도 빈번합니다.\n손만 들면 차가 멈춘다고 생각하는 어린이들\n어린이들은 적색신호일지라도 횡단보도에서 손만 들면 차가 알아서 멈출 거라고 생각합니다.\n어린이들의 사각지대 살피기\n어린이보호구역 안전운전 노하우\nTip 1\n어린이보호구역에서 주정차하지 않기\n키 작은 어린이가 차량 사이에 있을 경우 발견하지 못하거나 주정차 차량 때문에 아이가 달려오는 차를 발견하지 못할 수 있으므로 차량을 세우지 않습니다.\nTip 2\n어린이 통학버스 보호의무는 기본",
    "category": "차 vs. 사람",
    "case_id": "차 vs. 사람_2"
  },
  {
    "case_visual": {
      "title": "심야에 택시 잡기 위해\n도로에 들어선 사람을 접촉,\n누구의 과실일까?",
      "description": "심야에 택시 잡기 위해\n도로에 들어선 사람을 접촉,\n누구의 과실일까?"
    },
    "title": "도로에 진입한 보행자를 접촉한 사고",
    "situation": "일을 마치고 뒤늦게 귀가하던 홍길동 씨. 상가가 몰려 있는 번화가 편도 2차선 도로를 지나고 있었다. 그때, 택시를 잡으려고 차도에 내려선 전우치 씨를 충격하는 사고가 발생했다. 전우치 씨는 택시가 잘 잡히지 않아 부득이하게 도로로 진입한 상황이었다.\n전우치 씨는 도로에 진입할 수밖에 없었고, 당시 본인 말고도 택시를 잡으려는 사람이 더 있었음에도 불구하고 자신만 접촉한 건 전방주시 태만 때문이라며 홍길동 씨의 전적인 과실을 주장했다. 또 자신이 도로에 진입할 수밖에 없는 상황을 만든 택시협회 역시 과실이 있다고 말했다. 이에 홍길동 씨는 도로에 서 있던 전우치 씨에게도 과실이 있다며 맞섰다.",
    "situation_highlight": "홍길동 씨의 주장대로 보행자인 전우치 씨의 과실도 있는 걸까?",
    "sections": {
      "section_1": {
        "type": "과실비율",
        "title": "도로로 진입한 보행자의 과실도 인정",
        "main_ratio": "피해자 전우치 씨에게도 약 20%의 과실 인정",
        "details": [
          "홍길동 씨가 야간에 택시를 잡으려고 나와 있던 전우치 씨를 발견하지 못하고 접촉했다면 전방주시를 태만한 것이므로 가해자가 된다. 하지만 전우치 씨가 도로에 2m 지점까지 진입한 상태라면 그에게도 과실이 있다. 단, 사고시각이나 보행자 음주 여부에 따라 과실은 가감될 수 있다. 또한 택시가 탑승을 거부하거나 세워 주지 않았다고 해서 택시협회에 과실을 부과하는 것은 무리가 있다."
        ],
        "additional_cases": []
      },
      "section_2": {
        "type": "key point",
        "title": "언제 어디서나 발생하는 보행자 사고",
        "subtitles": [
          "다양한 곳에서 발생하는 보행자 교통사고"
        ],
        "details": []
      },
      "section_3": {
        "type": "꿀팁",
        "title": "보행자사고 예방 운전 요령",
        "steps": [
          "Tip 1\n보행자와 차가 함께 다니는 주택가와 상가 밀집지역의 좁은 골목길에서는 서행해야 합니다.",
          "Tip 2\n차도와 보도의 구분이 없는 도로에서는 보행자 옆을 지날 때 최대한 멀리 떨어져서 운행합니다.",
          "Tip 3\n교통량이 적은 한적한 도로나 교차로 부근에서 속력을 내면 갑자기 등장한 보행자를 충돌할 위험성이 높아지니 과속운전을 하지 않습니다.",
          "Tip 4\n상황 판단이 느린 어린이나 노인을 특히 주의하고, 도로에 진입하는 취객 또한 주의합니다."
        ],
        "subtitles": [
          "안전거리 확보와 서행은 제1의 원칙!\n보행자 사고 예방 운전 요령"
        ],
        "details": []
      }
    },
    "full_content": "도로에 진입한 보행자를 접촉한 사고\n일을 마치고 뒤늦게 귀가하던 홍길동 씨. 상가가 몰려 있는 번화가 편도 2차선 도로를 지나고 있었다. 그때, 택시를 잡으려고 차도에 내려선 전우치 씨를 충격하는 사고가 발생했다. 전우치 씨는 택시가 잘 잡히지 않아 부득이하게 도로로 진입한 상황이었다.\n전우치 씨는 도로에 진입할 수밖에 없었고, 당시 본인 말고도 택시를 잡으려는 사람이 더 있었음에도 불구하고 자신만 접촉한 건 전방주시 태만 때문이라며 홍길동 씨의 전적인 과실을 주장했다. 또 자신이 도로에 진입할 수밖에 없는 상황을 만든 택시협회 역시 과실이 있다고 말했다. 이에 홍길동 씨는 도로에 서 있던 전우치 씨에게도 과실이 있다며 맞섰다.\n홍길동 씨의 주장대로 보행자인 전우치 씨의 과실도 있는 걸까?\n과실비율\n도로로 진입한 보행자의 과실도 인정\n피해자 전우치 씨에게도 약 20%의 과실 인정\n홍길동 씨가 야간에 택시를 잡으려고 나와 있던 전우치 씨를 발견하지 못하고 접촉했다면 전방주시를 태만한 것이므로 가해자가 된다. 하지만 전우치 씨가 도로에 2m 지점까지 진입한 상태라면 그에게도 과실이 있다. 단, 사고시각이나 보행자 음주 여부에 따라 과실은 가감될 수 있다. 또한 택시가 탑승을 거부하거나 세워 주지 않았다고 해서 택시협회에 과실을 부과하는 것은 무리가 있다.\nkey point\n언제 어디서나 발생하는 보행자 사고\n다양한 곳에서 발생하는 보행자 교통사고\n보행자가 보행신호로 바뀌자마자 뛰어들어 이를 미처 발견하지 못한 자동차와 충돌하는 사고\n보행신호가 끝났으나 횡단을 끝마치지 못한 보행자와 차량신호가 녹색으로 바뀌면서 급하게 출발한 자동차 간의 사고\n횡단보도를 거쳐 좌회전 또는 우회전을 하다가 뒤늦게 발견한 보행자와 충돌하는 사고\n꿀팁\n보행자사고 예방 운전 요령\n보행자의 본능과 행동 특성\n보행자는 운전자가 안전을 확보해 줄 것이라 믿습니다.\n보행자는 운전자가 항상 앞을 잘 보고 있다고 인식하고, 차량은 사람을 보면 멈춘다고 생각합니다.\n보행자는 통행량이 적거나 정체된 도로에서 무단횡단하기 쉽습니다. 우회하기를 귀찮아하고 지름길을 택합니다.\n보행자는 보행 중 갑자기 달리거나 좌우로 진로를 쉽게 바꿉니다.\n보행자는 걸으면서 스마트폰 또는 태블릿 PC 등을 사용하거나 귀에 이어폰을 꽂은 채 음악을 듣습니다.\n안전거리 확보와 서행은 제1의 원칙!\n보행자 사고 예방 운전 요령\nTip 1\n보행자와 차가 함께 다니는 주택가와 상가 밀집지역의 좁은 골목길에서는 서행해야 합니다.\nTip 2\n차도와 보도의 구분이 없는 도로에서는 보행자 옆을 지날 때 최대한 멀리 떨어져서 운행합니다.\nTip 3\n교통량이 적은 한적한 도로나 교차로 부근에서 속력을 내면 갑자기 등장한 보행자를 충돌할 위험성이 높아지니 과속운전을 하지 않습니다.\nTip 4\n상황 판단이 느린 어린이나 노인을 특히 주의하고, 도로에 진입하는 취객 또한 주의합니다.",
    "category": "차 vs. 사람",
    "case_id": "차 vs. 사람_3"
  },
  {
    "case_visual": {
      "title": "술에 취해 쓰러져 자는 사람을\n치어 사망하게 했을 경우\n과실 범위는?",
      "description": "술에 취해 쓰러져 자는 사람을\n치어 사망하게 했을 경우\n과실 범위는?"
    },
    "title": "만취한 채 차량 밑에서 잠자던 사람을 친 운전자, 과실은 어느 정도?",
    "situation": "사귀던 여자친구에게 이별을 통보받고 괴로워하던 전우치 씨. 어느 토요일 대낮에 친구들을 만나서 술을 마시기 시작했다. 평소보다 많이 마신 전우치 씨는 인사불성이 되어 길에 서 있던 트럭 뒤편, 차량의 아래로 들어가서 잠들고 말았다. 트럭 운전자 홍길동 씨가 잠시 차를 세워 두고 자리를 뜬 상황에서 벌어진 일로 홍길동 씨는 차량 아래쪽에 있던 전우치 씨를 보지 못한 채 운전대를 잡았다. 홍길동 씨는 트럭 운행을 위해 후진하던 중 전우치 씨를 치었는데, 그만 전우치 씨가 사망에 이르고 말았다.\n사망한 전우치 씨의 죽음도 억울하지만, 자신이 전혀 모르고 있던 사이에 전우치 씨가 트럭 아래에 들어갔다는 것을 안 홍길동 씨의 당황스러움과 억울함도 그에 못지 않게 크다. 전우치 씨의 죽음에 대한 책임을 묻는 유족들에게 홍길동 씨는 미안하면서도 할 말은 있었다.",
    "situation_highlight": "",
    "sections": {
      "section_1": {
        "type": "과실비율",
        "title": "만취한 채 도로에 누워 있던 보행자\n과실은 약 50%",
        "main_ratio": "도로에 누워 있는 자는 주야간 구분 없이 30~40% 과실",
        "details": [
          "도로에 누워 있는 행위는 「도로교통법」상 ‘도로에서의 금지행위’에 해당되어 그 과실 범위가 40% 정도로 책정되는 것이 통상이다.\n다만, 이 장소가 주택이나 상점가, 학교 등 사람의 통행이 빈번한 곳이라면 보행자의 과실은 10% 정도 감산되어 30% 정도로 볼 수 있다. 도로가 간선도로 등 교통량이 많고 차량 속도가 빨라 보행자의 주의가 요구되는 곳이었다면 보행자 과실은 10% 정도 가산된다.\n이 사고의 경우, 홍길동 씨가 잠시 차를 세우고 볼일을 보러 간 점을 생각해보면 주택가 도로라고 생각할 수 있어서 홍길동 씨의 과실을 기본으로 30% 정도로 볼 수 있겠다.",
          "차 밑에 있는 사람을 주의해야 할 의무는 기본적으로 운전자에게 있다. 그러나 야간이나 날씨가 안 좋은 경우 등 기타 시야 장애 시에는 운전자 과실이 10% 정도 감산된다. 즉, 보행자가 주의해야 할 의무가 10%가량 가산되는 것.\n전우치 씨의 경우 운전자가 식별하기 어려운 차 아래에 들어가 있었으므로 과실 범위를 10% 정도 더 물을 수 있다. 만일 전우치 씨가 명백히 식별 가능한 곳에 누워서 잠들었다면 운전자인 홍길동 씨의 과실이 10~20% 가산된다고 볼 수 있다.\n또한, 만취한 것 역시 과실로 볼 수 있어 보행자인 전우치 씨의 과실이 10% 정도 추가될 것으로 판단된다."
        ],
        "additional_cases": []
      },
      "section_2": {
        "type": "key point",
        "title": "알아두면 좋은 관련 교통법",
        "subtitles": [
          "「도로교통법」 제 68조 (도로에서의 금지행위 등)",
          "참고) 운전자가 음주 측정을 거부하면 어떻게 되나요?",
          "음주 측정 거부란?",
          "음주 측정 거부에 대한 처벌은?",
          "음주운전의 기준은?"
        ],
        "details": [
          "③ 누구든지 다음 각 호의 어느 하나에 해당하는 행위를 하여서는 아니 된다.\n1. 술에 취하여 도로에서 갈팡질팡하는 행위\n2. 도로에서 교통에 방해되는 방법으로 눕거나 앉거나 서있는 행위\n3. 교통이 빈번한 도로에서 공놀이 또는 썰매타기 등의 놀이를 하는 행위",
          "교통단속처리지침 제38조에 의하면 음주 측정을 요구받은 운전자가 ‘10분 간격으로 3회 측정 불응 시 측정 거부로 처리’됩니다. 측정자는 음주 측정 불응에 따른 불이익을 10분 간격으로 3회 이상 명확히 고지해야 하며, 이러한 고지에도 불구하고 측정을 거부할 경우, 즉 최초 측정 요구로부터 30분이 지나면 측정 거부자로 분류되는 것입니다. 10분 간격으로 3회, 즉 30분이라는 것은 단순히 ‘음주 측정을 할 수 없다’는 완강한 거부만을 의미하는 것이 아닙니다. ‘잠시 후에 하겠다’는 등의 핑계로 10분 이상씩 3회, 전체 30분을 지연시키는 행위도 포함된다는 것을 의미합니다.",
          "음주 측정을 거부한 사람은 「도로교통법」 제148조의2 제2항에 따라 3년 이하의 징역이나 1,000만원 이하의 벌금형을 받을 수 있으며, 이는 운전면허 정지나 취소의 사유가 됩니다.",
          "혈중 알코올 농도 0.03% 이상. 0.08% 이상이면 면허가 취소되며, 0.2% 이상이면 구속될 수 있다."
        ]
      }
    },
    "full_content": "만취한 채 차량 밑에서 잠자던 사람을 친 운전자, 과실은 어느 정도?\n사귀던 여자친구에게 이별을 통보받고 괴로워하던 전우치 씨. 어느 토요일 대낮에 친구들을 만나서 술을 마시기 시작했다. 평소보다 많이 마신 전우치 씨는 인사불성이 되어 길에 서 있던 트럭 뒤편, 차량의 아래로 들어가서 잠들고 말았다. 트럭 운전자 홍길동 씨가 잠시 차를 세워 두고 자리를 뜬 상황에서 벌어진 일로 홍길동 씨는 차량 아래쪽에 있던 전우치 씨를 보지 못한 채 운전대를 잡았다. 홍길동 씨는 트럭 운행을 위해 후진하던 중 전우치 씨를 치었는데, 그만 전우치 씨가 사망에 이르고 말았다.\n사망한 전우치 씨의 죽음도 억울하지만, 자신이 전혀 모르고 있던 사이에 전우치 씨가 트럭 아래에 들어갔다는 것을 안 홍길동 씨의 당황스러움과 억울함도 그에 못지 않게 크다. 전우치 씨의 죽음에 대한 책임을 묻는 유족들에게 홍길동 씨는 미안하면서도 할 말은 있었다.\n과실비율\n만취한 채 도로에 누워 있던 보행자\n과실은 약 50%\n도로에 누워 있는 자는 주야간 구분 없이 30~40% 과실\n도로에 누워 있는 행위는 「도로교통법」상 ‘도로에서의 금지행위’에 해당되어 그 과실 범위가 40% 정도로 책정되는 것이 통상이다.\n다만, 이 장소가 주택이나 상점가, 학교 등 사람의 통행이 빈번한 곳이라면 보행자의 과실은 10% 정도 감산되어 30% 정도로 볼 수 있다. 도로가 간선도로 등 교통량이 많고 차량 속도가 빨라 보행자의 주의가 요구되는 곳이었다면 보행자 과실은 10% 정도 가산된다.\n이 사고의 경우, 홍길동 씨가 잠시 차를 세우고 볼일을 보러 간 점을 생각해보면 주택가 도로라고 생각할 수 있어서 홍길동 씨의 과실을 기본으로 30% 정도로 볼 수 있겠다.\n보행자의 부주의에 의한 가산 20%\n차 밑에 있는 사람을 주의해야 할 의무는 기본적으로 운전자에게 있다. 그러나 야간이나 날씨가 안 좋은 경우 등 기타 시야 장애 시에는 운전자 과실이 10% 정도 감산된다. 즉, 보행자가 주의해야 할 의무가 10%가량 가산되는 것.\n전우치 씨의 경우 운전자가 식별하기 어려운 차 아래에 들어가 있었으므로 과실 범위를 10% 정도 더 물을 수 있다. 만일 전우치 씨가 명백히 식별 가능한 곳에 누워서 잠들었다면 운전자인 홍길동 씨의 과실이 10~20% 가산된다고 볼 수 있다.\n또한, 만취한 것 역시 과실로 볼 수 있어 보행자인 전우치 씨의 과실이 10% 정도 추가될 것으로 판단된다.\nkey point\n알아두면 좋은 관련 교통법\n「도로교통법」 제 68조 (도로에서의 금지행위 등)\n③ 누구든지 다음 각 호의 어느 하나에 해당하는 행위를 하여서는 아니 된다.\n1. 술에 취하여 도로에서 갈팡질팡하는 행위\n2. 도로에서 교통에 방해되는 방법으로 눕거나 앉거나 서있는 행위\n3. 교통이 빈번한 도로에서 공놀이 또는 썰매타기 등의 놀이를 하는 행위\n참고) 운전자가 음주 측정을 거부하면 어떻게 되나요?\n음주 측정 거부란?\n교통단속처리지침 제38조에 의하면 음주 측정을 요구받은 운전자가 ‘10분 간격으로 3회 측정 불응 시 측정 거부로 처리’됩니다. 측정자는 음주 측정 불응에 따른 불이익을 10분 간격으로 3회 이상 명확히 고지해야 하며, 이러한 고지에도 불구하고 측정을 거부할 경우, 즉 최초 측정 요구로부터 30분이 지나면 측정 거부자로 분류되는 것입니다. 10분 간격으로 3회, 즉 30분이라는 것은 단순히 ‘음주 측정을 할 수 없다’는 완강한 거부만을 의미하는 것이 아닙니다. ‘잠시 후에 하겠다’는 등의 핑계로 10분 이상씩 3회, 전체 30분을 지연시키는 행위도 포함된다는 것을 의미합니다.\n음주 측정 거부에 대한 처벌은?\n음주 측정을 거부한 사람은 「도로교통법」 제148조의2 제2항에 따라 3년 이하의 징역이나 1,000만원 이하의 벌금형을 받을 수 있으며, 이는 운전면허 정지나 취소의 사유가 됩니다.\n음주운전의 기준은?\n혈중 알코올 농도 0.03% 이상. 0.08% 이상이면 면허가 취소되며, 0.2% 이상이면 구속될 수 있다.",
    "category": "차 vs. 사람",
    "case_id": "차 vs. 사람_4"
  },
  {
    "case_visual": {
      "title": "야간에 보행금지구역에서\n무단횡단자와 부딪히면\n과실 범위는?",
      "description": "야간에 보행금지구역에서\n무단횡단자와 부딪히면\n과실 범위는?"
    },
    "title": "늦은 밤 강변북로에서의 무단횡단 교통사고",
    "situation": "계속된 야근으로 심신이 지친 홍길동 씨. 집으로 돌아가기 위해 강변북로에 접어든 시간은 밤 10시를 조금 넘었다. '집에 돌아가서 어서 샤워하고 침대에 누워야지’ 생각하며 운전대를 살짝 움켜쥔 순간 도로에서 차도로 들어오는 시커먼 그림자! 홍길동 씨는 급히 브레이크를 밟았다. 하지만 쿵 하고 부딪히는 느낌이 나면서 차 앞으로 검은 그림자가 쓰러졌다. 홍길동 씨는 서둘러 차에서 내렸다. “아이고!” 신음을 내면서 주저앉아 있는 검은 그림자는 술에 취해 무단으로 도로를 건너고 있던 전우치 씨. 홍 씨는 전 씨를 부축해 일으키면서 다친 곳은 없는지 확인을 먼저 했다. 술 냄새가 홍 씨의 콧속으로 확 번져 들어왔다. 다행히 전 씨는 크게 다친 곳은 없어 보였다. 정신을 차린 전 씨는 노발대발 소리부터 지른다. \"당신! 사람을 쳤어. 어떻게 할 거야? 병원비와 피해보상금 다 물어내야 할 거야!!!” 홍 씨는 갑자기 차도로 뛰어든 전 씨보다 더 억울한 것은 자신이라는 생각이 들었다. \"갑자기 차도로 뛰어드시면 어떻게 해요. 무단횡단하셨잖아요.”라고 따졌다.",
    "situation_highlight": "술에 취한 무단횡단자와 자동차전용도로의 운전자, 누구의 과실이 더 클까?",
    "sections": {
      "section_1": {
        "type": "과실비율",
        "title": "야간에 보행금지구역에서 무단횡단을 한\n전우치 씨 과실",
        "main_ratio": "보행금지구역의 무단횡단 사고는 보행자 과실",
        "details": [
          "일반적으로 '무단횡단을 해도 과실책임은 운전자에게 있다'고 알려졌고, 정황상 운전자의 과실이 큰 경우가 많다. 하지만 홍길동 씨와 전우치 씨의 사건은 '과실책임은 전우치 씨에게 있는 것'으로 볼 수 있다. 우선 자동차전용도로 등 보행금지구역에서는 운전자가 보행자가 나타날 것을 대비해서 운전해야 할 의무가 없기 때문이다. 또한, 야간이어서 운전자가 전방을 주시하기 힘든 상황이었던 점, 보행자가 술에 취해 부주의했음이 명백한 점, 보행이 금지된 구역이었던 점 등이 운전자보다는 보행자의 과실책임범위가 큰 것을 입증하는 사실들이다.",
          "무단횡단이라 하더라도 일반적으로 보행자의 과실은 적게 묻는 편이다. 하지만 보행자의 과실이 있다고 보는 몇 가지 경우가 있는데, 다음과 같은 경우가 이에 해당한다고 볼 수 있다.\n보행자가 보행신호를 위반한 경우의 사고는 보행자와 운전자 반반의 과실로 보는 경우가 많다. 신호를 준수해야 하는 기본 원칙을 어긴 보행자에게 과실에 대한 책임을 지게 하는 것이다. 다만, 보행신호가 아닌 원칙(보행자의 우측통행 등)에 대해서는 10~20%로 과실 범위가 다소 좁혀지기도 한다.\n또한, 자동차전용도로의 무단횡단사고에서도 보행자의 과실을 더 크게 본다. 2010년 수원지법은 고속도로에서 무단횡단을 한 보행자를 친 화물차에 '운전자의 과실이 없다'는 판결을 내린 사례가 있다.",
          "기본적으로 운전자는 전방을 주시하고 주의해야 할 의무가 있다. 일반적으로 주간에 운전자가 전방주시를 소홀히 한 경우 70% 가까이 운전자의 과실을 묻는다. 이런 경우의 교통사고는 운전자가 전방주시를 잘하면 사고를 방지할 수 있는 경우가 대부분이기 때문이다.\n하지만 야간이나 비, 눈으로 인해 운전자가 시야를 확보하기 힘든 상황에서는 보행자가 더 주의해야 하는 것으로 본다. 운전자가 아무리 주의를 한다 해도 전방을 명확하게 관찰하기는 한계가 있기 때문이다. 이런 상황에서 교통사고가 나면 보행자 쪽에 약 10%의 과실책임이 가산된다.",
          "일반적으로 보행자의 부주의가 확실한 경우에도 20%에서 그 이상으로 보행자의 과실이 가산된다. 대표적인 예가 음주라고 할 수 있는데, 2011년 5월 울산지방법원은 술에 취해 무단횡단을 하다 택시에 치인 보행자에게 '보행자과실 60%’라는 판결을 내린 사례가 있다.\n반대로 운전자의 부주의가 확실한 경우는 운전자 과실을 피할 수 없다. 운전자가 과속한 경우 운전자 과실을 통상 20% 정도로 본다. 과속 자체가 과실이며 과속으로 인한 추가 피해까지 고려될 수도 있기 때문이다."
        ],
        "additional_cases": []
      },
      "section_2": {
        "type": "꿀팁",
        "title": "교통사고 시 목격자 확보 방법",
        "steps": [
          "Tip 1\n목격자는 사고 상황을 목격한 사람과 사고 직후의 상황을 목격한 사람으로 나뉘는데, 사고 상황을 목격한 사람을 확보하는 것이 더 적절합니다.",
          "Tip 2\n사고 즉시 상황을 지켜본 목격자를 확보하며 정중히 연락처를 확보해야 합니다.",
          "Tip 3\n사고 직후 진술을 받을 수 있도록 조치해야 합니다. 사고를 목격한 목격자는 대부분 적극적으로 진술에 참여해 주지만 시간이 지날수록 여러 가지 이유가 생겨 참여가 어려운 경우도 있고, 기억도 흐려질 수 있습니다. 사법기관 역시 시간이 지날수록 목격자의 진술에 신빙성이 떨어진다고 믿고 있습니다.",
          "Tip 4\n사고 직후 진술이 어렵다면, 목격자의 신원(연락처, 이름 등)을 확보한 후 경찰서에 전화해서 통화로 간단히 진술을 하도록 합니다.",
          "Tip 5\n목격자를 확보할 수 없다면, 사고 상황의 물리적 증거물들을 최대한 확보해서 사진 등 기록으로 남겨 둡니다."
        ],
        "subtitles": [],
        "details": []
      }
    },
    "full_content": "늦은 밤 강변북로에서의 무단횡단 교통사고\n계속된 야근으로 심신이 지친 홍길동 씨. 집으로 돌아가기 위해 강변북로에 접어든 시간은 밤 10시를 조금 넘었다. '집에 돌아가서 어서 샤워하고 침대에 누워야지’ 생각하며 운전대를 살짝 움켜쥔 순간 도로에서 차도로 들어오는 시커먼 그림자! 홍길동 씨는 급히 브레이크를 밟았다. 하지만 쿵 하고 부딪히는 느낌이 나면서 차 앞으로 검은 그림자가 쓰러졌다. 홍길동 씨는 서둘러 차에서 내렸다. “아이고!” 신음을 내면서 주저앉아 있는 검은 그림자는 술에 취해 무단으로 도로를 건너고 있던 전우치 씨. 홍 씨는 전 씨를 부축해 일으키면서 다친 곳은 없는지 확인을 먼저 했다. 술 냄새가 홍 씨의 콧속으로 확 번져 들어왔다. 다행히 전 씨는 크게 다친 곳은 없어 보였다. 정신을 차린 전 씨는 노발대발 소리부터 지른다. \"당신! 사람을 쳤어. 어떻게 할 거야? 병원비와 피해보상금 다 물어내야 할 거야!!!” 홍 씨는 갑자기 차도로 뛰어든 전 씨보다 더 억울한 것은 자신이라는 생각이 들었다. \"갑자기 차도로 뛰어드시면 어떻게 해요. 무단횡단하셨잖아요.”라고 따졌다.\n술에 취한 무단횡단자와 자동차전용도로의 운전자, 누구의 과실이 더 클까?\n과실비율\n야간에 보행금지구역에서 무단횡단을 한\n전우치 씨 과실\n일반적으로 '무단횡단을 해도 과실책임은 운전자에게 있다'고 알려졌고, 정황상 운전자의 과실이 큰 경우가 많다. 하지만 홍길동 씨와 전우치 씨의 사건은 '과실책임은 전우치 씨에게 있는 것'으로 볼 수 있다. 우선 자동차전용도로 등 보행금지구역에서는 운전자가 보행자가 나타날 것을 대비해서 운전해야 할 의무가 없기 때문이다. 또한, 야간이어서 운전자가 전방을 주시하기 힘든 상황이었던 점, 보행자가 술에 취해 부주의했음이 명백한 점, 보행이 금지된 구역이었던 점 등이 운전자보다는 보행자의 과실책임범위가 큰 것을 입증하는 사실들이다.\n보행금지구역의 무단횡단 사고는 보행자 과실\n무단횡단이라 하더라도 일반적으로 보행자의 과실은 적게 묻는 편이다. 하지만 보행자의 과실이 있다고 보는 몇 가지 경우가 있는데, 다음과 같은 경우가 이에 해당한다고 볼 수 있다.\n보행자가 보행신호를 위반한 경우의 사고는 보행자와 운전자 반반의 과실로 보는 경우가 많다. 신호를 준수해야 하는 기본 원칙을 어긴 보행자에게 과실에 대한 책임을 지게 하는 것이다. 다만, 보행신호가 아닌 원칙(보행자의 우측통행 등)에 대해서는 10~20%로 과실 범위가 다소 좁혀지기도 한다.\n또한, 자동차전용도로의 무단횡단사고에서도 보행자의 과실을 더 크게 본다. 2010년 수원지법은 고속도로에서 무단횡단을 한 보행자를 친 화물차에 '운전자의 과실이 없다'는 판결을 내린 사례가 있다.\n운전자가 앞을 볼 수 없는 상황에서는 보행자의 과실 가산\n기본적으로 운전자는 전방을 주시하고 주의해야 할 의무가 있다. 일반적으로 주간에 운전자가 전방주시를 소홀히 한 경우 70% 가까이 운전자의 과실을 묻는다. 이런 경우의 교통사고는 운전자가 전방주시를 잘하면 사고를 방지할 수 있는 경우가 대부분이기 때문이다.\n하지만 야간이나 비, 눈으로 인해 운전자가 시야를 확보하기 힘든 상황에서는 보행자가 더 주의해야 하는 것으로 본다. 운전자가 아무리 주의를 한다 해도 전방을 명확하게 관찰하기는 한계가 있기 때문이다. 이런 상황에서 교통사고가 나면 보행자 쪽에 약 10%의 과실책임이 가산된다.\n음주한 보행자, 과실은 보행자에게!\n일반적으로 보행자의 부주의가 확실한 경우에도 20%에서 그 이상으로 보행자의 과실이 가산된다. 대표적인 예가 음주라고 할 수 있는데, 2011년 5월 울산지방법원은 술에 취해 무단횡단을 하다 택시에 치인 보행자에게 '보행자과실 60%’라는 판결을 내린 사례가 있다.\n반대로 운전자의 부주의가 확실한 경우는 운전자 과실을 피할 수 없다. 운전자가 과속한 경우 운전자 과실을 통상 20% 정도로 본다. 과속 자체가 과실이며 과속으로 인한 추가 피해까지 고려될 수도 있기 때문이다.\n꿀팁\n교통사고 시 목격자 확보 방법\nTip 1\n목격자는 사고 상황을 목격한 사람과 사고 직후의 상황을 목격한 사람으로 나뉘는데, 사고 상황을 목격한 사람을 확보하는 것이 더 적절합니다.\nTip 2\n사고 즉시 상황을 지켜본 목격자를 확보하며 정중히 연락처를 확보해야 합니다.\nTip 3\n사고 직후 진술을 받을 수 있도록 조치해야 합니다. 사고를 목격한 목격자는 대부분 적극적으로 진술에 참여해 주지만 시간이 지날수록 여러 가지 이유가 생겨 참여가 어려운 경우도 있고, 기억도 흐려질 수 있습니다. 사법기관 역시 시간이 지날수록 목격자의 진술에 신빙성이 떨어진다고 믿고 있습니다.\nTip 4\n사고 직후 진술이 어렵다면, 목격자의 신원(연락처, 이름 등)을 확보한 후 경찰서에 전화해서 통화로 간단히 진술을 하도록 합니다.\nTip 5\n목격자를 확보할 수 없다면, 사고 상황의 물리적 증거물들을 최대한 확보해서 사진 등 기록으로 남겨 둡니다.",
    "category": "차 vs. 사람",
    "case_id": "차 vs. 사람_5"
  },
  {
    "case_visual": {
      "title": "아이가 차에서 내리자마자\n횡단보도를 건너다 사고가 나면\n과실 범위는?",
      "description": "아이가 차에서 내리자마자\n횡단보도를 건너다 사고가 나면\n과실 범위는?"
    },
    "title": "신호등이 없는 횡단보도에서 갑자기 차에서 뛰어나온 보행자의 사고",
    "situation": "평일 오후, 쇼핑을 마치고 집으로 돌아가던 홍길동 씨는 신호등이 없는 편도 2차선 도로를 달리고 있었다. 횡단보도를 막 지나치려는 찰나, 횡단보도가 시작하는 쪽에 정차해 있던 차량의 문이 열리면서 한 여성이 횡단보도를 향해 뛰기 시작했다. 홍길동 씨는 차를 세우려고 시도했으나 이미 너무 늦어 길을 건너던 보행자를 치고 말았다.\n바로 직전, 전우치 씨는 학원에 가는 딸 전향단 양을 학원 길 건너편에 내려주러 차를 세웠다. 전향단 양이 차에 내려서 바로 길을 건너기 편하게 하려고 횡단보도에 잠시 정차했다. 인사를 마친 딸이 차 문을 열고 내리자마자 들려온 굉음. 전향단 양을 보지 못한 홍길동 씨의 차에 딸이 치이고 마는 사고가 발생한 것이다.",
    "situation_highlight": "",
    "sections": {
      "section_1": {
        "type": "과실비율",
        "title": "횡단보도에서 일어난 사고인 것으로 봐서\n운전자 과실이 클 것으로 판단",
        "main_ratio": "횡단보도에 정차한 차에서 내린 보행자는 횡단보도 보행자로 판단할 수 있음",
        "details": [
          "차에서 갑자기 뛰어나온 사람이어도 횡단보도로 길을 건넜기 때문에 횡단보도에서 일어난 교통사고로 볼 수 있겠다. 통상, 신호등이 없는 횡단보도에서 사고가 일어날 경우 운전자 과실이 80%, 교통 상황을 살피지 않은 보행자 과실을 20%로 볼 수 있다. 편도 2차로인 점을 감안하면 5%가량 보행자 과실이 더해질 수 있다. 단, 운전자가 과속한 경우는 운전자 과실이 5~10% 가산될 수 있다.",
          "사고를 당한 전향단 양이 6세 이하 유아라면 자녀를 길거리에 방치한 전우치 씨는 10~30% 과실을 추가로 지게 된다. 신호가 없는 곳에서 발생한 무단횡단 사고에 대한 통상의 과실책임 약 25%에서 유아 방치에 대한 책임까지, 35~55%의 과실책임을 물을 수도 있는 것.\n다만 6세 이상 어린이라면 운전자 부주의를 물어 운전자에게 5%가량의 과실책임이 가산될 수 있다. 어린이나 노인의 경우 운전자의 과실을 묻는 것이 보호자의 방치에 대한 책임보다 우선이다."
        ],
        "additional_cases": []
      },
      "section_2": {
        "type": "key point",
        "title": "알아두면 좋은 관련 교통법",
        "subtitles": [
          "「도로교통법」 제11조 (어린이 등에 대한 보호)"
        ],
        "details": [
          "① 어린이의 보호자는 교통이 빈번한 도로에서 어린이를 놀게 하여서는 아니 되며, 영유아(6세 미만인 사람을 말한다)의 보호자는 교통이 빈번한 도로에서 영유아가 혼자 보행하게 하여서는 아니 된다."
        ]
      }
    },
    "full_content": "신호등이 없는 횡단보도에서 갑자기 차에서 뛰어나온 보행자의 사고\n평일 오후, 쇼핑을 마치고 집으로 돌아가던 홍길동 씨는 신호등이 없는 편도 2차선 도로를 달리고 있었다. 횡단보도를 막 지나치려는 찰나, 횡단보도가 시작하는 쪽에 정차해 있던 차량의 문이 열리면서 한 여성이 횡단보도를 향해 뛰기 시작했다. 홍길동 씨는 차를 세우려고 시도했으나 이미 너무 늦어 길을 건너던 보행자를 치고 말았다.\n바로 직전, 전우치 씨는 학원에 가는 딸 전향단 양을 학원 길 건너편에 내려주러 차를 세웠다. 전향단 양이 차에 내려서 바로 길을 건너기 편하게 하려고 횡단보도에 잠시 정차했다. 인사를 마친 딸이 차 문을 열고 내리자마자 들려온 굉음. 전향단 양을 보지 못한 홍길동 씨의 차에 딸이 치이고 마는 사고가 발생한 것이다.\n과실비율\n횡단보도에서 일어난 사고인 것으로 봐서\n운전자 과실이 클 것으로 판단\n횡단보도에 정차한 차에서 내린 보행자는 횡단보도 보행자로 판단할 수 있음\n차에서 갑자기 뛰어나온 사람이어도 횡단보도로 길을 건넜기 때문에 횡단보도에서 일어난 교통사고로 볼 수 있겠다. 통상, 신호등이 없는 횡단보도에서 사고가 일어날 경우 운전자 과실이 80%, 교통 상황을 살피지 않은 보행자 과실을 20%로 볼 수 있다. 편도 2차로인 점을 감안하면 5%가량 보행자 과실이 더해질 수 있다. 단, 운전자가 과속한 경우는 운전자 과실이 5~10% 가산될 수 있다.\n전향단 양이 유아라면 전우치 씨 과실 10~30% 가산\n사고를 당한 전향단 양이 6세 이하 유아라면 자녀를 길거리에 방치한 전우치 씨는 10~30% 과실을 추가로 지게 된다. 신호가 없는 곳에서 발생한 무단횡단 사고에 대한 통상의 과실책임 약 25%에서 유아 방치에 대한 책임까지, 35~55%의 과실책임을 물을 수도 있는 것.\n다만 6세 이상 어린이라면 운전자 부주의를 물어 운전자에게 5%가량의 과실책임이 가산될 수 있다. 어린이나 노인의 경우 운전자의 과실을 묻는 것이 보호자의 방치에 대한 책임보다 우선이다.\nkey point\n알아두면 좋은 관련 교통법\n「도로교통법」 제11조 (어린이 등에 대한 보호)\n① 어린이의 보호자는 교통이 빈번한 도로에서 어린이를 놀게 하여서는 아니 되며, 영유아(6세 미만인 사람을 말한다)의 보호자는 교통이 빈번한 도로에서 영유아가 혼자 보행하게 하여서는 아니 된다.",
    "category": "차 vs. 사람",
    "case_id": "차 vs. 사람_6"
  },
  {
    "case_visual": {
      "title": "차량신호기와 횡단보도 없는\n도로에서 일어난 사고의\n과실 범위는?",
      "description": "차량신호기와 횡단보도 없는\n도로에서 일어난 사고의\n과실 범위는?"
    },
    "title": "없어진 횡단보도를 건너던 보행자 사고",
    "situation": "도로에서 운전 중이던 전우치 씨, 지하철 공사가 한창인 도로를 지나치게 되었다. 횡단보도가 없는 곳이라 특별히 긴장하지 않고 운전하던 중 길을 건너던 홍길동 씨를 치고 말았다. 깜짝 놀란 전우치 씨, 우선 홍길동 씨를 부축해서 부상 여부를 먼저 살펴보려고 했는데 화가 난 홍길동 씨의 항의가 이만저만이 아니다.\n“횡단보도인데 주의도 하지 않고 운전을 하면 어떡합니까?”\n“예? 횡단보도라고요? 무슨 말씀이세요? 무단횡단 하셨잖아요!”\n분명히 횡단보도가 아닌 것으로 인식하고 운전을 한 전우치 씨는 홍길동 씨의 말에 깜짝 놀라서 사고 현장을 다시 살펴보았다.\n홍길동 씨가 길을 건넌 곳은 예전에 횡단보도가 있었던 자리일 뿐, 현재는 지하철 공사로 인해 횡단보도가 없어졌고, 횡단보도임을 알리는 신호체계도 없는 상태다.",
    "situation_highlight": "무단횡단 사고와 횡단보도상의 사고,\n어느 쪽 사고 일까?",
    "sections": {
      "section_1": {
        "type": "과실비율",
        "title": "없어진 횡단보도 보행은 무단횡단 과실로 판단\n20~30% 보행자 과실",
        "main_ratio": "통상 도로에서의 무단횡단자 과실은 20%가량",
        "details": [
          "사고가 일어난 장소는 도로상 횡단보도 표기와 신호체계가 없으므로, 과거에 횡단보도가 있던 곳이라 해도 현재는 횡단보도가 아닌 곳으로 볼 수 있다. 따라서 일반도로에서 일어난 무단횡단 사고로 판단할 수 있겠다.\n일반적으로 도로에서 보행자가 무단횡단을 한 경우 20%의 과실 책임을 묻는 것을 기본으로 볼 수 있다. 여기에 횡단 금지 표기나 기타 상황에 따라 보행자의 과실이 가감된다.\n만약 공사중인 현장에 횡단을 금지하는 표지판이 있었다면 10% 보행자 과실이 가산된다. 하지만 홍길동 씨가 횡단보도로 건넜음을 주장하는 정황으로 보아 횡단 금지 표지판은 없던 것으로 볼 수 있겠다.",
          "횡단보도가 아닌 도로를 건너는 보행자에게 묻는 과실은 ‘안전에 대한 주의’도 포함하고 있다. 넓은 도로일수록 더 조심해야 하는 책임을 물을 수 있기 때문에 도로가 넓어질수록 보행자 과실은 추가되는데, 통상 편도 1차로씩 넓어질 때마다 5%의 과실을 더 묻는다.\n지하철 공사가 가능한 도로라면 편도 3차로 이상일 경우로 볼 수 있으니, 홍길동 씨의 과실은 기본 20%에서 약 10~15% 더 추가될 것으로 예상할 수 있다."
        ],
        "additional_cases": []
      },
      "section_2": {
        "type": "key point",
        "title": "알아두면 좋은 관련 교통법",
        "subtitles": [
          "「도로교통법」 제10조 (도로의 횡단)",
          "「도로교통법」 제27조 (보행자의 보호)"
        ],
        "details": [
          "① 시·도경찰청장은 도로를 횡단하는 보행자의 안전을 위하여 행정안전부령이 정하는 기준에 따라 횡단보도를 설치할 수 있다.",
          "② 보행자는 제1항에 따른 횡단보도, 지하도, 육교나 그 밖의 도로 횡단시설이 설치되어 있는 도로에서는 그 곳으로 횡단하여야 한다. 다만, 지하도 또는 육교 등의 도로 횡단시설을 이용할 수 없는 지체장애인의 경우에는 다른 교통에 방해가 되지 아니하는 방법으로 도로 횡단시설을 이용하지 아니하고 도로를 횡단할 수 있다.",
          "③ 보행자는 제1항에 따른 횡단보도가 설치되어 있지 아니한 도로에서는 가장 짧은 거리로 횡단하여야 한다.",
          "④ 보행자는 차와 노면전차의 바로 앞이나 뒤로 횡단하여서는 아니 된다. 다만, 횡단보도를 횡단하거나 신호기 또는 경찰공무원 등의 신호나 지시에 따라 도로를 횡단하는 경우에는 그러하지 아니하다.",
          "⑤ 보행자는 안전표지 등에 의하여 횡단이 금지되어 있는 도로의 부분에서는 그 도로를 횡단하여서는 아니 된다.",
          "③ 모든 차의 운전자는 교통정리를 하고 있지 아니하는 교차로 또는 그 부근의 도로를 횡단하는 보행자의 통행을 방해하여서는 아니 된다."
        ]
      }
    },
    "full_content": "없어진 횡단보도를 건너던 보행자 사고\n도로에서 운전 중이던 전우치 씨, 지하철 공사가 한창인 도로를 지나치게 되었다. 횡단보도가 없는 곳이라 특별히 긴장하지 않고 운전하던 중 길을 건너던 홍길동 씨를 치고 말았다. 깜짝 놀란 전우치 씨, 우선 홍길동 씨를 부축해서 부상 여부를 먼저 살펴보려고 했는데 화가 난 홍길동 씨의 항의가 이만저만이 아니다.\n“횡단보도인데 주의도 하지 않고 운전을 하면 어떡합니까?”\n“예? 횡단보도라고요? 무슨 말씀이세요? 무단횡단 하셨잖아요!”\n분명히 횡단보도가 아닌 것으로 인식하고 운전을 한 전우치 씨는 홍길동 씨의 말에 깜짝 놀라서 사고 현장을 다시 살펴보았다.\n홍길동 씨가 길을 건넌 곳은 예전에 횡단보도가 있었던 자리일 뿐, 현재는 지하철 공사로 인해 횡단보도가 없어졌고, 횡단보도임을 알리는 신호체계도 없는 상태다.\n무단횡단 사고와 횡단보도상의 사고,\n어느 쪽 사고 일까?\n과실비율\n없어진 횡단보도 보행은 무단횡단 과실로 판단\n20~30% 보행자 과실\n통상 도로에서의 무단횡단자 과실은 20%가량\n사고가 일어난 장소는 도로상 횡단보도 표기와 신호체계가 없으므로, 과거에 횡단보도가 있던 곳이라 해도 현재는 횡단보도가 아닌 곳으로 볼 수 있다. 따라서 일반도로에서 일어난 무단횡단 사고로 판단할 수 있겠다.\n일반적으로 도로에서 보행자가 무단횡단을 한 경우 20%의 과실 책임을 묻는 것을 기본으로 볼 수 있다. 여기에 횡단 금지 표기나 기타 상황에 따라 보행자의 과실이 가감된다.\n만약 공사중인 현장에 횡단을 금지하는 표지판이 있었다면 10% 보행자 과실이 가산된다. 하지만 홍길동 씨가 횡단보도로 건넜음을 주장하는 정황으로 보아 횡단 금지 표지판은 없던 것으로 볼 수 있겠다.\n간선도로인 경우 보행자 과실 가산 가능\n횡단보도가 아닌 도로를 건너는 보행자에게 묻는 과실은 ‘안전에 대한 주의’도 포함하고 있다. 넓은 도로일수록 더 조심해야 하는 책임을 물을 수 있기 때문에 도로가 넓어질수록 보행자 과실은 추가되는데, 통상 편도 1차로씩 넓어질 때마다 5%의 과실을 더 묻는다.\n지하철 공사가 가능한 도로라면 편도 3차로 이상일 경우로 볼 수 있으니, 홍길동 씨의 과실은 기본 20%에서 약 10~15% 더 추가될 것으로 예상할 수 있다.\nkey point\n알아두면 좋은 관련 교통법\n「도로교통법」 제10조 (도로의 횡단)\n① 시·도경찰청장은 도로를 횡단하는 보행자의 안전을 위하여 행정안전부령이 정하는 기준에 따라 횡단보도를 설치할 수 있다.\n② 보행자는 제1항에 따른 횡단보도, 지하도, 육교나 그 밖의 도로 횡단시설이 설치되어 있는 도로에서는 그 곳으로 횡단하여야 한다. 다만, 지하도 또는 육교 등의 도로 횡단시설을 이용할 수 없는 지체장애인의 경우에는 다른 교통에 방해가 되지 아니하는 방법으로 도로 횡단시설을 이용하지 아니하고 도로를 횡단할 수 있다.\n③ 보행자는 제1항에 따른 횡단보도가 설치되어 있지 아니한 도로에서는 가장 짧은 거리로 횡단하여야 한다.\n④ 보행자는 차와 노면전차의 바로 앞이나 뒤로 횡단하여서는 아니 된다. 다만, 횡단보도를 횡단하거나 신호기 또는 경찰공무원 등의 신호나 지시에 따라 도로를 횡단하는 경우에는 그러하지 아니하다.\n⑤ 보행자는 안전표지 등에 의하여 횡단이 금지되어 있는 도로의 부분에서는 그 도로를 횡단하여서는 아니 된다.\n「도로교통법」 제27조 (보행자의 보호)\n③ 모든 차의 운전자는 교통정리를 하고 있지 아니하는 교차로 또는 그 부근의 도로를 횡단하는 보행자의 통행을 방해하여서는 아니 된다.",
    "category": "차 vs. 사람",
    "case_id": "차 vs. 사람_7"
  },
  {
    "case_visual": {
      "title": "야간에 횡단보도를 건너던\n만취 보행자, 차와 충돌한 경우 과실 범위는?",
      "description": "야간에 횡단보도를 건너던\n만취 보행자, 차와 충돌한 경우 과실 범위는?"
    },
    "title": "술 취해 횡단보도를 건너던 중 발생한 사고",
    "situation": "오늘도 사무실에서 잔뜩 스트레스를 받은 홍길동 씨는 종종 그렇듯 퇴근길에 동료들과 술을 마셨다. 상사 욕도 하고 거래처 업무에 대한 하소연도 하고, 이야기를 나누다 보니 거나하게 취한 채로 귀가하게 되었다. 버스를 타기 위해 횡단보도를 건너던 홍길동 씨, 길을 막 건너기 시작한 찰나, 왼쪽에서 횡단보도를 향해 달려오다 급정거한 전우치 씨의 차량에 부딪혀 큰 부상을 당하고 말았다.\n홍길동 씨가 건너던 횡단보도는 신호등이 없는 횡단보도로, 전우치 씨는 운전자인 자신의 과실을 인정하지만 만취한 홍길동 씨가 자신의 차량을 보지 못한 것도 일부 과실이 있는 것 아니냐며 문제를 제기했다.",
    "situation_highlight": "술에 취해 횡단보도를 건너던 홍길동 씨,\n과실이 있을까 없을까?",
    "sections": {
      "section_1": {
        "type": "과실비율",
        "title": "야간, 신호등 없는 횡단보도, 만취한 보행자의 과실 약 20%",
        "main_ratio": "만취 상태로 신호등 없는 횡단보도를 건넌 보행자 과실 10%",
        "details": [
          "신호등 없는 횡단보도에서 만취한 보행자가 길을 건너다 발생한 사고에 대해서는 보행자의 과실도 약 10%로 본다. 술 취한 보행자가 부주의할 수 있다는 것에 대한 과실을 묻는 것이다.",
          "또한 사고 발생 시점이 야간이므로 운전자가 앞을 살피기 힘든 정황임을 감안하면 보행자 과실이 15% 정도 가산된다."
        ],
        "additional_cases": []
      },
      "section_2": {
        "type": "꿀팁",
        "title": "유사한 상황, 다른 판단",
        "steps": [],
        "subtitles": [],
        "details": []
      },
      "section_3": {
        "type": "key point",
        "title": "횡단보도 통행, 알아두면 좋은 교통법",
        "subtitles": [
          "「도로교통법」 제27조 (보행자의 보호)"
        ],
        "details": [
          "① 모든 차 또는 노면전차의 운전자는 보행자가 횡단보도를 통행하고 있거나 통행하려고 하는 때에는 보행자의 횡단을 방해하거나 위험을 주지 아니하도록 그 횡단보도 앞(정지선이 설치되어 있는 곳에서는 그 정지선을 말한다)에서 일시정지하여야 한다.",
          "③ 모든 차의 운전자는 교통정리를 하고 있지 아니하는 교차로 또는 그 부근의 도로를 횡단하는 보행자의 통행을 방해하여서는 아니 된다."
        ]
      }
    },
    "full_content": "술 취해 횡단보도를 건너던 중 발생한 사고\n오늘도 사무실에서 잔뜩 스트레스를 받은 홍길동 씨는 종종 그렇듯 퇴근길에 동료들과 술을 마셨다. 상사 욕도 하고 거래처 업무에 대한 하소연도 하고, 이야기를 나누다 보니 거나하게 취한 채로 귀가하게 되었다. 버스를 타기 위해 횡단보도를 건너던 홍길동 씨, 길을 막 건너기 시작한 찰나, 왼쪽에서 횡단보도를 향해 달려오다 급정거한 전우치 씨의 차량에 부딪혀 큰 부상을 당하고 말았다.\n홍길동 씨가 건너던 횡단보도는 신호등이 없는 횡단보도로, 전우치 씨는 운전자인 자신의 과실을 인정하지만 만취한 홍길동 씨가 자신의 차량을 보지 못한 것도 일부 과실이 있는 것 아니냐며 문제를 제기했다.\n술에 취해 횡단보도를 건너던 홍길동 씨,\n과실이 있을까 없을까?\n과실비율\n야간, 신호등 없는 횡단보도, 만취한 보행자의 과실 약 20%\n만취 상태로 신호등 없는 횡단보도를 건넌 보행자 과실 10%\n신호등 없는 횡단보도에서 만취한 보행자가 길을 건너다 발생한 사고에 대해서는 보행자의 과실도 약 10%로 본다. 술 취한 보행자가 부주의할 수 있다는 것에 대한 과실을 묻는 것이다.\n야간의 사고, 보행자 과실 약 15% 가산\n또한 사고 발생 시점이 야간이므로 운전자가 앞을 살피기 힘든 정황임을 감안하면 보행자 과실이 15% 정도 가산된다.\n꿀팁\n유사한 상황, 다른 판단\n신호등이 있는 횡단보도라면 보행자의 만취 여부와 상관없이 운전자 과실 100%입니다.\n보행자가 신호등 있는 횡단보도를 파란불에 건너고 있었다면 보행자는 100% 면책됩니다.\n주야간 여부는 판단에 영향을 주지 않지만, 보행자가 신호를 지키지 않았다면 판단 결과가 달라질 수 있습니다.\nkey point\n횡단보도 통행, 알아두면 좋은 교통법\n「도로교통법」 제27조 (보행자의 보호)\n① 모든 차 또는 노면전차의 운전자는 보행자가 횡단보도를 통행하고 있거나 통행하려고 하는 때에는 보행자의 횡단을 방해하거나 위험을 주지 아니하도록 그 횡단보도 앞(정지선이 설치되어 있는 곳에서는 그 정지선을 말한다)에서 일시정지하여야 한다.\n③ 모든 차의 운전자는 교통정리를 하고 있지 아니하는 교차로 또는 그 부근의 도로를 횡단하는 보행자의 통행을 방해하여서는 아니 된다.",
    "category": "차 vs. 사람",
    "case_id": "차 vs. 사람_8"
  },
  {
    "case_visual": {
      "title": "교차로 사고 발생하면\n목소리 큰 사람이 이길까?",
      "description": "교차로 사고 발생하면\n목소리 큰 사람이 이길까?"
    },
    "title": "교차로 충돌사고 후 대뜸 언성을 높이는 상대방",
    "situation": "평소 차량이 많아 늘 복잡한 교차로. 서둘러 출근 중이던 홍길동 씨는 녹색신호가 되자 앞차에 바짝 붙어 교차로에 진입했다. 그런데 교차로를 채 벗어나기도 전에 신호가 적색으로 바뀌었다. 이러지도 못하고 저러지도 못한 채 교차로에 그대로 정지해버린 홍 씨 차량. 그때 녹색신호를 받고 직진하던 교차 방향의 전우치 씨 차량과 충돌했다.\n녹색신호에 정상적으로 진입한 전 씨는 차에서 내려 홍 씨에게 책임을 물려 하는데, 홍 씨가 대뜸 큰소리로 삿대질까지 하며 말하는 게 아닌가! 위압적인 모습으로 나오는 홍 씨의 모습에 전 씨는 당황했다.",
    "situation_highlight": "홍 씨의 주장대로 충격을 가한 전 씨에게 모든 책임이 있는 걸까?",
    "sections": {
      "section_1": {
        "type": "과실비율",
        "title": "교차로 정체 상황, 꼬리물기 운전자에게\n더 많은 과실 적용",
        "main_ratio": "교차로 통행방법을 위반한 홍 씨의 과실이 더 큼",
        "details": [
          "교차로에서 사고가 발생하면, 신호를 위반한 차량의 과실이 100% 인정되는 것이 통상적이다. 하지만 앞차 꼬리물기를 하는 경우는 예외다. 교차로에 진입할 때 앞쪽 차량 상황에 따라 교차로에 정지할 것으로 예상되어 다른 차의 통행에 방해될 우려가 있는데도 불구하고 교차로에 들어가는 행위는 도로교통법상 교차로 통행방법 위반이 된다.\n하지만 전 씨 또한 신호에 따라 진입했다 하더라도 홍 씨 차량에 비해 뒤늦게 교차로에 진입했기 때문에, 주의의무(신호에 따라 교차로에 먼저 진입하였더라도 뒤늦게 교차로에 진입하는 차가 있는지 좌우를 살펴 안전하게 출발할 의무) 위반으로 과실이 10~20% 인정된다."
        ],
        "additional_cases": []
      },
      "section_2": {
        "type": "key point",
        "title": "사고 다발지역 교차로, 사고 유형도 여러 가지",
        "subtitles": [
          "교차로 교통사고란?"
        ],
        "details": [
          "교차로 또는 교차로 측단 후방 30m 이내에서 발생한 사고를 말합니다. 교차로는 여러 방향에서 진행하는 차들로 인해 상충의 위험성이 높아 각별히 주의해야 합니다."
        ]
      },
      "section_3": {
        "type": "꿀팁",
        "title": "일단 진입하고 보는 자세는 위험\n안전한 교차로 통행방법 6",
        "steps": [
          "Tip 1\n원활한 교통소통과 사고방지를 위한 교통신호 준수는 의무입니다.",
          "Tip 2\n황색신호는 ‘녹색신호의 연장’이 아니라 ‘적색신호의 시작’을 뜻합니다.",
          "Tip 3\n녹색신호라 하더라도 교통 혼잡으로 교차로에서 정지할 우려가 있을 때는 주변 진행차량의 통행에 방해가 되지 않도록 교차로에 진입하지 않습니다.",
          "Tip 4\n교차로 부근에서는 안전거리를 충분히 유지하고 2~3대 앞차의 상황까지 주의합니다.",
          "Tip 5\n좌회전이나 우회전을 할 때는 뒷바퀴가 앞바퀴보다 안쪽으로 도는 것을 신경 써서 뒷바퀴에 자전거나 보행자가 치이지 않도록 주의합니다.",
          "Tip 6\n신호가 없거나 교통정리가 행해지고 있지 않으면서, 좌우를 확인할 수 없을 때는 우선 일시 정지해 안전을 확인합니다."
        ],
        "subtitles": [
          "사고를 막는 양보운전\n교차로 통행 우선순위, 긴급자동차"
        ],
        "details": []
      },
      "section_4": {
        "type": "key point",
        "title": "교차로 통행방법 위반 시 범칙금 부과",
        "subtitles": [
          "「도로교통법」 제25조(교차로 통행방법)"
        ],
        "details": [
          "교차로에 정체가 발생하면 녹색신호라도 진입하면 안 됩니다. 만일 정지선을 넘으면 진입한 것으로 간주해 「도로교통법」상 교차로 통행방법 위반이 됩니다.",
          "⑤ 모든 차 또는 노면전차의 운전자는 신호기로 교통정리를 하고 있는 교차로에 들어가려는 경우에는 진행하려는 진로의 앞쪽에 있는 차 또는 노면전차의 상황에 따라 교차로(정지선이 설치되어 있는 경우에는 그 정지선을 넘은 부분을 말한다)에 정지하게 되어 다른 차 또는 노면전차의 통행에 방해가 될 우려가 있는 경우에는 그 교차로에 들어가서는 아니 된다."
        ]
      }
    },
    "full_content": "교차로 충돌사고 후 대뜸 언성을 높이는 상대방\n평소 차량이 많아 늘 복잡한 교차로. 서둘러 출근 중이던 홍길동 씨는 녹색신호가 되자 앞차에 바짝 붙어 교차로에 진입했다. 그런데 교차로를 채 벗어나기도 전에 신호가 적색으로 바뀌었다. 이러지도 못하고 저러지도 못한 채 교차로에 그대로 정지해버린 홍 씨 차량. 그때 녹색신호를 받고 직진하던 교차 방향의 전우치 씨 차량과 충돌했다.\n녹색신호에 정상적으로 진입한 전 씨는 차에서 내려 홍 씨에게 책임을 물려 하는데, 홍 씨가 대뜸 큰소리로 삿대질까지 하며 말하는 게 아닌가! 위압적인 모습으로 나오는 홍 씨의 모습에 전 씨는 당황했다.\n자신 과실이 아닌 것 같은데 홍 씨의 위압적인 태도에 전 씨는 위축되었다.\n홍 씨의 주장대로 충격을 가한 전 씨에게 모든 책임이 있는 걸까?\n과실비율\n교차로 정체 상황, 꼬리물기 운전자에게\n더 많은 과실 적용\n교차로 통행방법을 위반한 홍 씨의 과실이 더 큼\n교차로에서 사고가 발생하면, 신호를 위반한 차량의 과실이 100% 인정되는 것이 통상적이다. 하지만 앞차 꼬리물기를 하는 경우는 예외다. 교차로에 진입할 때 앞쪽 차량 상황에 따라 교차로에 정지할 것으로 예상되어 다른 차의 통행에 방해될 우려가 있는데도 불구하고 교차로에 들어가는 행위는 도로교통법상 교차로 통행방법 위반이 된다.\n하지만 전 씨 또한 신호에 따라 진입했다 하더라도 홍 씨 차량에 비해 뒤늦게 교차로에 진입했기 때문에, 주의의무(신호에 따라 교차로에 먼저 진입하였더라도 뒤늦게 교차로에 진입하는 차가 있는지 좌우를 살펴 안전하게 출발할 의무) 위반으로 과실이 10~20% 인정된다.\nkey point\n사고 다발지역 교차로, 사고 유형도 여러 가지\n교차로 교통사고란?\n교차로 또는 교차로 측단 후방 30m 이내에서 발생한 사고를 말합니다. 교차로는 여러 방향에서 진행하는 차들로 인해 상충의 위험성이 높아 각별히 주의해야 합니다.\n교차로에서 자주 발생하는 사고 유형\n우회전 중 좌회전 또는 직진하는 차량과 충돌사고\n앞차의 진행을 따라 진입하다 앞차의 정지에 따른 후미 추돌사고\n좌회전 또는 우회전 중 횡단보도 보행자와의 사고\n직진으로 교차로 통과 직후 유턴 차량이나 횡단보도 보행자와의 사고\n직진 차로와 좌회전 차로 운전자가 각자 자신의 진행을 다르게 하다 발생하는 사고\n꿀팁\n일단 진입하고 보는 자세는 위험\n안전한 교차로 통행방법 6\nTip 1\n원활한 교통소통과 사고방지를 위한 교통신호 준수는 의무입니다.\nTip 2\n황색신호는 ‘녹색신호의 연장’이 아니라 ‘적색신호의 시작’을 뜻합니다.\nTip 3\n녹색신호라 하더라도 교통 혼잡으로 교차로에서 정지할 우려가 있을 때는 주변 진행차량의 통행에 방해가 되지 않도록 교차로에 진입하지 않습니다.\nTip 4\n교차로 부근에서는 안전거리를 충분히 유지하고 2~3대 앞차의 상황까지 주의합니다.\nTip 5\n좌회전이나 우회전을 할 때는 뒷바퀴가 앞바퀴보다 안쪽으로 도는 것을 신경 써서 뒷바퀴에 자전거나 보행자가 치이지 않도록 주의합니다.\nTip 6\n신호가 없거나 교통정리가 행해지고 있지 않으면서, 좌우를 확인할 수 없을 때는 우선 일시 정지해 안전을 확인합니다.\n사고를 막는 양보운전\n교차로 통행 우선순위, 긴급자동차\n먼저 교차로에 진입한 차\n좌회전하려는 경우: 직진 및 우회전 차량\n직진 또는 우회전하려는 경우: 이미 좌회전하고 있는 차량\n폭이 넓은 도로에서 진입한 차 혹은 일시 정지 또는 양보의 표지가 없는 쪽 통행 차량\nkey point\n교차로 통행방법 위반 시 범칙금 부과\n교차로에 정체가 발생하면 녹색신호라도 진입하면 안 됩니다. 만일 정지선을 넘으면 진입한 것으로 간주해 「도로교통법」상 교차로 통행방법 위반이 됩니다.\n「도로교통법」 제25조(교차로 통행방법)\n⑤ 모든 차 또는 노면전차의 운전자는 신호기로 교통정리를 하고 있는 교차로에 들어가려는 경우에는 진행하려는 진로의 앞쪽에 있는 차 또는 노면전차의 상황에 따라 교차로(정지선이 설치되어 있는 경우에는 그 정지선을 넘은 부분을 말한다)에 정지하게 되어 다른 차 또는 노면전차의 통행에 방해가 될 우려가 있는 경우에는 그 교차로에 들어가서는 아니 된다.",
    "category": "차 vs. 사람",
    "case_id": "차 vs. 사람_9"
  },
  {
    "case_visual": {
      "title": "파란불이 점멸할 때 횡단보도에\n뛰어든 사람을 쳤다면,\n과실 범위는?",
      "description": "파란불이 점멸할 때 횡단보도에\n뛰어든 사람을 쳤다면,\n과실 범위는?"
    },
    "title": "깜빡거리는 파란불에 횡단을 시작하는 보행자",
    "situation": "사무실 앞, 신호등이 있는 횡단보도를 건너려던 전우치 씨. 전화 통화를 하면서 느긋하게 횡단보도를 향하다 보니 파란불이던 신호등이 깜빡깜빡하기 시작한다. 전화를 끊은 전우치 씨는 망설임 없이 횡단보도를 향해 뛰기 시작한다. 횡단보도를 반쯤 건넜을 무렵, 신호는 벌써 빨간색으로 바뀌었다. 그때 힘차게 달리는 전우치 씨의 오른쪽에서 달려오던 자동차 한 대가 전우치 씨를 치고 말았다. 횡단보도를 향해서 신호만 보고 달려오던 홍길동 씨는 전우치 씨가 횡단보도로 뛰어드는 것을 보지 못한 것이다.\n꽤 크게 다친 전우치 씨, 합의를 청하는 홍길동 씨에게 강경한 태도로 반박했다.",
    "situation_highlight": "파란불 점멸에 길을 건넌 보행자와 신호에 맞춰 직진한 운전자, 과실은 어느 쪽에?",
    "sections": {
      "section_1": {
        "type": "과실비율",
        "title": "파란불이 깜빡일 때 보행을 시작한 보행자,\n사고 시 과실 범위는 일부",
        "main_ratio": "파란불이 깜박이기 시작하면 횡단 금지!",
        "details": [
          "보통 보행자들은 파란불이 깜박거리기 시작하면 더욱 서둘러 횡단보도를 건너는 습관이 있다. 하지만 이것은 굉장히 위험한 행위다. 보행 도중에 신호가 바뀌면 차가 횡단보도를 통과할 가능성이 높기 때문이다. 또한, 위험할 뿐 아니라 법률에서도 금지하고 있는 사항이다. 파란불이 깜박이기 시작할 때는 횡단하면 안 되고, 보행 중 깜박이는 신호로 바뀐다면 서둘러 인도로 올라서야 한다.\n파란불이 깜박이기 시작한 횡단보도를 건너다 다친 보행자에게는 통상 20% 정도의 과실을 묻는다. 파란불에 건너기 시작해서 빨간불에 충돌한 경우는 보행자 과실이 10% 정도로 줄어든다.",
          "보행자가 파란불이 점멸할 때 횡단보도를 건너기 시작했다면, 운전자는 보행자가 길을 건너는 것을 주의하고 지켜볼 의무가 있다. 따라서 운전자의 과실 범위는 보행자보다 훨씬 큰 80%가량으로 판단할 수 있다."
        ],
        "additional_cases": []
      },
      "section_2": {
        "type": "key point",
        "title": "도로 횡단 관련, 알아두면 좋은 교통법",
        "subtitles": [
          "「도로교통법 시행규칙」 별표 2(신호기가 표시하는 신호의 종류 및 신호의 뜻)",
          "보행신호등 녹색 등화의 점멸",
          "「도로교통법」 제27조(보행자의 보호)"
        ],
        "details": [
          "보행자는 횡단을 시작하여서는 아니 되고, 횡단하고 있는 보행자는 신속하게 횡단을 완료하거나 그 횡단을 중지하고 보도로 되돌아와야 한다.",
          "② 모든 차 또는 노면전차의 운전자는 교통정리를 하고 있는 교차로에서 좌회전이나 우회전을 하려는 경우에는 신호기 또는 경찰공무원 등의 신호나 지시에 따라 도로를 횡단하는 보행자의 통행을 방해하여서는 아니 된다."
        ]
      }
    },
    "full_content": "깜빡거리는 파란불에 횡단을 시작하는 보행자\n사무실 앞, 신호등이 있는 횡단보도를 건너려던 전우치 씨. 전화 통화를 하면서 느긋하게 횡단보도를 향하다 보니 파란불이던 신호등이 깜빡깜빡하기 시작한다. 전화를 끊은 전우치 씨는 망설임 없이 횡단보도를 향해 뛰기 시작한다. 횡단보도를 반쯤 건넜을 무렵, 신호는 벌써 빨간색으로 바뀌었다. 그때 힘차게 달리는 전우치 씨의 오른쪽에서 달려오던 자동차 한 대가 전우치 씨를 치고 말았다. 횡단보도를 향해서 신호만 보고 달려오던 홍길동 씨는 전우치 씨가 횡단보도로 뛰어드는 것을 보지 못한 것이다.\n꽤 크게 다친 전우치 씨, 합의를 청하는 홍길동 씨에게 강경한 태도로 반박했다.\n파란불 점멸에 길을 건넌 보행자와 신호에 맞춰 직진한 운전자, 과실은 어느 쪽에?\n과실비율\n파란불이 깜빡일 때 보행을 시작한 보행자,\n사고 시 과실 범위는 일부\n파란불이 깜박이기 시작하면 횡단 금지!\n보통 보행자들은 파란불이 깜박거리기 시작하면 더욱 서둘러 횡단보도를 건너는 습관이 있다. 하지만 이것은 굉장히 위험한 행위다. 보행 도중에 신호가 바뀌면 차가 횡단보도를 통과할 가능성이 높기 때문이다. 또한, 위험할 뿐 아니라 법률에서도 금지하고 있는 사항이다. 파란불이 깜박이기 시작할 때는 횡단하면 안 되고, 보행 중 깜박이는 신호로 바뀐다면 서둘러 인도로 올라서야 한다.\n파란불이 깜박이기 시작한 횡단보도를 건너다 다친 보행자에게는 통상 20% 정도의 과실을 묻는다. 파란불에 건너기 시작해서 빨간불에 충돌한 경우는 보행자 과실이 10% 정도로 줄어든다.\n운전자에게는 보행자의 횡단 완료를 지켜볼 의무\n보행자가 파란불이 점멸할 때 횡단보도를 건너기 시작했다면, 운전자는 보행자가 길을 건너는 것을 주의하고 지켜볼 의무가 있다. 따라서 운전자의 과실 범위는 보행자보다 훨씬 큰 80%가량으로 판단할 수 있다.\nkey point\n도로 횡단 관련, 알아두면 좋은 교통법\n「도로교통법 시행규칙」 별표 2(신호기가 표시하는 신호의 종류 및 신호의 뜻)\n보행신호등 녹색 등화의 점멸\n보행자는 횡단을 시작하여서는 아니 되고, 횡단하고 있는 보행자는 신속하게 횡단을 완료하거나 그 횡단을 중지하고 보도로 되돌아와야 한다.\n「도로교통법」 제27조(보행자의 보호)\n② 모든 차 또는 노면전차의 운전자는 교통정리를 하고 있는 교차로에서 좌회전이나 우회전을 하려는 경우에는 신호기 또는 경찰공무원 등의 신호나 지시에 따라 도로를 횡단하는 보행자의 통행을 방해하여서는 아니 된다.",
    "category": "차 vs. 사람",
    "case_id": "차 vs. 사람_10"
  },
  {
    "case_visual": {
      "title": "횡단보도를 비스듬히 건너던\n보행자를 쳤다면,\n과실 범위는?",
      "description": "횡단보도를 비스듬히 건너던\n보행자를 쳤다면,\n과실 범위는?"
    },
    "title": "횡단보도를 향해 길을 건너던 보행자와 차가 충돌",
    "situation": "점심시간에 밥 먹을 식당을 찾아 길을 건너려고 횡단보도를 향해 가던 직장인 전우치 씨, 횡단보도와 몇 미터 떨어진 곳에서 파란불로 바뀌는 신호를 보고는 횡단보도 쪽으로 급하게 걸음을 옮겼다. 그런데 중앙선을 넘어 맞은편에 거의 도달할 때쯤 오른쪽에서 횡단보도를 향해 달려오던 홍길동 씨의 차량이 전우치 씨를 쳤다.\n이 사고로 인해 심하게 다치지는 않았으나 병원에서 통원치료를 받게 된 전우치 씨, 운전자 홍길동 씨에게 손해배상을 요구했지만 홍길동 씨는 순순히 응해 주지 않았다.",
    "situation_highlight": "횡단보도 밖에서 길을 건너던 보행자, 사고 시 과실은 어느 정도일까?",
    "sections": {
      "section_1": {
        "type": "과실비율",
        "title": "횡단보도가 아닌 길로 건넌 보행자에게도\n과실이 있다",
        "main_ratio": "보행자도 꼭 따라야 할 신호 준수의 의무",
        "details": [
          "상황에 따라 달라지겠으나, 보도와 차도의 구분이 명확한 횡단보도를 벗어나서 길을 건넌 보행자에게도 상당 부분 과실이 있는 것으로 볼 수 있겠다. 다만, 정황이나 위치에 따라서 보행자의 과실 범위는 달라진다.",
          "일반적으로 보행자 보호가 원칙이지만, 보행자에게도 신호를 따를 의무는 있다. 횡단보도의 경우 보도와 차도의 구분이 명확해서 보행자가 걸어갈 수 있는 지역과 없는 지역을 쉽게 구분할 수 있으므로, 이를 어긴 보행자에게도 일부 과실을 묻게 된다. 신호가 녹색이었다고 해도 보행자에게 10~20% 과실책임이 있다. 만약 신호가 적색이었다면 신호를 위반한 보행자에게 과실 범위가 더 커져서 50%까지 책임을 물을 수 있다. 야간 등 운전자가 전방을 살필 수 없는 상황이라면 보행자 과실은 10% 정도 가산된다고 볼 수 있다. 즉, 야간 적색신호 시 횡단보도를 벗어난 지역에서 길을 건넜다면 보행자의 과실이 운전자보다 더 커지게 되는 것이다.",
          "횡단보도 부근에서 일어난 사고의 경우 자동차가 횡단보도를 통과했는지, 통과하기 전이었는지 위치에 따라 보행자의 과실 정도가 달라진다. 자동차가 횡단보도를 통과하기 전이라면 보행자가 자동차를 향해서 길을 건넜다는 점을 고려해 보행자의 기본 과실이 20%, 자동차가 횡단보도를 통과했다면 보행자 과실은 10% 정도 된다.",
          "자동차가 횡단보도를 통과하기 전이라면 사고 난 지점이 정지선 안쪽인지 바깥쪽인지에 따라 자동차의 과실 범위가 달라질 수 있겠다. 정지선 안쪽이라면 정지선을 지키지 않은 점을 감안해 자동차 과실이 10% 증가, 즉 보행자 과실이 10% 줄어든다고 볼 수 있다."
        ],
        "additional_cases": []
      },
      "section_2": {
        "type": "key point",
        "title": "도로 횡단 관련, 알아두면 좋은 교통법",
        "subtitles": [
          "「도로교통법」 제10조(도로의 횡단)"
        ],
        "details": [
          "① 시·도경찰청장은 도로를 횡단하는 보행자의 안전을 위하여 행정안전부령이 정하는 기준에 따라 횡단보도를 설치할 수 있다.",
          "② 보행자는 제1항에 따른 횡단보도, 지하도, 육교나 그 밖의 도로 횡단시설이 설치되어 있는 도로에서는 그 곳으로 횡단하여야 한다. 다만, 지하도나 육교 등의 도로 횡단시설을 이용할 수 없는 지체장애인의 경우에는 다른 교통에 방해가 되지 아니하는 방법으로 도로 횡단시설을 이용하지 아니하고 도로를 횡단할 수 있다.",
          "③ 보행자는 제1항에 따른 횡단보도가 설치되어 있지 아니한 도로에서는 가장 짧은 거리로 횡단하여야 한다.",
          "④ 보행자는 차와 노면전차의 바로 앞이나 뒤로 횡단하여서는 아니 된다. 다만, 횡단보도를 횡단하거나 신호기 또는 경찰공무원 등의 신호나 지시에 따라 도로를 횡단하는 경우에는 그러하지 아니하다.",
          "⑤ 보행자는 안전표지 등에 의하여 횡단이 금지되어 있는 도로의 부분에서는 그 도로를 횡단하여서는 아니 된다."
        ]
      }
    },
    "full_content": "횡단보도를 향해 길을 건너던 보행자와 차가 충돌\n점심시간에 밥 먹을 식당을 찾아 길을 건너려고 횡단보도를 향해 가던 직장인 전우치 씨, 횡단보도와 몇 미터 떨어진 곳에서 파란불로 바뀌는 신호를 보고는 횡단보도 쪽으로 급하게 걸음을 옮겼다. 그런데 중앙선을 넘어 맞은편에 거의 도달할 때쯤 오른쪽에서 횡단보도를 향해 달려오던 홍길동 씨의 차량이 전우치 씨를 쳤다.\n이 사고로 인해 심하게 다치지는 않았으나 병원에서 통원치료를 받게 된 전우치 씨, 운전자 홍길동 씨에게 손해배상을 요구했지만 홍길동 씨는 순순히 응해 주지 않았다.\n횡단보도 밖에서 길을 건너던 보행자, 사고 시 과실은 어느 정도일까?\n과실비율\n횡단보도가 아닌 길로 건넌 보행자에게도\n과실이 있다\n상황에 따라 달라지겠으나, 보도와 차도의 구분이 명확한 횡단보도를 벗어나서 길을 건넌 보행자에게도 상당 부분 과실이 있는 것으로 볼 수 있겠다. 다만, 정황이나 위치에 따라서 보행자의 과실 범위는 달라진다.\n보행자도 꼭 따라야 할 신호 준수의 의무\n일반적으로 보행자 보호가 원칙이지만, 보행자에게도 신호를 따를 의무는 있다. 횡단보도의 경우 보도와 차도의 구분이 명확해서 보행자가 걸어갈 수 있는 지역과 없는 지역을 쉽게 구분할 수 있으므로, 이를 어긴 보행자에게도 일부 과실을 묻게 된다. 신호가 녹색이었다고 해도 보행자에게 10~20% 과실책임이 있다. 만약 신호가 적색이었다면 신호를 위반한 보행자에게 과실 범위가 더 커져서 50%까지 책임을 물을 수 있다. 야간 등 운전자가 전방을 살필 수 없는 상황이라면 보행자 과실은 10% 정도 가산된다고 볼 수 있다. 즉, 야간 적색신호 시 횡단보도를 벗어난 지역에서 길을 건넜다면 보행자의 과실이 운전자보다 더 커지게 되는 것이다.\n차량의 횡단보도 통과 전? 통과 후?\n횡단보도 부근에서 일어난 사고의 경우 자동차가 횡단보도를 통과했는지, 통과하기 전이었는지 위치에 따라 보행자의 과실 정도가 달라진다. 자동차가 횡단보도를 통과하기 전이라면 보행자가 자동차를 향해서 길을 건넜다는 점을 고려해 보행자의 기본 과실이 20%, 자동차가 횡단보도를 통과했다면 보행자 과실은 10% 정도 된다.\n사고지점이 정지선 안? 정지선 밖?\n자동차가 횡단보도를 통과하기 전이라면 사고 난 지점이 정지선 안쪽인지 바깥쪽인지에 따라 자동차의 과실 범위가 달라질 수 있겠다. 정지선 안쪽이라면 정지선을 지키지 않은 점을 감안해 자동차 과실이 10% 증가, 즉 보행자 과실이 10% 줄어든다고 볼 수 있다.\nkey point\n도로 횡단 관련, 알아두면 좋은 교통법\n「도로교통법」 제10조(도로의 횡단)\n① 시·도경찰청장은 도로를 횡단하는 보행자의 안전을 위하여 행정안전부령이 정하는 기준에 따라 횡단보도를 설치할 수 있다.\n② 보행자는 제1항에 따른 횡단보도, 지하도, 육교나 그 밖의 도로 횡단시설이 설치되어 있는 도로에서는 그 곳으로 횡단하여야 한다. 다만, 지하도나 육교 등의 도로 횡단시설을 이용할 수 없는 지체장애인의 경우에는 다른 교통에 방해가 되지 아니하는 방법으로 도로 횡단시설을 이용하지 아니하고 도로를 횡단할 수 있다.\n③ 보행자는 제1항에 따른 횡단보도가 설치되어 있지 아니한 도로에서는 가장 짧은 거리로 횡단하여야 한다.\n④ 보행자는 차와 노면전차의 바로 앞이나 뒤로 횡단하여서는 아니 된다. 다만, 횡단보도를 횡단하거나 신호기 또는 경찰공무원 등의 신호나 지시에 따라 도로를 횡단하는 경우에는 그러하지 아니하다.\n⑤ 보행자는 안전표지 등에 의하여 횡단이 금지되어 있는 도로의 부분에서는 그 도로를 횡단하여서는 아니 된다.",
    "category": "차 vs. 사람",
    "case_id": "차 vs. 사람_11"
  },
  {
    "case_visual": {
      "title": "횡단보도 신호를 무시하고\n길을 건나다 직진 차량과 부딪히면?",
      "description": "횡단보도 신호를 무시하고\n길을 건나다 직진 차량과 부딪히면?"
    },
    "title": "빨간불 신호등을 무시하고 건너다가 사고",
    "situation": "약속에 늦은 홍길동 씨가 급하게 약속 장소를 향해 뛰어가고 있었다. 저 앞 교차로만 건너면 곧 도착인데, 달려가면서 보이는 교차로의 신호는 빨간불이다. ‘에라, 모르겠다. 그냥 건너자!’ 사거리 교차로를 향해 뛰어오던 홍길동 씨는 횡단보도 왼쪽에서 달려오는 차량 한 대를 보지 못했고, 횡단보도를 향해 직진하던 전우치 씨의 차량 역시 갑자기 달려 나온 홍길동 씨를 보지 못해 홍길동 씨와 부딪히고 말았다.\n이 사고로 상당히 다친 홍길동 씨는 전우치 씨에게 병원비와 피해보상 일체를 요구했다. 운전자 전우치 씨도 신호를 무시한 채 길을 건너던 홍길동 씨에게 할 말은 있었다.",
    "situation_highlight": "신호 무시하고 길을 건넌 홍길동 씨와 보행자를 친 전우치 씨, 과실은 누구에게?",
    "sections": {
      "section_1": {
        "type": "과실비율",
        "title": "빨간불의 교통사고,\n신호 준수의 의무를 무시한 보행자 과실",
        "main_ratio": "빨간불에 길을 건너기 시작, 빨간불에 충돌한 경우 보행자 과실 70% 이상",
        "details": [
          "보행자든 운전자든 일단 도로에서는 신호를 지켜야 할 의무가 있다. 운전자 전우치 씨가 중대한 과실을 범했다는 정황이 없으면 이 사고는 보행자의 신호 위반 사실만 존재하기 때문에 보행자 과실이 매우 크다.\n야간 등 운전자가 앞을 살피기 힘든 상황이었다면 보행자 과실이 5%가량 더 높아지고, 운전자가 현저하거나 중대한 과실을 범했다면 5~10%의 과실이 운전자에게 가산된다. 보행자가 어린이나 노인이라면 보행자 과실이 5% 정도 줄어드는데, 사고지역이 어린이/노인 보호구역이었다면 보행자 과실이 여기에 15% 정도 추가로 줄어든다."
        ],
        "additional_cases": [
          "위의 경우는 운전 신호등이 녹색이었을 경우, 즉 운전자 과실이 거의 없다고 볼 수 있는 경우에 대한 과실 범위다. 단, 보행자 신호등이 빨간불이었다고 해도 운전자의 신호등이 노란불이었다면 운전자에게도 50%가량 과실이 있다고 볼 수 있다."
        ]
      },
      "section_2": {
        "type": "꿀팁",
        "title": "유사한 상황, 다른 판단",
        "steps": [],
        "subtitles": [
          "운전자가 노란불을 확인하고 횡단보도에 닿게 되는 아래 2가지 경우, 운전자의 과실 범위를 다르게 판단할 수 있습니다.",
          "1. 보행자가 빨간불에 길을 건너기 시작, 녹색불에 충돌한 경우 보행자 과실 30%가량",
          "2. 보행자가 녹색불에 길을 건너기 시작, 녹색불에 충돌한 경우 보행자 과실 0%"
        ],
        "details": [
          "사고 난 시점이 녹색불이었다면 운전자 과실이 많이 늘어납니다. 운전자에게 결정적 과실이 있거나, 보행자가 어린이나 노인이라면 운전자 과실은 더욱 커집니다.",
          "보행자는 신호를 준수했으므로 노란불 신호를 지키지 않은 운전자의 신호 위반 사실만 남게 됩니다."
        ]
      }
    },
    "full_content": "빨간불 신호등을 무시하고 건너다가 사고\n약속에 늦은 홍길동 씨가 급하게 약속 장소를 향해 뛰어가고 있었다. 저 앞 교차로만 건너면 곧 도착인데, 달려가면서 보이는 교차로의 신호는 빨간불이다. ‘에라, 모르겠다. 그냥 건너자!’ 사거리 교차로를 향해 뛰어오던 홍길동 씨는 횡단보도 왼쪽에서 달려오는 차량 한 대를 보지 못했고, 횡단보도를 향해 직진하던 전우치 씨의 차량 역시 갑자기 달려 나온 홍길동 씨를 보지 못해 홍길동 씨와 부딪히고 말았다.\n이 사고로 상당히 다친 홍길동 씨는 전우치 씨에게 병원비와 피해보상 일체를 요구했다. 운전자 전우치 씨도 신호를 무시한 채 길을 건너던 홍길동 씨에게 할 말은 있었다.\n신호 무시하고 길을 건넌 홍길동 씨와 보행자를 친 전우치 씨, 과실은 누구에게?\n과실비율\n빨간불의 교통사고,\n신호 준수의 의무를 무시한 보행자 과실\n빨간불에 길을 건너기 시작, 빨간불에 충돌한 경우 보행자 과실 70% 이상\n보행자든 운전자든 일단 도로에서는 신호를 지켜야 할 의무가 있다. 운전자 전우치 씨가 중대한 과실을 범했다는 정황이 없으면 이 사고는 보행자의 신호 위반 사실만 존재하기 때문에 보행자 과실이 매우 크다.\n야간 등 운전자가 앞을 살피기 힘든 상황이었다면 보행자 과실이 5%가량 더 높아지고, 운전자가 현저하거나 중대한 과실을 범했다면 5~10%의 과실이 운전자에게 가산된다. 보행자가 어린이나 노인이라면 보행자 과실이 5% 정도 줄어드는데, 사고지역이 어린이/노인 보호구역이었다면 보행자 과실이 여기에 15% 정도 추가로 줄어든다.\n운전자 신호등이 노란색이었다면 보행자 과실은 50%가량\n위의 경우는 운전 신호등이 녹색이었을 경우, 즉 운전자 과실이 거의 없다고 볼 수 있는 경우에 대한 과실 범위다. 단, 보행자 신호등이 빨간불이었다고 해도 운전자의 신호등이 노란불이었다면 운전자에게도 50%가량 과실이 있다고 볼 수 있다.\n꿀팁\n유사한 상황, 다른 판단\n운전자가 노란불을 확인하고 횡단보도에 닿게 되는 아래 2가지 경우, 운전자의 과실 범위를 다르게 판단할 수 있습니다.\n1. 보행자가 빨간불에 길을 건너기 시작, 녹색불에 충돌한 경우 보행자 과실 30%가량\n사고 난 시점이 녹색불이었다면 운전자 과실이 많이 늘어납니다. 운전자에게 결정적 과실이 있거나, 보행자가 어린이나 노인이라면 운전자 과실은 더욱 커집니다.\n2. 보행자가 녹색불에 길을 건너기 시작, 녹색불에 충돌한 경우 보행자 과실 0%\n보행자는 신호를 준수했으므로 노란불 신호를 지키지 않은 운전자의 신호 위반 사실만 남게 됩니다.",
    "category": "차 vs. 사람",
    "case_id": "차 vs. 사람_12"
  }
]