[
  {
    "case_visual": {
      "title": "유턴 자동차와 앞지르기하던\n오토바이가 부딪히면 누구의 과실일까?",
      "description": "유턴 자동차와 앞지르기하던\n오토바이가 부딪히면 누구의 과실일까?"
    },
    "title": "유턴하던 차량과 앞지르기하던 오토바이의 충돌",
    "situation": "홍길동 씨는 편도 3차선 도로에서 좌회전 차선을 주행하던 중 잘못 진입한 것을 알고 유턴 구간에 못 미쳐 중앙선을 침범해 유턴을 시도했다. 그때 뒤따르던 오토바이 운전자인 전우치 씨가 앞지르기를 시도하다가 접촉사고가 발생했다. 홍 씨는 오토바이에 신호를 주기 위해 왼쪽 방향지시등을 켠 상태로 유턴을 했고, 전 씨는 직진 신호 중 앞지르기 양보를 얻으려고 했으나 불가능해 중앙선을 침범하게 된 상황이었다.",
    "situation_highlight": "양측 모두 중앙선을 침범한 상황, 과연 어느 쪽이 가해자일까?",
    "sections": {
      "section_1": {
        "type": "과실비율",
        "title": "중앙선을 침범한 양측 모두 과실 인정!",
        "main_ratio": "홍 씨와 전 씨 양측의 과실은 50 : 50으로 동일",
        "details": [
          "감속과 방향지시등만으로 홍 씨가 불법 유턴에 대한 안전조치를 모두 취했다고 볼 수 없다. 정황상 홍 씨는 중앙선을 침범해 불법 유턴을 시도하려던 의지가 있었다고 볼 수 있다. 또한 전 씨가 중앙선을 침범해 앞지르기를 한 것은 앞 차량이 전혀 예측할 수 없는 상황이기 때문에 불법이다. 이 경우, 양쪽 모두 불법행위로 원인을 제공한 것이기 때문에 과실은 양측 모두에게 있다."
        ],
        "additional_cases": [
          "자동차가 급제동 시 중앙선을 침범하지 않은 상황에서 이륜차량과 추돌한 경우\n→ 차량 : 오토바이 = 과실 30 : 70",
          "자동차가 중앙선을 침범한 상황에서 직진하던 이륜차량과 추돌한 경우\n→ 차량 : 오토바이 = 과실 70 : 30"
        ]
      },
      "section_2": {
        "type": "key point",
        "title": "유턴은 유턴 구간에서 유턴 신호일 때만!",
        "subtitles": [
          "유턴은 꼭 지정된 곳에서만",
          "신호는 시간을 두고 정확하게"
        ],
        "details": [
          "회전이 허용되지 않는 장소는 대부분 시야 확보가 어려운 도로이거나 교통이 유독 번잡한 도로입니다. 유턴이 금지된 구간에서 신호를 하지 않고 갑자기 유턴하여 사고가 발생한다면 매우 불리하게 과실 판정이 날 수 있습니다.",
          "유턴 지점에서 최소 30미터 전에 손이나 방향지시기 또는 등화로 신호를 해야 합니다. 특히 움직임을 예측하기 어려운 오토바이나 자전거 등 이륜차량이 뒤쪽에 있다면 잘 알아볼 수 있도록 충분히 신호를 해야 합니다."
        ]
      },
      "section_3": {
        "type": "꿀팁",
        "title": "유턴 전, 깜빡이 먼저! 안전한 유턴 방법",
        "steps": [
          "Step 1\n좌측 깜빡이를 켜고 유턴 차선으로 변경하기",
          "Step 2\n교차로에서 유턴신호 대기하기",
          "Step 3\n도로 폭에 맞게 핸들을 돌리며 유턴 시작하기",
          "Step 4\n유턴이 끝날 무렵 핸들 풀기 시작하기",
          "Step 5\n핸들을 모두 풀고 유턴 마무리하기",
          "Step 6\n교통 흐름에 따라 속도 조절하기"
        ],
        "subtitles": [
          "유턴할 땐 핸들을 꽉 잡으세요!"
        ],
        "details": [
          "급하게 유턴하면 원심력 때문에 핸들을 놓칠 수도 있으니 속도를 줄여야 합니다. 완전히 돌린 핸들은 차량이 유턴하면서 서서히 풀려 숙련된 운전자일수록 핸들을 약간 느슨하게 잡고 자연스럽게 풉니다. 이때 초보 운전자의 경우, 성급하게 핸들을 놓아버리는 경우가 있으니 주의해야 합니다."
        ]
      },
      "section_4": {
        "type": "Q&A",
        "title": "차로 인정되는 자전거, 전방주시 필수!",
        "question": "Q. 도로에서 자전거를 타다 사고가 나면 차량 책임인가요?",
        "answer_title": "A. 아닙니다. 자전거도 도로에서는 차량입니다.",
        "answer_details": [
          "도로교통법상 자전거도 차량으로 인정되어 자동차와 똑같은 법을 적용받습니다. 자전거 운전자는 자전거도로로 통행해야 하며, 자전거도로가 없을 경우 도로 우측 가장자리에 붙어 통행해야 합니다.\n도로에서 자동차와 충돌사고가 나면 과실이 적용됩니다. 예를 들어, 후행 직진하던 자전거와 우회전하던 자동차가 충돌한 경우, 자전거 운전자가 미리 우측으로 다가선 자동차를 봤는데도 충분한 거리와 속도를 유지하지 않았다면 현저한 전방주시 태만으로 자전거 운전자에게 비교적 높은 과실이 인정됩니다."
        ]
      }
    },
    "full_content": "유턴하던 차량과 앞지르기하던 오토바이의 충돌\n홍길동 씨는 편도 3차선 도로에서 좌회전 차선을 주행하던 중 잘못 진입한 것을 알고 유턴 구간에 못 미쳐 중앙선을 침범해 유턴을 시도했다. 그때 뒤따르던 오토바이 운전자인 전우치 씨가 앞지르기를 시도하다가 접촉사고가 발생했다. 홍 씨는 오토바이에 신호를 주기 위해 왼쪽 방향지시등을 켠 상태로 유턴을 했고, 전 씨는 직진 신호 중 앞지르기 양보를 얻으려고 했으나 불가능해 중앙선을 침범하게 된 상황이었다.\n양측 모두 중앙선을 침범한 상황, 과연 어느 쪽이 가해자일까?\n과실비율\n중앙선을 침범한 양측 모두 과실 인정!\n홍 씨와 전 씨 양측의 과실은 50 : 50으로 동일\n감속과 방향지시등만으로 홍 씨가 불법 유턴에 대한 안전조치를 모두 취했다고 볼 수 없다. 정황상 홍 씨는 중앙선을 침범해 불법 유턴을 시도하려던 의지가 있었다고 볼 수 있다. 또한 전 씨가 중앙선을 침범해 앞지르기를 한 것은 앞 차량이 전혀 예측할 수 없는 상황이기 때문에 불법이다. 이 경우, 양쪽 모두 불법행위로 원인을 제공한 것이기 때문에 과실은 양측 모두에게 있다.\n이럴 땐 이런 과실 판정\n자동차가 급제동 시 중앙선을 침범하지 않은 상황에서 이륜차량과 추돌한 경우\n→ 차량 : 오토바이 = 과실 30 : 70\n자동차가 중앙선을 침범한 상황에서 직진하던 이륜차량과 추돌한 경우\n→ 차량 : 오토바이 = 과실 70 : 30\nkey point\n유턴은 유턴 구간에서 유턴 신호일 때만!\n유턴은 꼭 지정된 곳에서만\n회전이 허용되지 않는 장소는 대부분 시야 확보가 어려운 도로이거나 교통이 유독 번잡한 도로입니다. 유턴이 금지된 구간에서 신호를 하지 않고 갑자기 유턴하여 사고가 발생한다면 매우 불리하게 과실 판정이 날 수 있습니다.\n신호는 시간을 두고 정확하게\n유턴 지점에서 최소 30미터 전에 손이나 방향지시기 또는 등화로 신호를 해야 합니다. 특히 움직임을 예측하기 어려운 오토바이나 자전거 등 이륜차량이 뒤쪽에 있다면 잘 알아볼 수 있도록 충분히 신호를 해야 합니다.\n꿀팁\n유턴 전, 깜빡이 먼저! 안전한 유턴 방법\nStep 1\n좌측 깜빡이를 켜고 유턴 차선으로 변경하기\nStep 2\n교차로에서 유턴신호 대기하기\nStep 3\n도로 폭에 맞게 핸들을 돌리며 유턴 시작하기\nStep 4\n유턴이 끝날 무렵 핸들 풀기 시작하기\nStep 5\n핸들을 모두 풀고 유턴 마무리하기\nStep 6\n교통 흐름에 따라 속도 조절하기\n유턴할 땐 핸들을 꽉 잡으세요!\n급하게 유턴하면 원심력 때문에 핸들을 놓칠 수도 있으니 속도를 줄여야 합니다. 완전히 돌린 핸들은 차량이 유턴하면서 서서히 풀려 숙련된 운전자일수록 핸들을 약간 느슨하게 잡고 자연스럽게 풉니다. 이때 초보 운전자의 경우, 성급하게 핸들을 놓아버리는 경우가 있으니 주의해야 합니다.\nQ&A\n차로 인정되는 자전거, 전방주시 필수!\nQ. 도로에서 자전거를 타다 사고가 나면 차량 책임인가요?\nA. 아닙니다. 자전거도 도로에서는 차량입니다.\n도로교통법상 자전거도 차량으로 인정되어 자동차와 똑같은 법을 적용받습니다. 자전거 운전자는 자전거도로로 통행해야 하며, 자전거도로가 없을 경우 도로 우측 가장자리에 붙어 통행해야 합니다.\n도로에서 자동차와 충돌사고가 나면 과실이 적용됩니다. 예를 들어, 후행 직진하던 자전거와 우회전하던 자동차가 충돌한 경우, 자전거 운전자가 미리 우측으로 다가선 자동차를 봤는데도 충분한 거리와 속도를 유지하지 않았다면 현저한 전방주시 태만으로 자전거 운전자에게 비교적 높은 과실이 인정됩니다.",
    "category": "차 vs. 차",
    "case_id": "차 vs. 차_0"
  },
  {
    "case_visual": {
      "title": "차폭등과 미등만으로는\n안전조치가 안될까?",
      "description": "차폭등과 미등만으로는\n안전조치가 안될까?"
    },
    "title": "멈춰 선 차, 차폭등과 미등만으로 안전조치한 상황",
    "situation": "밤 늦게 귀가하던 홍길동 씨의 차가 갑자기 멈춰 섰다. 당황한 홍 씨는 우선 편도 2차선 도로 갓길에 차를 세우고 차폭등과 미등을 켜 안전조치를 취했다. 그렇게 견인차량을 기다리던 중, 저 멀리서 시속 60km로 달려오던 전우치 씨의 차가 홍 씨의 차를 그대로 들이받았다. 홍 씨는 전 씨가 ‘분명히 안전조치를 봤을 텐데도 속도를 줄이지 않은 것’이라고 판단해 화를 버럭 냈다. 그런데 이 무슨 황당한 시추에이션? 전 씨가 오히려 화를 내는 것이 아닌가! 전 씨의 주장은 ‘홍 씨가 미흡한 안전조치를 취해 과실이 있다’는 것이었다.",
    "situation_highlight": "홍 씨는 안전삼각대가 없는 상황에서 차폭등과 미등만으로 비상상황임을 알려 충분히 안전조치를 취했다며 과실이 없음을 주장했다. 하지만 전 씨는 앞쪽이 잘 보이지 않는 어두운 밤에 가로등도 없는 곳에서 충분한 안전조치를 취하지 않았다며 홍 씨의 과실을 주장하고 있다.",
    "sections": {
      "section_1": {
        "type": "과실비율",
        "title": "상황을 고려하지 않은 미흡한 안전조치는\n과실로 인정!",
        "main_ratio": "단순 안전조치만 취한 홍길동 씨에게 과실 20%",
        "details": [
          "차량 고장 등으로 갓길에 차를 세운 경우, 단순히 미등을 켜는 것만으로 안전조치를 취했다고 볼 수 없다. 더구나 사고가 발생한 곳은 어두운 밤에 가로등도 없는 곳. 따라서 뒤에 오는 운전자가 쉽게 식별할 수 있도록 충분히 안전조치를 취하지 않은 홍길동 씨에게 분명 과실이 있다. 안전조치 불이행에 따른 20% 정도의 과실이 인정된다."
        ],
        "additional_cases": []
      },
      "section_2": {
        "type": "key point",
        "title": "시야 확보 어려운 야간에는\n충분한 안전조치가 필수",
        "subtitles": [
          "안전삼각대는 도로 주행 기본 매너!",
          "어두운 밤에는 불꽃 신호를!"
        ],
        "details": [
          "한국도로공사 통계에 따르면 고장 정차한 차량 추돌사고가 전체 2차 사고 발생률의 25%를 차지하고, 야간 사고 발생률은 무려 73%입니다.\n따라서 차량이 멈췄을 경우, 안전조치를 빠르게 취하는 게 중요합니다. 이때 차량이 멈춘 지점의 주변환경이나 시각을 살펴 안전조치를 충분히 취해야 합니다.",
          "자동차용 안전삼각대를 후방에서 접근하는 자동차의 운전자가 확인할 수 있는 위치에 설치합니다.",
          "멈춰 선 차량의 뒤에서 접근하는 운전자가 사방 500m 지점에서 쉽게 식별할 수 있도록 적색 섬광신호ㆍ전기제등 또는 불꽃 신호를 추가로 설치합니다."
        ]
      },
      "section_3": {
        "type": "꿀팁",
        "title": "도로 운전 중 차가 멈춰 섰을 때 조치 방법",
        "steps": [
          "Step 1\n비상등을 켜고 주변 교통상황을 살피면서 갓길에 주차하기\n만일 차가 멈춰 움직이지 않을 경우, 그 자리에서 비상등을 켜고 보닛이나 트렁크를 열어두세요.",
          "Step 2\n차량 뒤쪽에 안전삼각대 설치하기\n밤에는 불꽃 신호를 추가로 설치해 주세요.",
          "Step 3\n안전지대나 가드레일 밖으로 대피하기\n운전자와 탑승자 모두 차량 밖으로 나와 주세요.",
          "Step 4\n보험사 혹은 견인업체에 신고하기\n필요하면 경찰에도 알리세요.",
          "Step 5\n뒤에 오는 차량들을 향해 주의 신호 보내기\n안전지대나 가드레일 밖에서 신호유도봉 또는 밝은색 옷을 흔들어 주세요. 이때 차도에서 맨손으로 수신호를 하는 것은 위험합니다."
        ],
        "subtitles": [],
        "details": []
      },
      "section_4": {
        "type": "꿀팁",
        "title": "상황에 따른 주정차 사고 예방법",
        "steps": [],
        "subtitles": [
          "1. 잠깐 세워두어서 주차가 아니라고?",
          "2. 갓길 주차는 대단히 위험",
          "3. 경사진 곳은 위험하니 조심 또 조심!"
        ],
        "details": [
          "홍길동 씨는 편의점에 들르기 위해 차를 잠깐 세워 두었다가 주차위반 딱지를 뗀 적이 있습니다. 교통경찰에게 하소연해봤지만 돌아온 건 “주차란 정차 상태가 5분 이상 지속되는 것을 말합니다. 주차에 대한 개념을 바로 알기 바랍니다.”라는 따끔한 충고였습니다.",
          "차량을 5분만 세워 둬도 주차라는 사실은 갓길에서도 동일 적용됩니다. 코너를 돌고 갓길에 들어섰다가 세워 둔 차량을 발견하지 못하고 충돌하는 경우가 많습니다. 갓길 교통사고 사망률이 일반 교통사고보다 4배나 높게 나타났습니다.",
          "잠깐 차에서 내릴 때 완만해 보여도 경사진 곳이 아닌지 확인해야 합니다. 주차가 아니라고 기어를 중립에 그대로 두는 것은 위험합니다. 반드시 기어를 주차 상태에 두고 보조 브레이크까지 당겨야 합니다. 경사가 좀 더 가파르다면 바퀴에 벽돌 등을 받쳐두는 것이 좋습니다."
        ]
      }
    },
    "full_content": "멈춰 선 차, 차폭등과 미등만으로 안전조치한 상황\n밤 늦게 귀가하던 홍길동 씨의 차가 갑자기 멈춰 섰다. 당황한 홍 씨는 우선 편도 2차선 도로 갓길에 차를 세우고 차폭등과 미등을 켜 안전조치를 취했다. 그렇게 견인차량을 기다리던 중, 저 멀리서 시속 60km로 달려오던 전우치 씨의 차가 홍 씨의 차를 그대로 들이받았다. 홍 씨는 전 씨가 ‘분명히 안전조치를 봤을 텐데도 속도를 줄이지 않은 것’이라고 판단해 화를 버럭 냈다. 그런데 이 무슨 황당한 시추에이션? 전 씨가 오히려 화를 내는 것이 아닌가! 전 씨의 주장은 ‘홍 씨가 미흡한 안전조치를 취해 과실이 있다’는 것이었다.\n홍 씨는 안전삼각대가 없는 상황에서 차폭등과 미등만으로 비상상황임을 알려 충분히 안전조치를 취했다며 과실이 없음을 주장했다. 하지만 전 씨는 앞쪽이 잘 보이지 않는 어두운 밤에 가로등도 없는 곳에서 충분한 안전조치를 취하지 않았다며 홍 씨의 과실을 주장하고 있다.\n팽팽하게 날이 선 두 사람, 과연 누가 맞을까?\n과실비율\n상황을 고려하지 않은 미흡한 안전조치는\n과실로 인정!\n단순 안전조치만 취한 홍길동 씨에게 과실 20%\n차량 고장 등으로 갓길에 차를 세운 경우, 단순히 미등을 켜는 것만으로 안전조치를 취했다고 볼 수 없다. 더구나 사고가 발생한 곳은 어두운 밤에 가로등도 없는 곳. 따라서 뒤에 오는 운전자가 쉽게 식별할 수 있도록 충분히 안전조치를 취하지 않은 홍길동 씨에게 분명 과실이 있다. 안전조치 불이행에 따른 20% 정도의 과실이 인정된다.\n이럴 땐 이런 과실 판정\n일반 도로에서 대낮에 사고가 발생했다면 사고 발생 상황에 따른 과실비율을 적용해 홍길동 씨에게 과실이 없다.\nkey point\n시야 확보 어려운 야간에는\n충분한 안전조치가 필수\n한국도로공사 통계에 따르면 고장 정차한 차량 추돌사고가 전체 2차 사고 발생률의 25%를 차지하고, 야간 사고 발생률은 무려 73%입니다.\n따라서 차량이 멈췄을 경우, 안전조치를 빠르게 취하는 게 중요합니다. 이때 차량이 멈춘 지점의 주변환경이나 시각을 살펴 안전조치를 충분히 취해야 합니다.\n안전삼각대는 도로 주행 기본 매너!\n자동차용 안전삼각대를 후방에서 접근하는 자동차의 운전자가 확인할 수 있는 위치에 설치합니다.\n어두운 밤에는 불꽃 신호를!\n멈춰 선 차량의 뒤에서 접근하는 운전자가 사방 500m 지점에서 쉽게 식별할 수 있도록 적색 섬광신호ㆍ전기제등 또는 불꽃 신호를 추가로 설치합니다.\n꿀팁\n도로 운전 중 차가 멈춰 섰을 때 조치 방법\nStep 1\n비상등을 켜고 주변 교통상황을 살피면서 갓길에 주차하기\n만일 차가 멈춰 움직이지 않을 경우, 그 자리에서 비상등을 켜고 보닛이나 트렁크를 열어두세요.\nStep 2\n차량 뒤쪽에 안전삼각대 설치하기\n밤에는 불꽃 신호를 추가로 설치해 주세요.\nStep 3\n안전지대나 가드레일 밖으로 대피하기\n운전자와 탑승자 모두 차량 밖으로 나와 주세요.\nStep 4\n보험사 혹은 견인업체에 신고하기\n필요하면 경찰에도 알리세요.\nStep 5\n뒤에 오는 차량들을 향해 주의 신호 보내기\n안전지대나 가드레일 밖에서 신호유도봉 또는 밝은색 옷을 흔들어 주세요. 이때 차도에서 맨손으로 수신호를 하는 것은 위험합니다.\n꿀팁\n상황에 따른 주정차 사고 예방법\n1. 잠깐 세워두어서 주차가 아니라고?\n홍길동 씨는 편의점에 들르기 위해 차를 잠깐 세워 두었다가 주차위반 딱지를 뗀 적이 있습니다. 교통경찰에게 하소연해봤지만 돌아온 건 “주차란 정차 상태가 5분 이상 지속되는 것을 말합니다. 주차에 대한 개념을 바로 알기 바랍니다.”라는 따끔한 충고였습니다.\n2. 갓길 주차는 대단히 위험\n차량을 5분만 세워 둬도 주차라는 사실은 갓길에서도 동일 적용됩니다. 코너를 돌고 갓길에 들어섰다가 세워 둔 차량을 발견하지 못하고 충돌하는 경우가 많습니다. 갓길 교통사고 사망률이 일반 교통사고보다 4배나 높게 나타났습니다.\n3. 경사진 곳은 위험하니 조심 또 조심!\n잠깐 차에서 내릴 때 완만해 보여도 경사진 곳이 아닌지 확인해야 합니다. 주차가 아니라고 기어를 중립에 그대로 두는 것은 위험합니다. 반드시 기어를 주차 상태에 두고 보조 브레이크까지 당겨야 합니다. 경사가 좀 더 가파르다면 바퀴에 벽돌 등을 받쳐두는 것이 좋습니다.",
    "category": "차 vs. 차",
    "case_id": "차 vs. 차_1"
  },
  {
    "case_visual": {
      "title": "불법 유턴하는 차를 피하려다\n다른 차와 부딪히면 과실 범위는?",
      "description": "불법 유턴하는 차를 피하려다\n다른 차와 부딪히면 과실 범위는?"
    },
    "title": "불법 유턴 차량을 피하려다 뒤따르던 차와 충돌",
    "situation": "도심 한가운데를 운전 중인 전우치 씨. 전 씨가 달리는 차선은 교통 흐름이 원활했지만, 반대편 차선은 빽빽하게 차가 밀려 있었다.\n내심 안심하며 계속 운전을 하고 있던 전 씨는 바로 맞은편 차선에서 차 한 대가 급하게 유턴을 하는 것을 발견했다. ‘어어, 이러다가 부딪히겠는데?’라는 생각에 급하게 핸들을 오른쪽으로 꺾은 전 씨, 그 순간이었다. 차에 무언가 부딪히는 둔탁한 소리가 나며 차와 함께 전 씨 몸이 심하게 흔들렸다. 자신의 오른쪽 차선에서 달리던 차와 부딪힌 것이다. 세 명의 운전자가 실랑이가 붙었다.",
    "situation_highlight": "불법 유턴 vs. 급작스러운 차선 변경 vs. 안전거리 미확보, 어느 쪽 과실일까?",
    "sections": {
      "section_1": {
        "type": "과실비율",
        "title": "갑작스런 불법 유턴으로 인한 충돌사고,\n과실은 불법 유턴자에게",
        "main_ratio": "진로 변경과 불법 유턴의 과실 정도는?",
        "details": [
          "불법 지역에서 급작스러운 유턴을 감행한 홍길동 씨로 인해, 이를 감지하고 조치할 시간적 여유가 부족한 전우치 씨가 진로 변경을 하다가 뒤에 따라오던 임꺽정 씨의 차와 충돌했으므로 과실은 홍길동 씨에게 있는 것으로 정리할 수 있다.",
          "갑자기 진로를 변경해 뒤차 운행에 피해를 준 전우치 씨, 불법 유턴으로 맞은편 차에 피해를 준 홍길동 씨. 두 상황을 일반적으로 비교해 보더라도 홍길동 씨의 과실 범위가 더 큰 것은 명백한 사실. 더군다나 전우치 씨의 진로 변경이 홍길동 씨의 불법 유턴으로 인한 것이므로 홍길동 씨는 배상책임을 면할 수 없을 것으로 보인다.",
          "일반적으로 운전자는 안전운전의 의무가 있으며, 위험이 감지되는 경우 이를 예상하여 방지하기 위한 행위를 할 필요가 있다. 예를 들어, 홍길동 씨가 불법 유턴하는 것을 전우치 씨가 멀리서 보고 이를 막기 위해 경적을 울린다든가 하는 행위를 할 시간이나 거리상 여유가 충분히 있었다면, 이런 행위를 하지 않은 채 돌발적으로 경로를 변경해 사고를 낸 전우치 씨에게도 일부분 과실이 있다고 볼 수 있다.\n하지만 홍길동 씨의 불법 유턴과 전우치 씨의 진로 변경이 거의 동시에 이루어졌다면 전우치 씨가 이를 사전에 감지하고 조치를 마련해야 할 의무는 없는 것으로 볼 수 있어 홍길동 씨의 과실 범위가 절대적인 것으로 판단할 수 있다.",
          "‘안전거리 확보’란 교통사고 방지를 위해 뒤차가 앞차와 일정 거리 이상의 간격을 유지하는 것을 말한다. 일반적으로 앞차가 갑자기 정지했을 때 앞차와의 충돌을 방지할 수 있는 거리를 말하며, 자동차가 자전거 등과 나란히 주행할 때 상호 충돌을 방지하기 위한 거리를 뜻하기도 한다.\n옆 차선을 달리던 자동차가 진로를 변경한 경우는 안전거리 미확보로 인해 뒤차의 과실이 있음을 주장할 수 없다. 따라서 이 사건의 경우 임꺽정 씨의 과실은 없는 것으로 판단할 수 있다."
        ],
        "additional_cases": []
      }
    },
    "full_content": "불법 유턴 차량을 피하려다 뒤따르던 차와 충돌\n도심 한가운데를 운전 중인 전우치 씨. 전 씨가 달리는 차선은 교통 흐름이 원활했지만, 반대편 차선은 빽빽하게 차가 밀려 있었다.\n내심 안심하며 계속 운전을 하고 있던 전 씨는 바로 맞은편 차선에서 차 한 대가 급하게 유턴을 하는 것을 발견했다. ‘어어, 이러다가 부딪히겠는데?’라는 생각에 급하게 핸들을 오른쪽으로 꺾은 전 씨, 그 순간이었다. 차에 무언가 부딪히는 둔탁한 소리가 나며 차와 함께 전 씨 몸이 심하게 흔들렸다. 자신의 오른쪽 차선에서 달리던 차와 부딪힌 것이다. 세 명의 운전자가 실랑이가 붙었다.\n불법 유턴한 홍길동 씨는 자신만의 책임은 아니라고 한다. 뒤차 운전자 임꺽정 씨도 억울하기만 하다.\n불법 유턴 vs. 급작스러운 차선 변경 vs. 안전거리 미확보, 어느 쪽 과실일까?\n과실비율\n갑작스런 불법 유턴으로 인한 충돌사고,\n과실은 불법 유턴자에게\n불법 지역에서 급작스러운 유턴을 감행한 홍길동 씨로 인해, 이를 감지하고 조치할 시간적 여유가 부족한 전우치 씨가 진로 변경을 하다가 뒤에 따라오던 임꺽정 씨의 차와 충돌했으므로 과실은 홍길동 씨에게 있는 것으로 정리할 수 있다.\n진로 변경과 불법 유턴의 과실 정도는?\n갑자기 진로를 변경해 뒤차 운행에 피해를 준 전우치 씨, 불법 유턴으로 맞은편 차에 피해를 준 홍길동 씨. 두 상황을 일반적으로 비교해 보더라도 홍길동 씨의 과실 범위가 더 큰 것은 명백한 사실. 더군다나 전우치 씨의 진로 변경이 홍길동 씨의 불법 유턴으로 인한 것이므로 홍길동 씨는 배상책임을 면할 수 없을 것으로 보인다.\n운전자가 예측할 수 없는 돌발 상황에 대한 판단\n일반적으로 운전자는 안전운전의 의무가 있으며, 위험이 감지되는 경우 이를 예상하여 방지하기 위한 행위를 할 필요가 있다. 예를 들어, 홍길동 씨가 불법 유턴하는 것을 전우치 씨가 멀리서 보고 이를 막기 위해 경적을 울린다든가 하는 행위를 할 시간이나 거리상 여유가 충분히 있었다면, 이런 행위를 하지 않은 채 돌발적으로 경로를 변경해 사고를 낸 전우치 씨에게도 일부분 과실이 있다고 볼 수 있다.\n하지만 홍길동 씨의 불법 유턴과 전우치 씨의 진로 변경이 거의 동시에 이루어졌다면 전우치 씨가 이를 사전에 감지하고 조치를 마련해야 할 의무는 없는 것으로 볼 수 있어 홍길동 씨의 과실 범위가 절대적인 것으로 판단할 수 있다.\n안전거리 미확보 문제\n‘안전거리 확보’란 교통사고 방지를 위해 뒤차가 앞차와 일정 거리 이상의 간격을 유지하는 것을 말한다. 일반적으로 앞차가 갑자기 정지했을 때 앞차와의 충돌을 방지할 수 있는 거리를 말하며, 자동차가 자전거 등과 나란히 주행할 때 상호 충돌을 방지하기 위한 거리를 뜻하기도 한다.\n옆 차선을 달리던 자동차가 진로를 변경한 경우는 안전거리 미확보로 인해 뒤차의 과실이 있음을 주장할 수 없다. 따라서 이 사건의 경우 임꺽정 씨의 과실은 없는 것으로 판단할 수 있다.",
    "category": "차 vs. 차",
    "case_id": "차 vs. 차_2"
  },
  {
    "case_visual": {
      "title": "교통사고를 낸 차량이\n도주하면?",
      "description": "교통사고를 낸 차량이\n도주하면?"
    },
    "title": "차선 변경을 시도한 차량을 피하다가 다른 차량과 충돌, 사고의 책임은?",
    "situation": "직진하던 홍길동 씨는 앞에서 차선을 갑자기 변경하려는 임꺽정 씨의 차량을 발견하고는 본능적으로 핸들을 틀었고, 이때 도로변에 불법주차 중이던 전우치 씨의 차량을 들이받아 파손시켰다. 홍 씨가 급하게 차에서 내리는 순간, 임 씨는 잽싸게 도주한 후였다.\n워낙 순식간에 달아난 터라 자동차번호도 살피지 못했고, 주변 목격자도 없는 상황. 홍 씨는 전 씨에게 자신도 피해자이며, 전 씨 또한 불법주차 과실이 있으니 각자 처리하자고 주장했다. 하지만 전 씨는 홍 씨에게 보상을 요구했다.",
    "situation_highlight": "홍 씨는 전 씨에게 보상해야 하는 걸까?",
    "sections": {
      "section_1": {
        "type": "과실비율",
        "title": "전 씨 차량을 직접 들이받은 홍 씨가 배상 책임",
        "main_ratio": "전 씨의 차량을 파손시킨 홍 씨가 수리비를 지급해야 함",
        "details": [
          "사고 원인을 제공한 임 씨의 차량은 이미 사라졌고 증거가 없다면, 결과적으로 홍 씨가 가해자로 남게 된다. 전 씨의 차량이 임 씨의 차량과 직접 접촉한 것이 아니고, 또 전 씨의 차량이 차선 변경 불가 지역에서 차선을 변경한 경우가 아니라면 책임을 묻기가 어렵다."
        ],
        "additional_cases": []
      },
      "section_2": {
        "type": "key point",
        "title": "사고 후 현장조치는 의무이자 필수",
        "subtitles": [
          "「도로교통법」 제54조 제1항"
        ],
        "details": [
          "우리나라 뺑소니 검거율은 90%를 넘어서고 있습니다. 교통사고를 낸 후, 당황해 우왕좌왕하다가 사고 수습을 제대로 못하고 현장을 달아나게 되면 결국 붙잡힐 확률이 높다는 뜻입니다. 따라서 운전자는 사고 후 현장조치를 의무이자 필수로 기억하고 대처해야 합니다.",
          "교통사고로 인해 사람을 사상하거나 물건을 손괴한 때에는 그 차의 운전자, 그 밖의 승무원은 곧 정차하여 사상자를 구호하는 등 필요한 조치를 해야 한다."
        ]
      },
      "section_3": {
        "type": "꿀팁",
        "title": "교통사고 현장조치 방법",
        "steps": [],
        "subtitles": [
          "1. 사고 발생 즉시 가까운 곳에 차 세우기",
          "2. 부상자 구호 조치하기",
          "3. 목격자 및 현장증거 확보하기",
          "4. 피해자와 함께 인근 병원으로 이동하기",
          "5. 경찰서나 지구대에 신고하기"
        ],
        "details": [
          "다른 차량의 소통에 방해가 되어 즉시 정차할 수 없는 여건이거나 정차 장소를 찾기 위해 사고 발생 장소를 다소 벗어나면 본의 아니게 도주나 뺑소니가 되는 경우가 있습니다.",
          "상대 차량의 탑승자 또는 보행자가 부상을 입었는지 확인해 주세요. 부상자를 차에서 내리게 하거나 도로에 누워 있는 피해자를 무리하게 일으키는 행위는 부상 부위를 자극해 악화시킬 수 있으니 삼갑니다. 중상이라고 판단되면 119에 신고해 도움을 받으세요.",
          "목격자에게 휴대폰번호를 반드시 받아 두세요. 목격자가 이를 거부한다면 자동차번호라도 기록해 둡니다. 또 휴대폰으로 차량의 파손 부위를 근접 촬영하고, 최종 정차 위치를 여러 방향으로 찍어 두세요. 신호등, 횡단보도 등 주위 배경이 포함되면 좋습니다. 도로 위에 떨어진 차량 파편, 오일 또는 냉각수 등의 위치도 촬영해 두세요.",
          "피해자가 중상을 입었다면 119에 도움을 청하고, 부상 정도가 가볍다면 함께 병원에 가야 합니다. 피해자가 특별히 아픈 데가 없다거나 바쁘다면서 연락처만 건네주고 사고현장을 떠나게 하면 안 됩니다. 나중에 피해자가 병원에서 따로 진단서를 발급받으면 뺑소니범으로 몰릴 수도 있어요.",
          "피해자가 확인서 작성을 거부하는 경우도 있습니다. 어린이는 사고 직후 두려움으로 달아나기도 합니다. 이때는 곧장 경찰서나 지구대로 가서 육하원칙에 따른 사고개요를 자진신고하는 것이 좋습니다. 발생 장소, 사상자 수, 부상 정도, 손괴한 물건과 그 정도, 그 밖의 조치 상황을 경찰에 신고해 지시를 따르세요."
        ]
      }
    },
    "full_content": "차선 변경을 시도한 차량을 피하다가 다른 차량과 충돌, 사고의 책임은?\n직진하던 홍길동 씨는 앞에서 차선을 갑자기 변경하려는 임꺽정 씨의 차량을 발견하고는 본능적으로 핸들을 틀었고, 이때 도로변에 불법주차 중이던 전우치 씨의 차량을 들이받아 파손시켰다. 홍 씨가 급하게 차에서 내리는 순간, 임 씨는 잽싸게 도주한 후였다.\n워낙 순식간에 달아난 터라 자동차번호도 살피지 못했고, 주변 목격자도 없는 상황. 홍 씨는 전 씨에게 자신도 피해자이며, 전 씨 또한 불법주차 과실이 있으니 각자 처리하자고 주장했다. 하지만 전 씨는 홍 씨에게 보상을 요구했다.\n급작스러운 차선 변경 시도로 사고 원인을 제공한 임 씨는 사라진 상황이다.\n홍 씨는 전 씨에게 보상해야 하는 걸까?\n과실비율\n전 씨 차량을 직접 들이받은 홍 씨가 배상 책임\n전 씨의 차량을 파손시킨 홍 씨가 수리비를 지급해야 함\n사고 원인을 제공한 임 씨의 차량은 이미 사라졌고 증거가 없다면, 결과적으로 홍 씨가 가해자로 남게 된다. 전 씨의 차량이 임 씨의 차량과 직접 접촉한 것이 아니고, 또 전 씨의 차량이 차선 변경 불가 지역에서 차선을 변경한 경우가 아니라면 책임을 묻기가 어렵다.\n이럴 땐 이런 과실 판정\n만약 전 씨의 불법주차 차량이 차량 통행에 현저히 장해를 주었다면 전 씨에게 과실 10~20%가 주어진다.\nkey point\n사고 후 현장조치는 의무이자 필수\n우리나라 뺑소니 검거율은 90%를 넘어서고 있습니다. 교통사고를 낸 후, 당황해 우왕좌왕하다가 사고 수습을 제대로 못하고 현장을 달아나게 되면 결국 붙잡힐 확률이 높다는 뜻입니다. 따라서 운전자는 사고 후 현장조치를 의무이자 필수로 기억하고 대처해야 합니다.\n「도로교통법」 제54조 제1항\n교통사고로 인해 사람을 사상하거나 물건을 손괴한 때에는 그 차의 운전자, 그 밖의 승무원은 곧 정차하여 사상자를 구호하는 등 필요한 조치를 해야 한다.\n꿀팁\n교통사고 현장조치 방법\n1. 사고 발생 즉시 가까운 곳에 차 세우기\n다른 차량의 소통에 방해가 되어 즉시 정차할 수 없는 여건이거나 정차 장소를 찾기 위해 사고 발생 장소를 다소 벗어나면 본의 아니게 도주나 뺑소니가 되는 경우가 있습니다.\n2. 부상자 구호 조치하기\n상대 차량의 탑승자 또는 보행자가 부상을 입었는지 확인해 주세요. 부상자를 차에서 내리게 하거나 도로에 누워 있는 피해자를 무리하게 일으키는 행위는 부상 부위를 자극해 악화시킬 수 있으니 삼갑니다. 중상이라고 판단되면 119에 신고해 도움을 받으세요.\n3. 목격자 및 현장증거 확보하기\n목격자에게 휴대폰번호를 반드시 받아 두세요. 목격자가 이를 거부한다면 자동차번호라도 기록해 둡니다. 또 휴대폰으로 차량의 파손 부위를 근접 촬영하고, 최종 정차 위치를 여러 방향으로 찍어 두세요. 신호등, 횡단보도 등 주위 배경이 포함되면 좋습니다. 도로 위에 떨어진 차량 파편, 오일 또는 냉각수 등의 위치도 촬영해 두세요.\n4. 피해자와 함께 인근 병원으로 이동하기\n피해자가 중상을 입었다면 119에 도움을 청하고, 부상 정도가 가볍다면 함께 병원에 가야 합니다. 피해자가 특별히 아픈 데가 없다거나 바쁘다면서 연락처만 건네주고 사고현장을 떠나게 하면 안 됩니다. 나중에 피해자가 병원에서 따로 진단서를 발급받으면 뺑소니범으로 몰릴 수도 있어요.\n5. 경찰서나 지구대에 신고하기\n피해자가 확인서 작성을 거부하는 경우도 있습니다. 어린이는 사고 직후 두려움으로 달아나기도 합니다. 이때는 곧장 경찰서나 지구대로 가서 육하원칙에 따른 사고개요를 자진신고하는 것이 좋습니다. 발생 장소, 사상자 수, 부상 정도, 손괴한 물건과 그 정도, 그 밖의 조치 상황을 경찰에 신고해 지시를 따르세요.",
    "category": "차 vs. 차",
    "case_id": "차 vs. 차_3"
  },
  {
    "case_visual": {
      "title": "3중 추돌사고 후\n가해자가 뺑소니치면?",
      "description": "3중 추돌사고 후\n가해자가 뺑소니치면?"
    },
    "title": "가해자의 뺑소니로 졸지에 가해자로 몰린 사건",
    "situation": "한낮의 고속도로. 주행 중이던 홍길동 씨 차량에 쿵, 하는 소리와 함께 뒤에서 충격이 전해졌다. 뒤에 있던 임꺽정 씨 차량이 안전거리를 확보하지 않아 홍 씨 차량과 추돌한 것이다. 이 충격으로 홍 씨 차량이 앞에서 주행하던 전우치 씨의 차량을 들이받아 파손시키는 상황이 발생했다. 추돌 후 임 씨는 ‘나 몰라라’ 하며 그대로 달아나서 그 어떤 인적사항도 확보가 안 되는 상황. 게다가 홍 씨는 보험에 가입되어 있지 않아 사태를 수습하기도 어려워졌다. 설상가상으로 전 씨는 차에서 내려 홍 씨에게 수리비와 치료비를 요구하고 나섰다.",
    "situation_highlight": "피해자인 홍 씨에게도 수리비와 치료비 배상책임이 있을까?",
    "sections": {
      "section_1": {
        "type": "과실비율",
        "title": "홍 씨도 명백한 피해자로 배상책임 없음",
        "main_ratio": "홍 씨는 전 씨 차량에 대한 배상책임 없음",
        "details": [
          "흔히 추돌한 차가 100% 과실이라고 생각하지만 경우에 따라 달라질 수 있다. 홍 씨 차량이 임 씨 차량에 의해 충격이 가해졌고, 그 충격으로 차가 밀려 전 씨 차량을 들이받았다면 홍 씨에게 배상책임이 없다. 그러나 임 씨 차량이 도주해버렸기 때문에 임 씨에게 배상을 받을 수 없는 상황이 된다."
        ],
        "additional_cases": []
      },
      "section_2": {
        "type": "key point",
        "title": "이럴 때가 바로 뺑소니 상황",
        "subtitles": [
          "뺑소니란?"
        ],
        "details": [
          "자동차나 오토바이 등 교통수단을 운전하는 자가 교통사고를 일으킨 후 피해자 응급후송 등의 구호조치를 취하지 않고 그대로 방치하고 도주하여 피해자의 생명이나 신체 또는 재산 피해를 발생시키거나 확대시킨 위법한 행위를 말합니다.\n뺑소니 성립 요건은 사람이 죽거나 다쳐야 하고, 가해자가 그 사고 사실을 알 수 있었을 때에 한합니다.",
          "즉, 뺑소니 판단 기준은 구호조치 및 피해자와의 연락처 교환 여부에 달려있습니다."
        ]
      },
      "section_3": {
        "type": "Q&A",
        "title": "연락처 알려 주지 않으면 당신도 뺑소니 운전자!",
        "question": "Q. 피해자가 안 다쳤다면서 그냥 가라고 해서 간 것뿐인데, 제가 뺑소니라고요?",
        "answer_title": "",
        "answer_details": [
          "피해자가 당장 병원에 가야 할 정도가 아닌 가벼운 사고라면 피해자에게 명함이나 연락처 등을 알려줘야 합니다. 이때 이름이나 연락처 등 개인정보를 사실과 다르게 전달한 경우에도 뺑소니가 될 수 있음을 명심하세요. 또 아무런 조치도 하지 않은 상태에서 피해자와 헤어졌다면 관할 경찰서에 피해자 불상으로 신고하고 확인서를 받아 둬야 합니다."
        ]
      }
    },
    "full_content": "가해자의 뺑소니로 졸지에 가해자로 몰린 사건\n한낮의 고속도로. 주행 중이던 홍길동 씨 차량에 쿵, 하는 소리와 함께 뒤에서 충격이 전해졌다. 뒤에 있던 임꺽정 씨 차량이 안전거리를 확보하지 않아 홍 씨 차량과 추돌한 것이다. 이 충격으로 홍 씨 차량이 앞에서 주행하던 전우치 씨의 차량을 들이받아 파손시키는 상황이 발생했다. 추돌 후 임 씨는 ‘나 몰라라’ 하며 그대로 달아나서 그 어떤 인적사항도 확보가 안 되는 상황. 게다가 홍 씨는 보험에 가입되어 있지 않아 사태를 수습하기도 어려워졌다. 설상가상으로 전 씨는 차에서 내려 홍 씨에게 수리비와 치료비를 요구하고 나섰다.\n졸지에 홍 씨의 차가 가해 차량으로 몰렸다.\n피해자인 홍 씨에게도 수리비와 치료비 배상책임이 있을까?\n과실비율\n홍 씨도 명백한 피해자로 배상책임 없음\n홍 씨는 전 씨 차량에 대한 배상책임 없음\n흔히 추돌한 차가 100% 과실이라고 생각하지만 경우에 따라 달라질 수 있다. 홍 씨 차량이 임 씨 차량에 의해 충격이 가해졌고, 그 충격으로 차가 밀려 전 씨 차량을 들이받았다면 홍 씨에게 배상책임이 없다. 그러나 임 씨 차량이 도주해버렸기 때문에 임 씨에게 배상을 받을 수 없는 상황이 된다.\n이럴 땐 이런 과실 판정\n홍 씨 차량이 전 씨 차량을 먼저 들이받은 후에 임 씨 차량이 홍 씨 차량만 추돌했다면 임 씨 차량이 도주했더라도 홍 씨에게 과실 100%가 주어져 전액 배상해야 한다. 이때, 임 씨 차량과 홍 씨 차량의 사고는 홍 씨 차량과 전 씨 차량의 추돌사고와 별개가 된다.\nkey point\n이럴 때가 바로 뺑소니 상황\n뺑소니란?\n자동차나 오토바이 등 교통수단을 운전하는 자가 교통사고를 일으킨 후 피해자 응급후송 등의 구호조치를 취하지 않고 그대로 방치하고 도주하여 피해자의 생명이나 신체 또는 재산 피해를 발생시키거나 확대시킨 위법한 행위를 말합니다.\n뺑소니 성립 요건은 사람이 죽거나 다쳐야 하고, 가해자가 그 사고 사실을 알 수 있었을 때에 한합니다.\n뺑소니 판단 기준\n사고 후 피해자를 구호조치하지 않고 현장을 이탈했을 때\n사고 후 현장을 이탈했다가 다시 돌아왔을 때\n사고 후 범죄 은닉 또는 은폐를 위해 도주했을 때\n사고 후 피해자를 병원에 데려갔지만 신원을 밝히지 않고 가버렸을 때\n사고차량을 현장에 두고 아무런 조치 없이 현장을 이탈했을 때\n현장출동 경찰에게 동승자가 사고를 낸 것처럼 위장하고 가버렸을 때\n즉, 뺑소니 판단 기준은 구호조치 및 피해자와의 연락처 교환 여부에 달려있습니다.\nQ&A\n연락처 알려 주지 않으면 당신도 뺑소니 운전자!\nQ. 피해자가 안 다쳤다면서 그냥 가라고 해서 간 것뿐인데, 제가 뺑소니라고요?\nA. 그렇습니다.\n피해자가 당장 병원에 가야 할 정도가 아닌 가벼운 사고라면 피해자에게 명함이나 연락처 등을 알려줘야 합니다. 이때 이름이나 연락처 등 개인정보를 사실과 다르게 전달한 경우에도 뺑소니가 될 수 있음을 명심하세요. 또 아무런 조치도 하지 않은 상태에서 피해자와 헤어졌다면 관할 경찰서에 피해자 불상으로 신고하고 확인서를 받아 둬야 합니다.",
    "category": "차 vs. 차",
    "case_id": "차 vs. 차_4"
  },
  {
    "case_visual": {
      "title": "아파트 단지 내 도로에서의\n중앙선 침범은 과연 불법일까?",
      "description": "아파트 단지 내 도로에서의\n중앙선 침범은 과연 불법일까?"
    },
    "title": "아파트 단지 내 도로에서 발생한 중앙선 침범사고",
    "situation": "퇴근길, 차를 몰고 집에 다다른 홍길동 씨는 아파트 단지로 들어섰다.\n그리고 중앙선이 그려진 아파트 단지 내 도로에서 주차장으로 들어가기 위해 좌회전을 했다.\n그때, 반대 차로에서 주행 중이던 전우치 씨 차와 충돌하고 말았다.\n중앙선 침범을 주장하는 전 씨에게 홍 씨는 아파트 단지 내에서는 중앙선을 넘어가도 된다며 맞섰다.",
    "situation_highlight": "아파트 단지 도로에서 중앙선을 넘으며 일어난 사고는 중앙선 침범사고로 성립되는 걸까?",
    "sections": {
      "section_1": {
        "type": "과실비율",
        "title": "아파트 단지 내 중앙선은 효력이 없다. 하지만!",
        "main_ratio": "민사법상 홍 씨의 과실 100%로 인정!",
        "details": [
          "아파트 단지 내 중앙선과 같이 민간이 임의로 설치한 중앙선은 도로교통법이나 교통사고처리특례법상 중앙선에 해당되지 않는다. 따라서 아파트 단지 내 도로에서의 중앙선 침범사고는 형사처분 대상이 아니다. 하지만 민사법에서는 중앙선을 침범해 사고를 일으킨 가해자의 과실을 100%로 인정하니, 이에 따라 사고를 처리하는 것이 통상적이다.",
          "아파트 단지 내 도로가 도로교통법상 도로인지 여부가 중요한데, 아파트 내 도로는 도로교통법상 도로가 아닌 경우가 대부분이다. 따라서 주취운전, 중앙선 침범사고, 속도위반사고 등은 교통사고처리특례법으로 처벌되지 않는다."
        ],
        "additional_cases": []
      },
      "section_2": {
        "type": "key point",
        "title": "중앙선이라고 다 같은 게 아니다?\n중앙선 침범 적용 예외 사례",
        "subtitles": [
          "민간이 설치한 중앙선은 효력이 없다"
        ],
        "details": [
          "도로교통법 시행규칙에 중앙선이나 안전표지 등은 지방경찰청장이 설치하도록 되어 있어, 권한 없는 자가 설치한 경우는 ‘중앙선 침범’을 적용하지 않고 있습니다. 즉, 아파트 구내도로는 중앙선을 아파트 관리사무소에서 임의로 설치한 것이기 때문에 중앙선을 침범했다 하더라도 중과실에 해당하지 않습니다."
        ]
      },
      "section_3": {
        "type": "꿀팁",
        "title": "중앙선, 넘어가면 죽음의 선",
        "steps": [],
        "subtitles": [],
        "details": [
          "중앙선 침범사고는 시시비비가 많이 일어나는 교통사고 중 하나입니다. 언제든 피해자도 가해자도 될 수 있습니다. 아파트 단지 내 도로든 일반도로든, 중앙선은 단순한 노란색 선이 아닙니다. 침범할 경우 소중한 목숨까지 위협할 수 있는 생명선이자 불가침선입니다."
        ]
      }
    },
    "full_content": "아파트 단지 내 도로에서 발생한 중앙선 침범사고\n퇴근길, 차를 몰고 집에 다다른 홍길동 씨는 아파트 단지로 들어섰다.\n그리고 중앙선이 그려진 아파트 단지 내 도로에서 주차장으로 들어가기 위해 좌회전을 했다.\n그때, 반대 차로에서 주행 중이던 전우치 씨 차와 충돌하고 말았다.\n중앙선 침범을 주장하는 전 씨에게 홍 씨는 아파트 단지 내에서는 중앙선을 넘어가도 된다며 맞섰다.\n아파트 단지 도로에서 중앙선을 넘으며 일어난 사고는 중앙선 침범사고로 성립되는 걸까?\n과실비율\n아파트 단지 내 중앙선은 효력이 없다. 하지만!\n민사법상 홍 씨의 과실 100%로 인정!\n아파트 단지 내 중앙선과 같이 민간이 임의로 설치한 중앙선은 도로교통법이나 교통사고처리특례법상 중앙선에 해당되지 않는다. 따라서 아파트 단지 내 도로에서의 중앙선 침범사고는 형사처분 대상이 아니다. 하지만 민사법에서는 중앙선을 침범해 사고를 일으킨 가해자의 과실을 100%로 인정하니, 이에 따라 사고를 처리하는 것이 통상적이다.\n아파트 단지 내 또 다른 중앙선 침범사고는?\n아파트 단지 내 도로가 도로교통법상 도로인지 여부가 중요한데, 아파트 내 도로는 도로교통법상 도로가 아닌 경우가 대부분이다. 따라서 주취운전, 중앙선 침범사고, 속도위반사고 등은 교통사고처리특례법으로 처벌되지 않는다.\nkey point\n중앙선이라고 다 같은 게 아니다?\n중앙선 침범 적용 예외 사례\n민간이 설치한 중앙선은 효력이 없다\n도로교통법 시행규칙에 중앙선이나 안전표지 등은 지방경찰청장이 설치하도록 되어 있어, 권한 없는 자가 설치한 경우는 ‘중앙선 침범’을 적용하지 않고 있습니다. 즉, 아파트 구내도로는 중앙선을 아파트 관리사무소에서 임의로 설치한 것이기 때문에 중앙선을 침범했다 하더라도 중과실에 해당하지 않습니다.\n중앙선 침범 적용 예외 사례\n아파트 단지 내 사설 중앙선 침범사고\n중앙선 도색이 벗겨져 식별이 곤란하거나, 흙더미 또는 눈이 덮여 보이지 않는 경우\n중앙선 없는 도로의 교차로 중앙 부분을 넘어서 일어난 사고\n같은 방향으로 주행하던 앞뒤 차량이 중앙선을 침범해 추돌사고를 일으킨 경우\n오른쪽 차선에서 주행하던 차량이 좌회전 중 중앙선을 넘어서 일어난 사고\n급작스럽게 차선을 변경해 끼어드는 차를 피하기 위해 중앙선을 침범한 경우\n꿀팁\n중앙선, 넘어가면 죽음의 선\n중앙선 침범사고는 시시비비가 많이 일어나는 교통사고 중 하나입니다. 언제든 피해자도 가해자도 될 수 있습니다. 아파트 단지 내 도로든 일반도로든, 중앙선은 단순한 노란색 선이 아닙니다. 침범할 경우 소중한 목숨까지 위협할 수 있는 생명선이자 불가침선입니다.",
    "category": "차 vs. 차",
    "case_id": "차 vs. 차_5"
  },
  {
    "case_visual": {
      "title": "무단횡단자 피하려다\n중앙선 침범하면\n과실 범위는?",
      "description": "무단횡단자 피하려다\n중앙선 침범하면\n과실 범위는?"
    },
    "title": "무단횡단자를 피해 중앙선을 넘어 맞은편 차선의 차량과 충돌",
    "situation": "외부 미팅을 잘 끝내고 기분 좋게 회사로 돌아오던 홍길동 씨, 느긋하게 운전하고 있었다. 건널목도 없고 인적도 드문 도로를 따라 직진을 하고 있는데, 갑자기 무단횡단하는 중년 아주머니를 발견했다. 무의식적으로 브레이크를 밟으면서 아주머니를 피해 핸들을 왼쪽으로 틀었다. 차가 왼쪽으로 휙 미끄러지는 듯싶더니 쿵 소리가 나면서 온몸에 충격이 느껴졌다. 질끈 감은 눈을 뜨고 보니 홍 씨의 차는 중앙선을 넘어가 있었고, 달려오던 맞은편 차량이 그대로 홍 씨의 차에 충돌해 있었다. 홍 씨 차와 충돌한 차에서 내린 전우치 씨는 크게 화를 냈다.",
    "situation_highlight": "무단횡단자를 피해 중앙선을 넘은 홍길동 씨와 그로 인해 사고를 당한 전우치 씨, 이 사고의 과실은 누구에게 있을까?",
    "sections": {
      "section_1": {
        "type": "과실비율",
        "title": "전방주시 의무를 지키지 않은 홍길동 씨 과실",
        "main_ratio": "운전자의 전방주시 의무",
        "details": [
          "무단횡단자 때문이었다 하더라도 전방을 주시하며 안전운전해야 하는 의무를 이행하지 않은 홍길동 씨의 과실로 볼 수 있다. 홍길동 씨는 전우치 씨에게 배상해야 할 의무가 있다.",
          "보행자가 무단횡단을 한 경우라고 해도 운전자는 전방을 주시해야 할 의무가 있다. 전방 식별이 힘든 야간이거나 눈 · 비 등의 사유가 있는 경우 운전자의 의무가 덜해질 수는 있으나 이 사건의 경우 낮에 일어난 일이으로 운전자가 전방 주시의 의무에서 벗어날 수 없다. 또한, 무단횡단을 한 보행자의 신원이 확보되지 않은 상황에서 운전자는 더욱 불리할 수밖에 없다.\n중앙선을 침범하지 않았더라도 전방주시, 안전운전 의무를 이행하지 않은 운전자의 경우 구체적인 상황에 따라 차이는 있겠으나, 일반적으로 사고의 책임을 피할 수 없다.\n최근에는 스마트폰, DMB 등의 사용으로 인한 전방주시 태만으로 발생하는 교통사고가 눈에 띄게 급증하고 있고, 그에 대한 중요성 역시 크게 두드러지고 있어서 관련 법규는 점점 강화될 것으로 보인다."
        ],
        "additional_cases": []
      },
      "section_2": {
        "type": "key point",
        "title": "중앙선 침범, 참고할 만한 판례",
        "subtitles": [
          "대법원 2001.02.09"
        ],
        "details": [
          "\"일반적으로 중앙선이 설치된 도로를 자기 차로를 따라 운행하는 자동차 운전자로서는 마주 오는 자동차도 자기 차로를 지켜 운행하리라고 신뢰하는 것이 보통이므로, 상대방 자동차의 비정상적인 운행을 예견할 수 있는 특별한 사정이 없다면, 상대방 자동차가 중앙선을 침범해 들어올 경우까지 예상하여 미리 2차로나 도로 우측 가장자리로 붙여 운전하여야 할 주의의무는 없고, 또한 운전자가 제한속도를 초과하여 운전하는 등 교통법규를 위반하였다고 하더라도 그와 같이 과속운행 등을 하지 아니하였다면 상대방 자동차의 중앙선 침범을 발견하는 즉시 감속하거나 피행함으로써 충돌을 피할 수 있었다는 사정이 있었던 경우에 한하여 과속운행을 과실로 볼 수 있다.\""
        ]
      }
    },
    "full_content": "무단횡단자를 피해 중앙선을 넘어 맞은편 차선의 차량과 충돌\n외부 미팅을 잘 끝내고 기분 좋게 회사로 돌아오던 홍길동 씨, 느긋하게 운전하고 있었다. 건널목도 없고 인적도 드문 도로를 따라 직진을 하고 있는데, 갑자기 무단횡단하는 중년 아주머니를 발견했다. 무의식적으로 브레이크를 밟으면서 아주머니를 피해 핸들을 왼쪽으로 틀었다. 차가 왼쪽으로 휙 미끄러지는 듯싶더니 쿵 소리가 나면서 온몸에 충격이 느껴졌다. 질끈 감은 눈을 뜨고 보니 홍 씨의 차는 중앙선을 넘어가 있었고, 달려오던 맞은편 차량이 그대로 홍 씨의 차에 충돌해 있었다. 홍 씨 차와 충돌한 차에서 내린 전우치 씨는 크게 화를 냈다.\n전우치 씨는 무조건 홍길동 씨 잘못이라고 했다.\n홍길동 씨도 자신 잘못을 인정하지만 무단횡단자 탓이 크다며 모든 책임을 질 수 없다는 입장이다.\n무단횡단자를 피해 중앙선을 넘은 홍길동 씨와 그로 인해 사고를 당한 전우치 씨, 이 사고의 과실은 누구에게 있을까?\n과실비율\n전방주시 의무를 지키지 않은 홍길동 씨 과실\n무단횡단자 때문이었다 하더라도 전방을 주시하며 안전운전해야 하는 의무를 이행하지 않은 홍길동 씨의 과실로 볼 수 있다. 홍길동 씨는 전우치 씨에게 배상해야 할 의무가 있다.\n운전자의 전방주시 의무\n보행자가 무단횡단을 한 경우라고 해도 운전자는 전방을 주시해야 할 의무가 있다. 전방 식별이 힘든 야간이거나 눈 · 비 등의 사유가 있는 경우 운전자의 의무가 덜해질 수는 있으나 이 사건의 경우 낮에 일어난 일이으로 운전자가 전방 주시의 의무에서 벗어날 수 없다. 또한, 무단횡단을 한 보행자의 신원이 확보되지 않은 상황에서 운전자는 더욱 불리할 수밖에 없다.\n중앙선을 침범하지 않았더라도 전방주시, 안전운전 의무를 이행하지 않은 운전자의 경우 구체적인 상황에 따라 차이는 있겠으나, 일반적으로 사고의 책임을 피할 수 없다.\n최근에는 스마트폰, DMB 등의 사용으로 인한 전방주시 태만으로 발생하는 교통사고가 눈에 띄게 급증하고 있고, 그에 대한 중요성 역시 크게 두드러지고 있어서 관련 법규는 점점 강화될 것으로 보인다.\nkey point\n중앙선 침범, 참고할 만한 판례\n대법원 2001.02.09\n\"일반적으로 중앙선이 설치된 도로를 자기 차로를 따라 운행하는 자동차 운전자로서는 마주 오는 자동차도 자기 차로를 지켜 운행하리라고 신뢰하는 것이 보통이므로, 상대방 자동차의 비정상적인 운행을 예견할 수 있는 특별한 사정이 없다면, 상대방 자동차가 중앙선을 침범해 들어올 경우까지 예상하여 미리 2차로나 도로 우측 가장자리로 붙여 운전하여야 할 주의의무는 없고, 또한 운전자가 제한속도를 초과하여 운전하는 등 교통법규를 위반하였다고 하더라도 그와 같이 과속운행 등을 하지 아니하였다면 상대방 자동차의 중앙선 침범을 발견하는 즉시 감속하거나 피행함으로써 충돌을 피할 수 있었다는 사정이 있었던 경우에 한하여 과속운행을 과실로 볼 수 있다.\"",
    "category": "차 vs. 차",
    "case_id": "차 vs. 차_6"
  },
  {
    "case_visual": {
      "title": "반대 차로를 달리던 차가\n중앙선을 침범하면\n과실 범위는?",
      "description": "반대 차로를 달리던 차가\n중앙선을 침범하면\n과실 범위는?"
    },
    "title": "반대쪽 차량이 갑자기 중앙선을 넘어온 상황",
    "situation": "바쁜 출근길, 전우치 씨는 공사 현장 인근의 편도 1차선 도로를 운전하며 지나가고 있었다. 그때 불쑥, 자재를 잔뜩 실은 홍길동 씨의 차량이 중앙선을 침범했다. 전 씨가 미처 손 쓸 겨를도 없이 마주 오던 홍 씨의 차량과 충돌했다. 급작스럽게 중앙선을 침범해온 홍 씨에게 단단히 화가 난 전 씨는 큰소리를 내보지만, 홍 씨는 전 씨 또한 발견하지 못하고 그대로 주행했다며 전방주시 태만 과실이 있다고 주장했다.",
    "situation_highlight": "홍 씨의 말처럼 정말 전 씨에게도 과실이 있는 걸까?",
    "sections": {
      "section_1": {
        "type": "과실비율",
        "title": "중앙선 침범사고는 가해자 100% 과실",
        "main_ratio": "",
        "details": [
          "피해자가 손 쓸 겨를도 없이 급작스럽게 중앙선을 침범해서 사고가 일어났다면 이는 가해자 과실이다. 따라서 홍 씨에게 배상의 책임이 주어진다. 즉, 중앙선 침범의 경우 아주 특별한 예외사항이 아니라면 100% 과실을 벗어나기는 어렵다."
        ],
        "additional_cases": []
      },
      "section_2": {
        "type": "key point",
        "title": "대형사고 초래하는 중앙선 침범 중앙선 침범사고 적용 사례",
        "subtitles": [
          "중앙선이란?",
          "중앙선에도 종류가 있다?",
          "방어운전 자세도 중요"
        ],
        "details": [
          "차량의 통행 방향을 명확하게 구분하기 위해 도로에 황색실선이나 황색점선 등의 안전표지로 표시한 선 또는 중앙분리대나 울타리 등으로 설치한 시설물을 말합니다. 다만, 가변차로가 설치된 경우에는 신호기가 지시하는 진행 방향의 가장 왼쪽에 있는 황색점선을 말합니다.",
          "중앙선 침범사고를 막기 위해서는 1차적으로 중앙선을 넘지 말아야 하고, 2차적으로는 반대편 차량이 중앙선을 잘 지키는지 전방을 주시하며 방어운전을 해야 합니다."
        ]
      },
      "section_3": {
        "type": "Q&A",
        "title": "끼어들기 허용하는 긴급차량, 중앙선 침범은?",
        "question": "Q. 소방차나 구급차가 중앙선을 침범해도 되나요?",
        "answer_title": "",
        "answer_details": [
          "소방차와 구급차, 혈액공급차량 등 긴급자동차는 긴급 상황에서 「도로교통법」 제30조(긴급자동차에 대한 특례)에 따라 속도제한, 앞지르기와 끼어들기 제한에 대해 규제받지 않습니다. 그러나 중앙선 등 설치차선 침범, 회전금지구간 회전 금지 조항을 배제하는 특례는 규정하고 있지 않습니다. 따라서 중앙선을 침범하거나 유턴금지구간에서 유턴을 하면 다른 차량과 동일하게 법규위반에 대한 책임을 묻습니다."
        ]
      }
    },
    "full_content": "반대쪽 차량이 갑자기 중앙선을 넘어온 상황\n바쁜 출근길, 전우치 씨는 공사 현장 인근의 편도 1차선 도로를 운전하며 지나가고 있었다. 그때 불쑥, 자재를 잔뜩 실은 홍길동 씨의 차량이 중앙선을 침범했다. 전 씨가 미처 손 쓸 겨를도 없이 마주 오던 홍 씨의 차량과 충돌했다. 급작스럽게 중앙선을 침범해온 홍 씨에게 단단히 화가 난 전 씨는 큰소리를 내보지만, 홍 씨는 전 씨 또한 발견하지 못하고 그대로 주행했다며 전방주시 태만 과실이 있다고 주장했다.\n홍 씨의 말처럼 정말 전 씨에게도 과실이 있는 걸까?\n과실비율\n중앙선 침범사고는 가해자 100% 과실\n피해자가 손 쓸 겨를도 없이 급작스럽게 중앙선을 침범해서 사고가 일어났다면 이는 가해자 과실이다. 따라서 홍 씨에게 배상의 책임이 주어진다. 즉, 중앙선 침범의 경우 아주 특별한 예외사항이 아니라면 100% 과실을 벗어나기는 어렵다.\n이럴 땐 이런 과실 판정\n멀리서부터 중앙선을 침범해 오는 반대편 차를 발견했을 때, 피해자는 반드시 전조등을 번쩍이거나 경적을 울려 사고를 막아야 한다. 방어운전을 하지 않아 사고를 피하지 못했다면, 피해자에게도 과실이 인정될 수 있다.\nkey point\n대형사고 초래하는 중앙선 침범 중앙선 침범사고 적용 사례\n중앙선이란?\n차량의 통행 방향을 명확하게 구분하기 위해 도로에 황색실선이나 황색점선 등의 안전표지로 표시한 선 또는 중앙분리대나 울타리 등으로 설치한 시설물을 말합니다. 다만, 가변차로가 설치된 경우에는 신호기가 지시하는 진행 방향의 가장 왼쪽에 있는 황색점선을 말합니다.\n중앙선에도 종류가 있다?\n황색실선\n절대로 넘어선 안 되는 선.\n황색점선\n반대 차로의 교통에 방해되지 않는 범위 내에서 일시적으로 넘어갈 수 있습니다. 그러나 점선이라 하더라도 중앙선을 넘던 중 반대편 차선에서 오는 차량과 충돌사고가 발생했다면 이는 중앙선 침범사고로 처리되어 형사처분은 물론 민사상 손해배상 과실비율 결정에도 매우 불리할 수 있습니다.\n방어운전 자세도 중요\n중앙선 침범사고를 막기 위해서는 1차적으로 중앙선을 넘지 말아야 하고, 2차적으로는 반대편 차량이 중앙선을 잘 지키는지 전방을 주시하며 방어운전을 해야 합니다.\n중앙선 침범사고 적용 사례\n횡단, 회전, 후진 위반 자동차가 중앙선을 완전히 넘어 반대 차선으로 들어가는 경우뿐 아니라 차량의 일부가 중앙선을 살짝 넘어가는 경우\n중앙선을 침범해 앞지르기를 한 후, 본 차선에 진입하는 경우\n중앙선을 침범해서 후진했다가 본 차선에 진입한 경우\n황색실선 중앙선을 넘어 진입해 사고가 난 경우\n황색점선 중앙선을 넘어 회전 중 사고가 난 경우\nQ&A\n끼어들기 허용하는 긴급차량, 중앙선 침범은?\nQ. 소방차나 구급차가 중앙선을 침범해도 되나요?\nA. 안 됩니다.\n소방차와 구급차, 혈액공급차량 등 긴급자동차는 긴급 상황에서 「도로교통법」 제30조(긴급자동차에 대한 특례)에 따라 속도제한, 앞지르기와 끼어들기 제한에 대해 규제받지 않습니다. 그러나 중앙선 등 설치차선 침범, 회전금지구간 회전 금지 조항을 배제하는 특례는 규정하고 있지 않습니다. 따라서 중앙선을 침범하거나 유턴금지구간에서 유턴을 하면 다른 차량과 동일하게 법규위반에 대한 책임을 묻습니다.",
    "category": "차 vs. 차",
    "case_id": "차 vs. 차_7"
  },
  {
    "case_visual": {
      "title": "외제차와 부딪히면\n얼마나 손해일까?",
      "description": "외제차와 부딪히면\n얼마나 손해일까?"
    },
    "title": "도로 위 ‘비싼 몸값’ 외제차와 접촉사고",
    "situation": "국산 경차를 타는 전우치 씨. 아침 출근길에 골목을 벗어나던 중 접촉사고가 일어났다. 바로 홍길동 씨의 독일산 스포츠카와 충돌한 것이다.\n두 사람은 쌍방 과실이 인정되며 수리비를 합의하기로 했다. 보험에 가입된 전 씨는 별 무리 없을 거라는 생각으로 견적서를 받았다. 그런데 홍 씨가 내민 수리비 견적서에는 범퍼 교체에 차량 렌트비용까지, 보험금 한도를 훨씬 웃도는 어마어마한 금액이 찍혀 있었다. 게다가 전 씨와 홍 씨의 과실비율이 3:7이었는데도 불구하고, 전 씨가 홍 씨보다 몇 곱절의 수리비를 내야 하는 상황이 되었다.",
    "situation_highlight": "과연 과실이 적은 전 씨가 더 많은 수리비를 물어줘야 하는걸까?",
    "sections": {
      "section_1": {
        "type": "과실비율",
        "title": "상대가 외제차라면 값비싼 수리비로 손해가 크므로 전 씨가 과실이 적어도 더 많이 부담!",
        "main_ratio": "값비싼 수리비로 인해 전 씨가 더 많이 부담",
        "details": [
          "국산차인 전 씨 차량이 3, 외제차인 홍 씨 차량이 7의 과실비율을 판정받은 상황. 전 씨 차량 수리비는 300만원, 홍 씨 차량 수리비는 8,000만원이 책정되었다면 전 씨는 상대 차량의 수리비 2,400만원을 떠안게 된다. 왜 그럴까?\n전 씨는 자신의 차량 수리비 300만원 중 30%인 90만원만 내면 된다. 하지만 사고 책임이 더 많은 홍 씨 차량의 수리비 8,000만원 중 전 씨 과실비율만큼, 즉 8,000만원의 30%인 2,400만원을 물어내야 하는 것.\n결국 전 씨는 한도가 2,000만원인 보험금을 웃도는 수리비를 물어주기 위해 자신의 지갑을 털어야 했다."
        ],
        "additional_cases": []
      },
      "section_2": {
        "type": "key point",
        "title": "외제차와 사고 나면\n비싼 부품 가격으로 대부분 고액 배상",
        "subtitles": [
          "1. 국산차보다 3~4배 이상 비싼 외제차 부품",
          "2. 긴 수리기간으로 늘어나는 렌트비용"
        ],
        "details": [
          "외제차 수리비와 수리공임비, 부품비 등은 국산차 대비 상당히 비쌉니다. 비슷한 부품이라도 국산차보다 4~5배 이상 비싸고 공임비도 평균 2배 정도 높습니다. 따라서 외제차 운전자가 과실이 더 많더라도 비싼 수리비 탓에 피해자가 오히려 돈을 더 내야 하는 경우가 흔히 발생합니다.",
          "외제차는 수리 시 필요한 부품을 수입 원산지에서 조달하는 경우가 많아 수리기간이 국산차보다 길어집니다. 수리기간 동안 급이 비슷한 차량을 빌려줘야 하는 렌트비용도 상당한 수준입니다."
        ]
      },
      "section_3": {
        "type": "key point",
        "title": "대물배상보험 한도를 높여 외제차 사고 대비",
        "subtitles": [
          "대물보상보험이란?"
        ],
        "details": [
          "다른 운전자의 차량 수리비 등 각종 손실을 보상해주는 의무가입 항목으로 「자동차손해배상 보장법」상 기본 한도는 2,000만원이며, 종합보험 대물배상의 경우 1~2만원 정도의 추가 비용을 내고 한도를 2~3억원으로 높이면 외제차와의 사고 시 막대한 손실을 막을 수 있습니다."
        ]
      },
      "section_4": {
        "type": "꿀팁",
        "title": "외제차와 접촉사고 시 대처법",
        "steps": [],
        "subtitles": [
          "1. 외제차 차주의 일방적 의견에 동의 안 하기",
          "2. 무리한 요구를 하면 일단 거절하기",
          "3. 해당 외제차의 중고차 시세를 파악하기"
        ],
        "details": [
          "접촉사고의 경우 후방 추돌이나 주차가능지역 내 주차 차량에 대한 접촉사고를 제외하고는 100% 과실이 있는 경우는 거의 없습니다. 접촉사고 발생 시 당황해 상대방의 일방적인 의견에 인정하거나 각서를 쓰고 면허증을 주는 행위는 절대 하지 말고 보험사에 즉시 연락을 합니다. 휴대폰 카메라로 사고 장면 각 방향을 찍고 안전 위험이 없다면 현장을 보존해야 합니다.",
          "단순 접촉사고로 수리할 수 있음에도 불구하고 새 부품 교환을 요구하는 경우가 많습니다. 원상회복과 수리가 가능한 경우인데도 계속해서 무리한 교환 요구를 한다면 수리 가능한 다른 견적서를 첨부해 거절할 수 있습니다.",
          "과실을 적용해 원상회복하는 수리비가 중고차 가격을 추월한다면 보험가액(시세표 기준)만큼 보상해야 합니다. 수입차는 감가상각이 국산차보다 큽니다. 겉모습만 보고 겁먹지 말고 보험사나 중고차 업체에 연락하여 실제 중고차 가격을 파악하기 바랍니다."
        ]
      }
    },
    "full_content": "도로 위 ‘비싼 몸값’ 외제차와 접촉사고\n국산 경차를 타는 전우치 씨. 아침 출근길에 골목을 벗어나던 중 접촉사고가 일어났다. 바로 홍길동 씨의 독일산 스포츠카와 충돌한 것이다.\n두 사람은 쌍방 과실이 인정되며 수리비를 합의하기로 했다. 보험에 가입된 전 씨는 별 무리 없을 거라는 생각으로 견적서를 받았다. 그런데 홍 씨가 내민 수리비 견적서에는 범퍼 교체에 차량 렌트비용까지, 보험금 한도를 훨씬 웃도는 어마어마한 금액이 찍혀 있었다. 게다가 전 씨와 홍 씨의 과실비율이 3:7이었는데도 불구하고, 전 씨가 홍 씨보다 몇 곱절의 수리비를 내야 하는 상황이 되었다.\n홍길동 씨는 값비싼 수리비를 물어내라며 버티고 있다. 전우치 씨는 그 말에 머리가 지끈지끈하다.\n과연 과실이 적은 전 씨가 더 많은 수리비를 물어줘야 하는걸까?\n과실비율\n상대가 외제차라면 값비싼 수리비로 손해가 크므로 전 씨가 과실이 적어도 더 많이 부담!\n값비싼 수리비로 인해 전 씨가 더 많이 부담\n국산차인 전 씨 차량이 3, 외제차인 홍 씨 차량이 7의 과실비율을 판정받은 상황. 전 씨 차량 수리비는 300만원, 홍 씨 차량 수리비는 8,000만원이 책정되었다면 전 씨는 상대 차량의 수리비 2,400만원을 떠안게 된다. 왜 그럴까?\n전 씨는 자신의 차량 수리비 300만원 중 30%인 90만원만 내면 된다. 하지만 사고 책임이 더 많은 홍 씨 차량의 수리비 8,000만원 중 전 씨 과실비율만큼, 즉 8,000만원의 30%인 2,400만원을 물어내야 하는 것.\n결국 전 씨는 한도가 2,000만원인 보험금을 웃도는 수리비를 물어주기 위해 자신의 지갑을 털어야 했다.\nkey point\n외제차와 사고 나면\n비싼 부품 가격으로 대부분 고액 배상\n1. 국산차보다 3~4배 이상 비싼 외제차 부품\n외제차 수리비와 수리공임비, 부품비 등은 국산차 대비 상당히 비쌉니다. 비슷한 부품이라도 국산차보다 4~5배 이상 비싸고 공임비도 평균 2배 정도 높습니다. 따라서 외제차 운전자가 과실이 더 많더라도 비싼 수리비 탓에 피해자가 오히려 돈을 더 내야 하는 경우가 흔히 발생합니다.\n2. 긴 수리기간으로 늘어나는 렌트비용\n외제차는 수리 시 필요한 부품을 수입 원산지에서 조달하는 경우가 많아 수리기간이 국산차보다 길어집니다. 수리기간 동안 급이 비슷한 차량을 빌려줘야 하는 렌트비용도 상당한 수준입니다.\nkey point\n대물배상보험 한도를 높여 외제차 사고 대비\n외제차와의 사고를 대비하려면 보험을 갱신할 때 대물배상보험의 한도를 높이는 것이 좋습니다.\n대물보상보험이란?\n다른 운전자의 차량 수리비 등 각종 손실을 보상해주는 의무가입 항목으로 「자동차손해배상 보장법」상 기본 한도는 2,000만원이며, 종합보험 대물배상의 경우 1~2만원 정도의 추가 비용을 내고 한도를 2~3억원으로 높이면 외제차와의 사고 시 막대한 손실을 막을 수 있습니다.\n꿀팁\n외제차와 접촉사고 시 대처법\n1. 외제차 차주의 일방적 의견에 동의 안 하기\n접촉사고의 경우 후방 추돌이나 주차가능지역 내 주차 차량에 대한 접촉사고를 제외하고는 100% 과실이 있는 경우는 거의 없습니다. 접촉사고 발생 시 당황해 상대방의 일방적인 의견에 인정하거나 각서를 쓰고 면허증을 주는 행위는 절대 하지 말고 보험사에 즉시 연락을 합니다. 휴대폰 카메라로 사고 장면 각 방향을 찍고 안전 위험이 없다면 현장을 보존해야 합니다.\n2. 무리한 요구를 하면 일단 거절하기\n단순 접촉사고로 수리할 수 있음에도 불구하고 새 부품 교환을 요구하는 경우가 많습니다. 원상회복과 수리가 가능한 경우인데도 계속해서 무리한 교환 요구를 한다면 수리 가능한 다른 견적서를 첨부해 거절할 수 있습니다.\n3. 해당 외제차의 중고차 시세를 파악하기\n과실을 적용해 원상회복하는 수리비가 중고차 가격을 추월한다면 보험가액(시세표 기준)만큼 보상해야 합니다. 수입차는 감가상각이 국산차보다 큽니다. 겉모습만 보고 겁먹지 말고 보험사나 중고차 업체에 연락하여 실제 중고차 가격을 파악하기 바랍니다.",
    "category": "차 vs. 차",
    "case_id": "차 vs. 차_8"
  }
]